interjection_id,text_clean_combined,line_id,page,line,transcript_line_number,line_type,section_header,speaker,speaker_standardized
28-259-25,"Sure. So you'll see, I think it was the Saturday, February 12th, that was the weekend we were having I think daily, almost daily Incident Response Group meetings that the Prime Minister was chairing in which I was participating. The situation from our perspective was becoming more and more alarming. There were a lot of public discussions of potential pop up blockades or demonstrations, and I'm going by memory, but a number of provincial legislatures saw demonstrations. There were some in Toronto, some in Quebec City, a number of provincial capitals. There was public discussion of a number of potential border crossings being targeted as well. There was some discussion about a border crossing in Woodstock, New Brunswick with the State of Maine in my home province. There were concerns around the Pacific Gateway border crossing in British Columbia. I know one of the discussions, again that was reported in the media or certainly in social media, was a potential sort of sympathy protest at the ferry terminal in North Sydney, which is the main supply route for the Province of Newfoundland and Labrador for the Island of Newfoundland. So on that Saturday, I wanted to reach out principally to a group of premiers in Atlantic Canada and Premier Horgan in British Columbia, who were seeing some of this activity and sympathy to the occupation that was taking place in Ottawa. I wanted to offer those premiers again, as they knew from their conversations between their senior officials but I wanted them to hear from me that the Government of Canada was absolutely ready inasmuch as we could to provide any support that they thought would be useful. The RCMP in many of those provinces are also the contract police authority and some of the premiers had said to me that they were receiving updates from the Divisional commanders of the RCMP in their capacity as the contract police of jurisdiction in those provinces. I remember Premier Furey telling me of his real concern around a potential blockage at the ferry terminal in North Sydney. He’s a doctor by profession and told me that on that ferry many medical supplies, drugs, medical equipment, is essentially transmitted to Port aux Basques in Newfoundland and then distributed around the province. And if ever there was a blockage of access to that ferry terminal, it’s much more than fresh fruits and vegetables in grocery stores in Newfoundland. But it represented a real threat to public safety and security in his province. So I wanted them to know that we were monitoring those situations. We were receiving updates from senior federal officials in the law enforcement community and in the intelligence community, and that if they had any concerns they could reach out to me. That was the nature of those conversations and on the Sunday, on February 13th, Premier Horgan, I'm assuming -- I would have sent those messages and followed up on the Saturday the 12th, but if it shows up on the 13th, it’s because Premier Horgan probably replied to me on the Sunday the 13th to talk to me about some of the concerns we were seeing in the media around the Pacific Gateway border crossing.",28-259-27,259,27,25,speaker_start,EXAMINATION-IN-CHIEF BY MS. SHANTONA CHAUDHURY,MINISTER DOMINIC LeBLANC,minister dominic leblanc
28-261-25,"Okay. And in any of those conversations did the notion of invoking emergency legislation come up, either provincial or federal?",28-261-27,261,27,25,speaker_start,EXAMINATION-IN-CHIEF BY MS. SHANTONA CHAUDHURY,MS. SHANTONA CHAUDHURY,shantona chaudhury
28-261-28,"No, not in those conversations. It was the conversation with Premier Ford on the 10th where he spoke about the provincial emergency orders. But in those subsequent conversations on that weekend, no, I did not discuss with them the issue of a Federal Emergencies Act invocation.",28-261-30,261,30,28,speaker_start,EXAMINATION-IN-CHIEF BY MS. SHANTONA CHAUDHURY,MINISTER DOMINIC LeBLANC,minister dominic leblanc
28-262-06,"Okay. And we know that Premier Ford did, in fact, invoke Ontario’s Emergency legislation on February 11th. So you mentioned that Premier Furey was expressing a concern about -- if I can put it this way -- there was no identified sort of threat to the supply chain but he was concerned that what was happening might spread and affect the supply chain in Newfoundland. Is that right?",28-262-08,262,8,6,speaker_start,EXAMINATION-IN-CHIEF BY MS. SHANTONA CHAUDHURY,MS. SHANTONA CHAUDHURY,shantona chaudhury
28-262-14,"That’s right. And it was discussed in the public space, if it was Atlantic media, Nova Scotia media is what, in many cases is followed in the neighbouring province of new Brunswick. So I was seeing in public discussions the risk or the threat or the discussion of potential attempts to block access to the North Sydney ferry terminal, the Marine Atlantic Ferry. And it reminded me of the vulnerability of half a million Canadians on the island of Newfoundland and Labrador in terms of what is their main supply route for things as important as medicines, medical equipment, and so on. And that was the concern the Premier had expressed to me. And sort of saying that he wanted to be reassured that the Government of Canada was ready, should that materialize, to do everything we had to do to ensure that his province wouldn’t be held hostage in some kind of circumstance there.",28-262-16,262,16,14,speaker_start,EXAMINATION-IN-CHIEF BY MS. SHANTONA CHAUDHURY,MINISTER DOMINIC LeBLANC,minister dominic leblanc
28-263-03,And you told him theat the federal government would do whatever it could? Or do what it could?,28-263-05,263,5,3,speaker_start,EXAMINATION-IN-CHIEF BY MS. SHANTONA CHAUDHURY,MS. SHANTONA CHAUDHURY,shantona chaudhury
28-263-06,"Of course. And my conversations with his Atlantic First Ministers counterparts was exactly in that sense. I remember Premier Higgs, as I said, there’s a border crossing that was the subject of some discussion in Woodstock, New Brunswick. There were protests, I think, in the city -- I’m going by memory -- in Halifax. And of course, Premier King, that Confederation Bridge to Prince Edward Island is obviously a critical supply route for that province as well. That’s not far from where I live, that bridge. It’s a two-lane bridge and it wouldn’t theoretically take much to create a lot of confusion in accessing that bridge. So there was a heightened concern that I was hearing both publicly -- but from First Ministers, from premiers, about what -- I think they were seeing what was happening in Windsor principally, but other points as well. And they were sharing their concerns with us.",28-263-08,263,8,6,speaker_start,EXAMINATION-IN-CHIEF BY MS. SHANTONA CHAUDHURY,MINISTER DOMINIC LeBLANC,minister dominic leblanc
28-263-23,"Okay. Whereas Premier Horgan in B.C., if you’ll see that middle sort of bullet there - - February 13th. He sort of seems to be conveying that from his perspective things are pretty under control in B.C.; is that fair?",28-263-25,263,25,23,speaker_start,EXAMINATION-IN-CHIEF BY MS. SHANTONA CHAUDHURY,MS. SHANTONA CHAUDHURY,shantona chaudhury
28-263-28,Absolutely.,28-263-30,263,30,28,speaker_start,EXAMINATION-IN-CHIEF BY MS. SHANTONA CHAUDHURY,MINISTER DOMINIC LeBLANC,minister dominic leblanc
28-264-01,"Okay. Thank you, Mr. Clerk. Can you take that one down? So again, we’re going to skip pretty quickly in the narrative here, given time constraints. But so those consultations, most of the ones we’ve discussed, were the weekend of February 12th and 13th. We know now essentially the chronology of what happened on February 13th, so the IRG meeting in the afternoon leading to a Cabinet meeting in the evening and the outcome of that Cabinet meeting has been described to us by the Clerk as -- the decision was to call a First Ministers meeting to discuss the potential invocation of the Emergencies Act. Is that fair?",28-264-03,264,3,1,speaker_start,EXAMINATION-IN-CHIEF BY MS. SHANTONA CHAUDHURY,MS. SHANTONA CHAUDHURY,shantona chaudhury
28-264-13,"Yes. That Cabinet meeting, both at the IRG, the Incident Response Group meeting, the prime minister chaired earlier in that day on the 13th and the Cabinet meeting which was quite late in that Sunday evening, the prime minister made it very clear to ministers that he had not come to a decision. He was very clear that he had not come to a conclusion around invoking the Emergencies Act, that he was going to hear from premiers the following day. But the discussion was amongst ministers in terms of what are the steps that we -- what are the steps that are necessary to bring these illegal occupations and blockades to an end, and to restore some sense of public confidence because even if particular activities or blockades were perhaps being resolved -- Ottawa certainly wasn’t -- but there was a concern, as I said about a spreading effect or what would be the knock-on effect. So he listened to ministers. We were briefed by the senior officials responsible for a number of federal law enforcement agencies, the National Security Advisor, for example, the Commissioner of the RCMP, the Canadian Border Services, some of the officials I’m sure you've interviewed would have described to ministers their sense of the evolving situation. And then the prime minister would have heard from ministers in terms of their views on what was necessary to resolve this.",28-264-15,264,15,13,speaker_start,EXAMINATION-IN-CHIEF BY MS. SHANTONA CHAUDHURY,MINISTER DOMINIC LeBLANC,minister dominic leblanc
28-265-09,"Okay. And you'll be glad to know that, given your role as Minister of Intergovernmental Affairs, I’m going to be focusing on that as opposed to going through all of the inputs that were received before Cabinet that night. So Mr. Clerk, can you then pull up please MAN00000048? So Minister LeBlanc, we understand the Cabinet meeting took place around 8:30 the night of the 13th. And the document we’re about to pull up is the email invitation that was sent about the First Ministers meeting. I think it was sent -- if we see the time stamp, it works out to 10:L46 p.m. EST. I have to do the conversion for time there. Scroll down a little bit, please, Mr. Clerk. It says: “Colleagues. The prime minister will convene an urgent First Ministers call. The call will take place on February 14th at 10:15. Dial-in info to follow. Please confirm your premier’s availability. I apologize for the short notice. Michael” Michael being Michael Vandergirft, the Deputy Secretary of --- the Deputy Minister, I'm sorry, of Intergovernmental Affairs.",28-265-11,265,11,9,speaker_start,EXAMINATION-IN-CHIEF BY MS. SHANTONA CHAUDHURY,MS. SHANTONA CHAUDHURY,shantona chaudhury
28-266-06,That’s right. And I remember discussing with him that evening after -- he sent that after the Cabinet meeting had concluded at 10:30 or 10:45 that evening.,28-266-08,266,8,6,speaker_start,EXAMINATION-IN-CHIEF BY MS. SHANTONA CHAUDHURY,MINISTER DOMINIC LeBLANC,minister dominic leblanc
28-266-10,"Okay. What’s sort of conspicuous by its absence in that email is any mention of the Emergencies Act, any mention of why the First Ministers meeting is being convened. Can you tell us why that would be?",28-266-12,266,12,10,speaker_start,EXAMINATION-IN-CHIEF BY MS. SHANTONA CHAUDHURY,MS. SHANTONA CHAUDHURY,shantona chaudhury
28-266-15,"So we obviously had a significant concern about potential leaks in the public domain about the subject of that First Ministers meeting. I had no doubt that had we said we’re convening this First Minister’s conversation on the Emergencies Act everybody on their morning radio shows would have heard that the prime minister has a meeting with the premiers to discuss the Emergencies Act. And we’ve heard from law enforcement officials in our own government, and I've taken note of a number of witnesses before your Commission, about the potential of an incendiary reaction to the invocation. So we thought that it would have been irresponsible to risk that going out into the public space before the First Ministers had had an opportunity, absent from everybody’s early morning radio shows to talk to the prime minister about that issue. So there were two reasons probably why Mr. Vandergrift didn’t put a subject line. One was to minimize the inevitable leak to a media or in the public space. We had a lot of experience with First Ministers' meetings in the COVID context and very rarely were those discussions not, in some extent, reflected in public comments, so that was a concern. But also, I think there was a desire from the Privy Council Office to as much as was possible, to as much as was possible, to allow first ministers to have that conversation with the prime minister at 10:15 on the 14th, absent, as I said, the public discourse that would have inevitably followed about should we, will we, did the government decide that as much as possible, would have been counterproductive to an open and frank discussion amongst first ministers.",28-266-17,266,17,15,speaker_start,EXAMINATION-IN-CHIEF BY MS. SHANTONA CHAUDHURY,MINISTER DOMINIC LeBLANC,minister dominic leblanc
28-267-16,"And one thing Madam Drouin said on this point when she testified on Friday was -- her words, I believe, were they knew that from the moment the government starts talking publicly about invoking the Emergencies Act, the timeline to take a decision was very short. So does that reflect the -- what you're discussing right now? It was sort of -- it was kept quiet because once it's out there, who knows what happens?",28-267-18,267,18,16,speaker_start,EXAMINATION-IN-CHIEF BY MS. SHANTONA CHAUDHURY,MS. SHANTONA CHAUDHURY,shantona chaudhury
28-267-24,"That was very much a concern the government had. She reflected, I think, what was a concern of some of the advice we were getting from senior officials in the law enforcement and intelligence apparatus of the Government of Canada. But we've seen subsequently, we've seen subsequently premiers who had expressed in that meeting concerns around the public effect of a discussion of a potential invocation, so the shortest period of time between the public discussion around should the government or will the government proceed to an invocation of the Emergencies Act, the shorter period of time would perhaps be conducive with the public safety imperative of making that decision in a way that was responsible.",28-267-26,267,26,24,speaker_start,EXAMINATION-IN-CHIEF BY MS. SHANTONA CHAUDHURY,MINISTER DOMINIC LeBLANC,minister dominic leblanc
28-268-10,"Well, I think in the end it clocked in as under 24 hours, so that was mission accomplished?",28-268-12,268,12,10,speaker_start,EXAMINATION-IN-CHIEF BY MS. SHANTONA CHAUDHURY,MS. SHANTONA CHAUDHURY,shantona chaudhury
28-268-13,"Yeah. And obviously, some people would have said that we should have had an open and extensive public conversation around these issues. In the particular context of the illegal activities that were taking place and the real threat to the safety of Canadians, we as a government concluded that a prolonged and public conversation of this would not be conducive to a safe and efficient and effective ending of these illegal blockades and occupations.",28-268-15,268,15,13,speaker_start,EXAMINATION-IN-CHIEF BY MS. SHANTONA CHAUDHURY,MINISTER DOMINIC LeBLANC,minister dominic leblanc
28-268-21,"Understood. And because you mentioned it, the various first ministers conversations or calls, rather, that were had around COVID back in, I think, probably March 2020, around then, is something that’s arisen sort of tangentially in passing a couple of times in testimony before the Commission, but -- so I'll just ask you to also address it tangentially in passing. But can you tell us a little bit about how those meetings were convened and how they proceeded and what they were about, because obviously, we know that they -- those meetings touched, in part on whether emergency legislation would be appropriate in that context.",28-268-23,268,23,21,speaker_start,EXAMINATION-IN-CHIEF BY MS. SHANTONA CHAUDHURY,MS. SHANTONA CHAUDHURY,shantona chaudhury
28-269-05,"So obviously, in the context of the pandemic, federal-provincial cooperation on public health measures, on things as important as vaccine procurements, vaccine distributions, border measures, the Government of Canada has responsibility obviously for international borders. So there was a very effective, I would argue, and extensive federal-provincial collaboration around the fight against COVID. That was one of, I think, our country's successes in terms of managing our federation. That required, in some cases, weekly or bi-weekly calls the prime minister would convene with first ministers. I would participate in most if not all of those calls, usually as an observer. But the prime minister wanted to coordinate as much as possible the various public health measures. Dr. Tam would provide updates. So that was an ongoing discussion. At one point, there was a discussion -- I don't remember, but I think it was in 2020 in the first months potentially of the pandemic around could the Emergencies Act be an instrument that would be helpful in our collective fight against COVID? And I think my colleague, David Lametti, consulted some of his provincial and territorial counterparts -- or not some of -- consulted provincial and territorial counterparts. There was a process and the government concluded that at that moment -- there was never a conclusion that we would never or could never perhaps have recourse to the Emergencies Act around the COVID measures, but certainly we concluded, having had that conversation with premiers and public health experts, that it wouldn't have been a particularly advisable tool at that particular moment.",28-269-07,269,7,5,speaker_start,EXAMINATION-IN-CHIEF BY MS. SHANTONA CHAUDHURY,MINISTER DOMINIC LeBLANC,minister dominic leblanc
28-270-06,Okay.,28-270-08,270,8,6,speaker_start,EXAMINATION-IN-CHIEF BY MS. SHANTONA CHAUDHURY,MS. SHANTONA CHAUDHURY,shantona chaudhury
28-270-07,"But that was not an active part of the first ministers' conversations around the COVID measures. It probably came up once or twice, but to say it was a source of significant discussion at the first ministers' level I think might not be an accurate representation, but it certainly had come up.",28-270-09,270,9,7,speaker_start,EXAMINATION-IN-CHIEF BY MS. SHANTONA CHAUDHURY,MINISTER DOMINIC LeBLANC,minister dominic leblanc
28-270-13,"Okay. And certainly, before this first ministers' call, the idea of invoking the Emergencies Act in the context of the Freedom Convoy had not come up in conversations with any premiers?",28-270-15,270,15,13,speaker_start,EXAMINATION-IN-CHIEF BY MS. SHANTONA CHAUDHURY,MS. SHANTONA CHAUDHURY,shantona chaudhury
28-270-17,Absolutely.,28-270-19,270,19,17,speaker_start,EXAMINATION-IN-CHIEF BY MS. SHANTONA CHAUDHURY,MINISTER DOMINIC LeBLANC,minister dominic leblanc
28-270-18,Okay.,28-270-20,270,20,18,speaker_start,EXAMINATION-IN-CHIEF BY MS. SHANTONA CHAUDHURY,MS. SHANTONA CHAUDHURY,shantona chaudhury
28-270-19,That’s accurate.,28-270-21,270,21,19,speaker_start,EXAMINATION-IN-CHIEF BY MS. SHANTONA CHAUDHURY,MINISTER DOMINIC LeBLANC,minister dominic leblanc
28-270-20,How am I doing for time? I completely neglected to write down when I started.,28-270-22,270,22,20,speaker_start,EXAMINATION-IN-CHIEF BY MS. SHANTONA CHAUDHURY,MS. SHANTONA CHAUDHURY,shantona chaudhury
28-270-22,"You have lots of time left. You have about I think about 20, 30 minutes.",28-270-24,270,24,22,speaker_start,EXAMINATION-IN-CHIEF BY MS. SHANTONA CHAUDHURY,COMMISSIONER ROULEAU,commissioner rouleau
28-270-24,"Perfect, okay. So then I want to take you, Minister, to the chronology of February 14th. And I'll ask Mr. Clerk to pull up now OPS0001456. No, sorry, 14566. So this is just a little chronological point that we'd like to clear up because if you scroll down here -- and just to let you know what these are, these are -- I think are probably scribe notes of a police meeting, so I think the participants were Commissoner Lucki, Commissioner Carrique, and Chief Sloly, if I'm not mistaken. Scroll down a -- oh, actually, you've got it. Thank you, Mr. Clerk. So if you see the last bullet point there, this is a meeting that takes place at 10 o'clock in the morning on February 14th. And you'll see what's recorded about what Commissioner Lucki says is, ""Lucki did not get prime minister briefed on the plan,"" the plan here being the Ottawa Police plan to resolve the situation in Ottawa. And then, ""Prime minister will be enacting the Emergency Measures Act."" So if I take your evidence and some other evidence we've heard so far, that had not been decided at 10 o'clock in the morning on the 14th, that the prime minister would invoke the Emergencies Act?",28-270-26,270,26,24,speaker_start,EXAMINATION-IN-CHIEF BY MS. SHANTONA CHAUDHURY,MS. SHANTONA CHAUDHURY,shantona chaudhury
28-271-20,"No, it had not been decided at all. I don't know why the commissioner would have said that. The prime minister began the meeting with the premiers 15 minutes after she said that by saying he had not come to a decision whatsoever. The clerk had not moved the decision memo to him, so that is not an accurate representation whatsoever from my perspective of when the government made the decision.",28-271-22,271,22,20,speaker_start,EXAMINATION-IN-CHIEF BY MS. SHANTONA CHAUDHURY,MINISTER DOMINIC LeBLANC,minister dominic leblanc
28-271-28,"And to be fair, these are notes of a meeting, so it's nothing -- it's not necessarily what Commissioner Lucki said, but it's what written down about what ---",28-271-30,271,30,28,speaker_start,EXAMINATION-IN-CHIEF BY MS. SHANTONA CHAUDHURY,MS. SHANTONA CHAUDHURY,shantona chaudhury
28-272-04,"That right, and I'm seeing this for the first time here.",28-272-06,272,6,4,speaker_start,EXAMINATION-IN-CHIEF BY MS. SHANTONA CHAUDHURY,MINISTER DOMINIC LeBLANC,minister dominic leblanc
28-272-06,"Okay. So -- but in any event, that does not accord with your recollection of the chronology?",28-272-08,272,8,6,speaker_start,EXAMINATION-IN-CHIEF BY MS. SHANTONA CHAUDHURY,MS. SHANTONA CHAUDHURY,shantona chaudhury
28-272-09,"No, that does not reflect at all my understanding and my personal involvement with those decisions on that day on the 14th.",28-272-11,272,11,9,speaker_start,EXAMINATION-IN-CHIEF BY MS. SHANTONA CHAUDHURY,MINISTER DOMINIC LeBLANC,minister dominic leblanc
28-272-12,"Thank you. Thanks, Mr. Clerk. You can take that one down. And can you pull up SSM.NSC.CAN00000625? This is the readout, Minister LeBlanc, of the first ministers' meeting itself, so with the assistance of this, I'd like you to just walk us through. How did that meeting unfold, how did it take place? Obviously not every detail, but what were the various opinions being conveyed, being expressed, and how were they received?",28-272-14,272,14,12,speaker_start,EXAMINATION-IN-CHIEF BY MS. SHANTONA CHAUDHURY,MS. SHANTONA CHAUDHURY,shantona chaudhury
28-272-21,"So I obviously have familiarized myself with this summary of that conversation, and I participated, of course, in that meeting. I made a brief intervention at the front end of that conversation. The prime minister began by stressing that he had not come to a decision on whether we should invoke the federal Emergencies Act. He spoke at length in terms of these measures would not supplant existing provincial authorities. I think later in the conversation there was some discussion about whether command structures of provincial police authorities would change. The Prime Minister wanted to, at the front end of the meeting, make it very clear that these were designed to be complimentary measures that provincial and municipal law enforcement authorities could use when they thought they were needed. He was very clear that it should be a proportionate series of measures, proportionate to the real public order emergency that the government was seeing to the threat to the safety and security of Canadians. And he also made it clear to the Premiers at the front end that nothing in the invocation of the Emergencies Act would take away the Charter protections that Canadians enjoyed, and that this could be done in a way that was compliant with the Charter of Rights and Freedoms.",28-272-23,272,23,21,speaker_start,EXAMINATION-IN-CHIEF BY MS. SHANTONA CHAUDHURY,MINISTER DOMINIC LeBLANC,minister dominic leblanc
28-273-17,"Okay. Mr. Clerk, can you scroll down to the next page, please? We’re just going to go through a few of the views that appear to have been expressed by various participants on the call. So Premier Horgan sees -- he says: “Approach sounds measured and practical. We are susceptible as anyone across the country.” But then he says: “Only concern is that these measures would be implemented by [the] RCMP […] which are already fully taxed.” And then: “Concern about emboldening those losing public support. People are exhausted […], but have taken three shorts […]. Worry that too heavy a hand may embolden others.” But then he says in the end: “Would support this at this stage.” So can you explain to us, in your words, essentially, what Premier Horgan was conveying to you at the meeting?",28-273-19,273,19,17,speaker_start,EXAMINATION-IN-CHIEF BY MS. SHANTONA CHAUDHURY,MS. SHANTONA CHAUDHURY,shantona chaudhury
