interjection_id,text_clean_combined,line_id,page,line,transcript_line_number,line_type,section_header,speaker,speaker_standardized
02-161-02,"And then Metcalfe and O’Connor but it would expand during the weekends when more vehicles came into the city on the weekends. So Metcalfe and O’Connor, at times, mostly on the weekends, could have a lot of vehicles parked ---",02-161-04,161,4,2,speaker_start,EXAMINATION IN-CHIEF BY MS. NATALIA RODRIGUEZ,COUNCILLOR CATHERINE McKENNEY,councillor catherine mckenney
02-161-07,Yeah.,02-161-09,161,9,7,speaker_start,EXAMINATION IN-CHIEF BY MS. NATALIA RODRIGUEZ,MS. NATALIA RODRIGUEZ,natalia rodriguez
02-161-08,--- but it did expand and contract depending on the time of the week.,02-161-10,161,10,8,speaker_start,EXAMINATION IN-CHIEF BY MS. NATALIA RODRIGUEZ,COUNCILLOR CATHERINE McKENNEY,councillor catherine mckenney
02-161-10,So several blocks south from Parliament down to Somerset is about -- it was six or seven blocks south and then expanding maybe five blocks east to west?,02-161-12,161,12,10,speaker_start,EXAMINATION IN-CHIEF BY MS. NATALIA RODRIGUEZ,MS. NATALIA RODRIGUEZ,natalia rodriguez
02-161-13,Correct.,02-161-15,161,15,13,speaker_start,EXAMINATION IN-CHIEF BY MS. NATALIA RODRIGUEZ,COUNCILLOR CATHERINE McKENNEY,councillor catherine mckenney
02-161-14,"Okay, thank you. And, Councillor Fleury, then, in terms of where the convoy expanded into in your area, can you give us a sense based on the map?",02-161-16,161,16,14,speaker_start,EXAMINATION IN-CHIEF BY MS. NATALIA RODRIGUEZ,MS. NATALIA RODRIGUEZ,natalia rodriguez
02-161-18,"Yes, it started in front of Chateau Laurier ---",02-161-20,161,20,18,speaker_start,EXAMINATION IN-CHIEF BY MS. NATALIA RODRIGUEZ,COUNCILLOR MATHIEU FLEURY,councillor mathieu fleury
02-161-20,"Yes, okay.",02-161-22,161,22,20,speaker_start,EXAMINATION IN-CHIEF BY MS. NATALIA RODRIGUEZ,MS. NATALIA RODRIGUEZ,natalia rodriguez
02-161-21,--- so what would be One Rideau.,02-161-23,161,23,21,speaker_start,EXAMINATION IN-CHIEF BY MS. NATALIA RODRIGUEZ,COUNCILLOR MATHIEU FLEURY,councillor mathieu fleury
02-161-23,"Right, right there.",02-161-25,161,25,23,speaker_start,EXAMINATION IN-CHIEF BY MS. NATALIA RODRIGUEZ,MS. NATALIA RODRIGUEZ,natalia rodriguez
02-161-24,"Yeah. Went through the intersection of Sussex. There were a number of -- you know, further down towards the Shaw Centre, further up towards George Street, all the way down Rideau Street, up to Waller.",02-161-26,161,26,24,speaker_start,EXAMINATION IN-CHIEF BY MS. NATALIA RODRIGUEZ,COUNCILLOR MATHIEU FLEURY,councillor mathieu fleury
02-161-28,"Yeah, so we just got to go up on the map a little bit here.",02-161-30,161,30,28,speaker_start,EXAMINATION IN-CHIEF BY MS. NATALIA RODRIGUEZ,MS. NATALIA RODRIGUEZ,natalia rodriguez
02-162-02,"Yeah, they’re ---",02-162-04,162,4,2,speaker_start,EXAMINATION IN-CHIEF BY MS. NATALIA RODRIGUEZ,COUNCILLOR MATHIEU FLEURY,councillor mathieu fleury
02-162-03,"Oh, other way.",02-162-05,162,5,3,speaker_start,EXAMINATION IN-CHIEF BY MS. NATALIA RODRIGUEZ,MS. NATALIA RODRIGUEZ,natalia rodriguez
02-162-04,It’s going east.,02-162-06,162,6,4,speaker_start,EXAMINATION IN-CHIEF BY MS. NATALIA RODRIGUEZ,COUNCILLOR MATHIEU FLEURY,councillor mathieu fleury
02-162-05,There we go.,02-162-07,162,7,5,speaker_start,EXAMINATION IN-CHIEF BY MS. NATALIA RODRIGUEZ,MS. NATALIA RODRIGUEZ,natalia rodriguez
02-162-06,That’s right.,02-162-08,162,8,6,speaker_start,EXAMINATION IN-CHIEF BY MS. NATALIA RODRIGUEZ,COUNCILLOR MATHIEU FLEURY,councillor mathieu fleury
02-162-07,"Yeah, that’s right. So we’re going that way now, okay.",02-162-09,162,9,7,speaker_start,EXAMINATION IN-CHIEF BY MS. NATALIA RODRIGUEZ,MS. NATALIA RODRIGUEZ,natalia rodriguez
02-162-09,So towards King Edward ---,02-162-11,162,11,9,speaker_start,EXAMINATION IN-CHIEF BY MS. NATALIA RODRIGUEZ,COUNCILLOR MATHIEU FLEURY,councillor mathieu fleury
02-162-11,Yeah.,02-162-13,162,13,11,speaker_start,EXAMINATION IN-CHIEF BY MS. NATALIA RODRIGUEZ,MS. NATALIA RODRIGUEZ,natalia rodriguez
02-162-12,"--- there were rigs along King Edward and there were rigs all the way to the Loblaws on Rideau, which is at Nelson and Rideau. So that was the furthest eastern segment. And then were sections of rigs beside the University of Ottawa, Desmarais Building on Nicholas.",02-162-14,162,14,12,speaker_start,EXAMINATION IN-CHIEF BY MS. NATALIA RODRIGUEZ,COUNCILLOR MATHIEU FLEURY,councillor mathieu fleury
02-162-17,"Right, and we see a pin there just on the bottom there. Now, there’s a pin at the top there where it says “Shepherds of Good Hope” and I understand there was incident there.",02-162-19,162,19,17,speaker_start,EXAMINATION IN-CHIEF BY MS. NATALIA RODRIGUEZ,MS. NATALIA RODRIGUEZ,natalia rodriguez
02-162-21,Correct.,02-162-23,162,23,21,speaker_start,EXAMINATION IN-CHIEF BY MS. NATALIA RODRIGUEZ,COUNCILLOR MATHIEU FLEURY,councillor mathieu fleury
02-162-22,Did the trucks expand up to that area?,02-162-24,162,24,22,speaker_start,EXAMINATION IN-CHIEF BY MS. NATALIA RODRIGUEZ,MS. NATALIA RODRIGUEZ,natalia rodriguez
02-162-24,Correct.,02-162-26,162,26,24,speaker_start,EXAMINATION IN-CHIEF BY MS. NATALIA RODRIGUEZ,COUNCILLOR MATHIEU FLEURY,councillor mathieu fleury
02-162-25,"Okay. So if we can expand -- if we can zoom out, rather. So we can -- it seems pretty expansive, then, if we’re looking all the way up there and then down to the residential areas in Centretown. Okay, so that’s very helpful to get a sense for the scope and breadth that we’re talking about when we’re discussing some of these issues. Okay, I think we can take the map down for now. Just a high level -- and we’re going to get into more details but I just wanted to ask at a high level how the residents in your ward were impacted by the protests of January and February of this year. Councillor McKenney, I’ll start with you.",02-162-27,162,27,25,speaker_start,EXAMINATION IN-CHIEF BY MS. NATALIA RODRIGUEZ,MS. NATALIA RODRIGUEZ,natalia rodriguez
02-163-09,"Well, on the first weekend, people were braced for, you know, what they anticipated would be serious disruption. They were surprised when -- and frustrated and angry when the city and/or police allowed trucks to actually enter non-truck routes. So trucks -- very large trucks parked along Queen Elizabeth Driveway, for example, which is not a truck route, and stayed there for the weekend, and then coming down Kent, Metcalfe, O’Connor. So there was, you know, that first weekend, more of a bracing just to kind of get through the weekend. Started to see almost immediately -- and I started to receive emails and it was on social media -- symbols of hatred, you know, swastikas and Confederate flags, you know, Pride flags being, you know, targeted, so there was fear. Certainly, people that first weekend who were reporting back to me, and calling me, and emailing were fearful but they were braced for it and, you know, had been told that would it end on Monday and waited for that. So after Monday, when it didn’t end, it just became -- you know, in the words of people who were, you know, calling me and talking to me, they felt that they were under a great deal of threat, seniors reporting that they, you know, had trouble going out, they felt threatened when they went into a grocery store, you know, residents not being able to leave their apartments. I had to help on couple leave the downtown with a police escort on the first weekend. There was a Pride flag in their window. They’re apartment was targeted. Somebody had defecated on the back step. And then later that night, you know, a pickup truck with angry people in it came back and were harassing and yelling at them so, at that point, they felt very unsafe and we had a police escort them out. So it was, you know, a general sense of fear, terror, and, you know, dismay that they felt abandoned by their city and by their police.",02-163-11,163,11,9,speaker_start,EXAMINATION IN-CHIEF BY MS. NATALIA RODRIGUEZ,COUNCILLOR CATHERINE McKENNEY,councillor catherine mckenney
02-164-16,"Councillor Fleury, how about you?",02-164-18,164,18,16,speaker_start,EXAMINATION IN-CHIEF BY MS. NATALIA RODRIGUEZ,MS. NATALIA RODRIGUEZ,natalia rodriguez
02-164-18,I’d like to add ---,02-164-20,164,20,18,speaker_start,EXAMINATION IN-CHIEF BY MS. NATALIA RODRIGUEZ,COUNCILLOR MATHIEU FLEURY,councillor mathieu fleury
02-164-19,Sure.,02-164-21,164,21,19,speaker_start,EXAMINATION IN-CHIEF BY MS. NATALIA RODRIGUEZ,MS. NATALIA RODRIGUEZ,natalia rodriguez
02-164-20,"So just to recognize that everything my colleague said is very similar to the realities I face -- that our communities face. I would add that the number of closures -- we have, in my community, one of the largest commercial properties, which is the Rideau Centre located at the corner of Rideau and Colonel By. There’s 300 business in the Rideau Centre. I’m told by the general manager, close to 3000 employees, and they were forced to close on the first Saturday and it took them about four hours, with help from police, to properly close the facility. Many of the businesses in the Byward Market -- there’s around -- it’s hard to give you an official because there’s businesses along Rideau Street; there’s businesses in the Byward Market. Many of them closed for the weekend and never reopened. Those who stayed open, many closed after that first weekend because of incidents with staff. And many incidents were reported relating -- there were a number of restrictions in place at the time? Mask wearing -- restaurants were not open. There’s a number of elements like that which created many incidents with part-time restaurant staff in the Byward Market and on Rideau Street. And then the non-stop noise of that first weekend, we have, as you've seen this morning and as we’ve encountered through the realities of walking through the site and communication with businesses and residents, just a non- liveable area for folks who lived in the Byward Market, lived on Rideau Street, lived on the northern part of Sandy Hill. Non- stop noise, the intimidation when they went out, specifically if they followed regulations and wore masks. There were a number of incidents where bus detours had to be conducted and we have communications with residents who, for example, waited for a Para-Transpo -- Para- Transpo is the accessible bus of Ottawa -- and couldn’t get to their cancer treatment because the bus couldn’t get there and they were not mobile. There were a number of incidents, as you know, and both Councillor McKenney and I, we have the LRT, the tunnel section. So if you want to access transit you have to walk -- go through long escalators to the platform. And there were a lot of movements between St. Laurent Shopping Centre and the downtown core. And many incidents on those trains that went unreported. And you know, fortunately OC Transpo did adapt but those first few days to weekends it was quite challenging. And so much so that many of the transit routes downtown just didn’t operate.",02-164-22,164,22,20,speaker_start,EXAMINATION IN-CHIEF BY MS. NATALIA RODRIGUEZ,COUNCILLOR MATHIEU FLEURY,councillor mathieu fleury
02-166-09,"And Councillor McKenney, were the businesses in your ward similarly affected?",02-166-11,166,11,9,speaker_start,EXAMINATION IN-CHIEF BY MS. NATALIA RODRIGUEZ,MS. NATALIA RODRIGUEZ,natalia rodriguez
02-166-11,"Yes, they were, Sparks Street in particular and also Bank Street. Bank Street ended up being closed down with trucks parked on it, all the way south to just north of Somerset. So I would say Lisgar. Again, on the weekends is when it really -- things would escalate. The transit stations were taken over. There were makeshift kitchens. There were barrels with fires burning on the street. And yeah, it was impossible for anyone to move about without encountering the people in the city who were occupying the city at the time.",02-166-13,166,13,11,speaker_start,EXAMINATION IN-CHIEF BY MS. NATALIA RODRIGUEZ,COUNCILLOR CATHERINE McKENNEY,councillor catherine mckenney
02-166-21,"Thank you. And I understand that during the second and third weeks particularly, both of you visited the site, walked around, walked the streets. Can you maybe describe a little bit of what you saw during those walks? I’ll start with Councillor Fleury.",02-166-23,166,23,21,speaker_start,EXAMINATION IN-CHIEF BY MS. NATALIA RODRIGUEZ,MS. NATALIA RODRIGUEZ,natalia rodriguez
02-166-27,"Very different from weekends to week days. On week days it was more, let’s call them, permanent occupiers with the larger rigs. As the weekend approached, it was pickup trucks that would be parking anywhere and everywhere and kind of add to the existing weapons that were on the street and that tension that was existing.",02-166-29,166,29,27,speaker_start,EXAMINATION IN-CHIEF BY MS. NATALIA RODRIGUEZ,COUNCILLOR MATHIEU FLEURY,councillor mathieu fleury
02-167-05,"Sorry, by “weapons” what do you mean by “weapons”?",02-167-07,167,7,5,speaker_start,EXAMINATION IN-CHIEF BY MS. NATALIA RODRIGUEZ,MS. NATALIA RODRIGUEZ,natalia rodriguez
02-167-07,"Well, for us, you know, having the physical truck on the street created a big weapon in the spirit of the noise, the pollution of the fumes, the ability for folks to operate their businesses, to open, for us to offer services. There were a lot of rigs at the corner of Sussex and Rideau, and Rideau Centre is kind of that connection point on transit and for many of the access in and out of the market and on transit for routes that are coming from the western part of downtown and the eastern part of downtown. So not having access to that Rideau Sussex intersection created that congestion in that space. So I mean, I could go on and on but I think you get the picture that there were really really -- you couldn’t. You couldn’t live in that space. It was non-stop noise, non-stop pollution. You couldn’t get out because you’d hear yells. You’d get yelled at. There were a number of micro aggressions on the periphery of the red zone, particularly in residential communities which both Catherine and I lived firsthand and heard directly from residents. And then through the weekend it was this influx of pickup trucks who would not follow rules. Like, for example, in the market, you know, the Byward Market -- and just to locate you a little bit, at the corner of Byward and George Street there’s The Bay on one side. So there’s this big kind of sidewalk, if you will, that leads to Sussex. The road is pretty defined. It’s a one lane in each direction with parking bays on each side. Well, pickup trucks were just parked anywhere and everywhere in any direction, on the sidewalk, in vehicular lanes, so even if residents or businesses, for example like The Bay, Chapters, and so on -- their loading zone is right there. They couldn’t physically get garbage in and out or their equipment if they wanted to open. So you kind of -- I’m giving you an example. It was the same issues along Rideau. It was the same issues along Nicholas, and in different parts of the Byward Market.",02-167-09,167,9,7,speaker_start,EXAMINATION IN-CHIEF BY MS. NATALIA RODRIGUEZ,COUNCILLOR MATHIEU FLEURY,councillor mathieu fleury
02-168-14,"Thank you. Councillor McKenney, what kind of issues did you observe on your walks?",02-168-16,168,16,14,speaker_start,EXAMINATION IN-CHIEF BY MS. NATALIA RODRIGUEZ,MS. NATALIA RODRIGUEZ,natalia rodriguez
02-168-17,"So I started to go out after the first weekend, Monday, when we knew that, you know, about 80 percent of the large trucks left. But the 20 percent that were left were remaining and had -- you could see no intention of leaving anytime soon. And as Councillor Fleury said, we would get this surge of people coming into the city who were sympathetic to the, you know, original convoy that had entered. I started to go out at that week, walk around. I would go through the convoy and observe. I would meet with residents who were feeling threatened. I delivered food to some people. I delivered pet food to some people, in particular, who were living in some of our community housing buildings who felt very threatened and not able to go out. I organized one -- what we called the safety walk so that we could come out together as a community. And that happened the second week. But you know, we stayed within the residential area away from, you know, where the convoy had taken root. We had organized a second one and we called it off because the environment just felt more threatening and I didn’t -- my fear through all of this and my key concern through all of this was the safety of residents that I represent. You know, there was nothing more on my mind than the safety of the people that live in the city and that I represent. So you know, again it would get the surge on the weekends and you know, I have stated before and I will again, you know, I was always careful when I went down, walked through the convoy. I was accosted on a few occasions but not, you know -- never felt that I was in any real danger. But walking home through the residential streets was always when I felt the most threatened. It’s often when I was threatened. You know, homophobic slurs, transphobic slurs, just you know, people recognizing me from media or other means. So it was more, you know, on the streets going home it was more those isolated incidents that were the greatest threat throughout the -- and that’s what I heard from residents as well. You know, it was uncomfortable. They had to stay safe walking through the convoy especially if they wore a mask, racialized. But it was outside of that where it was more so the people who were sympathetic to the convoy who were coming into the city and causing that type of fear.",02-168-19,168,19,17,speaker_start,EXAMINATION IN-CHIEF BY MS. NATALIA RODRIGUEZ,COUNCILLOR CATHERINE McKENNEY,councillor catherine mckenney
02-170-03,"And I'm going to take you then, Councillor McKenney, to a document that you received. It’s a video that was sent to you by a resident and you have mentioned that residents were communicating with you and sending you correspondence. It’s at OT00012814. Now, first of all, do you recall receiving this video from a constituent?",02-170-05,170,5,3,speaker_start,EXAMINATION IN-CHIEF BY MS. NATALIA RODRIGUEZ,MS. NATALIA RODRIGUEZ,natalia rodriguez
02-170-10,I do.,02-170-12,170,12,10,speaker_start,EXAMINATION IN-CHIEF BY MS. NATALIA RODRIGUEZ,COUNCILLOR CATHERINE McKENNEY,councillor catherine mckenney
02-170-11,And the email indicates that it was on February 1st. Do you have a sense for where the video was taken just based on what you could see there? And we could just show it up again just to --maybe just a still shot of the video. Just on pause here. But does that give you a sense for where the video was taken?,02-170-13,170,13,11,speaker_start,EXAMINATION IN-CHIEF BY MS. NATALIA RODRIGUEZ,MS. NATALIA RODRIGUEZ,natalia rodriguez
02-170-19,"Yes. It would indicate that it’s on Metcalf Street, either Metcalfe, Nepean. It's just behind the Shopify building, which is on Elgin.",02-170-21,170,21,19,speaker_start,EXAMINATION IN-CHIEF BY MS. NATALIA RODRIGUEZ,COUNCILLOR CATHERINE McKENNEY,councillor catherine mckenney
02-170-22,"And that's the one we're -- that blue kind of beige one that we're seeing there, that's the Shopify building?",02-170-24,170,24,22,speaker_start,EXAMINATION IN-CHIEF BY MS. NATALIA RODRIGUEZ,MS. NATALIA RODRIGUEZ,natalia rodriguez
02-170-25,Correct.,02-170-27,170,27,25,speaker_start,EXAMINATION IN-CHIEF BY MS. NATALIA RODRIGUEZ,COUNCILLOR CATHERINE McKENNEY,councillor catherine mckenney
02-170-26,Okay. And so this is a residential area?,02-170-28,170,28,26,speaker_start,EXAMINATION IN-CHIEF BY MS. NATALIA RODRIGUEZ,MS. NATALIA RODRIGUEZ,natalia rodriguez
02-170-28,"Yes, it is.",02-170-30,170,30,28,speaker_start,EXAMINATION IN-CHIEF BY MS. NATALIA RODRIGUEZ,COUNCILLOR CATHERINE McKENNEY,councillor catherine mckenney
02-171-01,And it's in your ward?,02-171-03,171,3,1,speaker_start,EXAMINATION IN-CHIEF BY MS. NATALIA RODRIGUEZ,MS. NATALIA RODRIGUEZ,natalia rodriguez
02-171-02,"Yes, it is.",02-171-04,171,4,2,speaker_start,EXAMINATION IN-CHIEF BY MS. NATALIA RODRIGUEZ,COUNCILLOR CATHERINE McKENNEY,councillor catherine mckenney
02-171-03,And is this consistent with the kind of sound level that you experienced in that area?,02-171-05,171,5,3,speaker_start,EXAMINATION IN-CHIEF BY MS. NATALIA RODRIGUEZ,MS. NATALIA RODRIGUEZ,natalia rodriguez
02-171-05,"Yes, it is.",02-171-07,171,7,5,speaker_start,EXAMINATION IN-CHIEF BY MS. NATALIA RODRIGUEZ,COUNCILLOR CATHERINE McKENNEY,councillor catherine mckenney
02-171-06,"And this is, you know, one video that was sent to you, but were there others in similar kind of nature, or how would you this relative to the other emails and communications that you received?",02-171-08,171,8,6,speaker_start,EXAMINATION IN-CHIEF BY MS. NATALIA RODRIGUEZ,MS. NATALIA RODRIGUEZ,natalia rodriguez
02-171-10,"Certainly, it was very consistent with other messages I received, but also social media that I was being sent. And also, just being in the area for days and having that type of horn noise going on almost 24/7, it was very -- it almost never stopped. It might for a half-an-hour now and then, and it would start up again, and it just traumatized residents. So it was very difficult to absorb that terror that residents were living under. It's why I just went down every day just so that I would be able to give voice to it.",02-171-12,171,12,10,speaker_start,EXAMINATION IN-CHIEF BY MS. NATALIA RODRIGUEZ,COUNCILLOR CATHERINE McKENNEY,councillor catherine mckenney
02-171-20,"And I'm going to take you now to another email you received, and it's at OTT, three zeroes, 14415. And so we can see that it's dated February 2nd, and the subject line is Centre Town Convoy Disruptions and Noise, and the sender starts by saying: ""Good afternoon. I hope you're all having a peaceful afternoon. I'm not. I live on the intersection of Metcalfe and Cooper Streets in Downtown Ottawa. Since Friday, I have had a non-stop barrage of truck horns, a very illegal train horn, drunken revellers and plain old guys screaming in my neighbourhood. This is oftentimes directly outside of my window, and I am just above street level. See attached video to experience how loud it was this past Sunday. This started as early as 7:00 a.m., and over the weekend I heard honking and screaming until well past 1:00 a.m."" (As read) Do you recall this email?",02-171-22,171,22,20,speaker_start,EXAMINATION IN-CHIEF BY MS. NATALIA RODRIGUEZ,MS. NATALIA RODRIGUEZ,natalia rodriguez
02-172-14,I do.,02-172-16,172,16,14,speaker_start,EXAMINATION IN-CHIEF BY MS. NATALIA RODRIGUEZ,COUNCILLOR CATHERINE McKENNEY,councillor catherine mckenney
02-172-15,And this person indicates that they're at Metcalfe and Cooper. And can you confirm that's a residential area within your ward?,02-172-17,172,17,15,speaker_start,EXAMINATION IN-CHIEF BY MS. NATALIA RODRIGUEZ,MS. NATALIA RODRIGUEZ,natalia rodriguez
02-172-18,"Yes, it is.",02-172-20,172,20,18,speaker_start,EXAMINATION IN-CHIEF BY MS. NATALIA RODRIGUEZ,COUNCILLOR CATHERINE McKENNEY,councillor catherine mckenney
02-172-19,And this person describes horns as early as 7:00 a.m. and at times going past 1:00 a.m. Does that accord with your experience as well?,02-172-21,172,21,19,speaker_start,EXAMINATION IN-CHIEF BY MS. NATALIA RODRIGUEZ,MS. NATALIA RODRIGUEZ,natalia rodriguez
02-172-22,"Yes, it does.",02-172-24,172,24,22,speaker_start,EXAMINATION IN-CHIEF BY MS. NATALIA RODRIGUEZ,COUNCILLOR CATHERINE McKENNEY,councillor catherine mckenney
02-172-23,"And if we look at the fourth paragraph, this person says: ""Besides all of this, I have anxiety, constantly being on edge, not knowing how long I will have just a little peace and quiet, or if I will be able to safely get groceries. It's taking its toll on me. My jaw hurts from clenching non-stop, my heart constantly races, I have been sleeping on average of three to four hours a night, I can't stop shaking, I'm barely eating and my stomach ache is constantly upset. My anxiety is well-controlled in normal times, but prescribed medication and coping mechanisms can only do so much when the threat is real and constant."" (As read) How would you say this resident's description of the impacts compares to the overall tone of communications that you were having with residents?",02-172-25,172,25,23,speaker_start,EXAMINATION IN-CHIEF BY MS. NATALIA RODRIGUEZ,MS. NATALIA RODRIGUEZ,natalia rodriguez
02-173-16,"This is one of hundreds of emails that I received with this very, very similar description of what was happening for people who lived in the residential area, in Centre Town. By this time, anybody who could leave was leaving. I had parents calling me from out of town trying to get their adult children out of that area. So this was the beginning when people in Centre Town, if they could leave they were, and people being -- people who were left behind, for the most part, relayed this type of experience to me for three-and-a-half weeks, and they had nowhere else to go.",02-173-18,173,18,16,speaker_start,EXAMINATION IN-CHIEF BY MS. NATALIA RODRIGUEZ,COUNCILLOR CATHERINE McKENNEY,councillor catherine mckenney
02-173-26,"And we're just going to look at the video that the constituents sent to you. It's at OTT, three zeroes, 14416. [VIDEO PLAYBACK] [END VIDEO PLAYBACK]",02-173-28,173,28,26,speaker_start,EXAMINATION IN-CHIEF BY MS. NATALIA RODRIGUEZ,MS. NATALIA RODRIGUEZ,natalia rodriguez
02-174-03,"And Councillor Fleury, did you receive similar emails regarding impacts from your constituents?",02-174-05,174,5,3,speaker_start,EXAMINATION IN-CHIEF BY MS. NATALIA RODRIGUEZ,MS. NATALIA RODRIGUEZ,natalia rodriguez
