interjection_id,text_clean_combined,line_id,page,line,transcript_line_number,line_type,section_header,speaker,speaker_standardized
20-175-23,Yes.,20-175-25,175,25,23,speaker_start,CROSS-EXAMINATION BY MR. BRENDAN van NIEJENHUIS,ADM IAN FREEMAN,adm. ian freeman
20-175-24,"And that connects Highway 401 to the port of entry, and the 401 is OPP and MTO jurisdiction; right?",20-175-26,175,26,24,speaker_start,CROSS-EXAMINATION BY MR. BRENDAN van NIEJENHUIS,MR. BRENDAN van NIEJENHUIS,brendan van niejenhuis
20-175-27,Yes.,20-175-29,175,29,27,speaker_start,CROSS-EXAMINATION BY MR. BRENDAN van NIEJENHUIS,ADM IAN FREEMAN,adm. ian freeman
20-175-28,"And similarly, just while we’re at this, Wellington Street and the streets of downtown Ottawa under occupation by the Freedom Convoy, likewise, were under the jurisdiction of the Ottawa Police Service, or alternatively, the Ontario Provincial Police and within the authority of MTO from a transport regulation perspective; fair?",20-175-30,175,30,28,speaker_start,CROSS-EXAMINATION BY MR. BRENDAN van NIEJENHUIS,MR. BRENDAN van NIEJENHUIS,brendan van niejenhuis
20-176-07,Yes.,20-176-09,176,9,7,speaker_start,CROSS-EXAMINATION BY MR. BRENDAN van NIEJENHUIS,ADM IAN FREEMAN,adm. ian freeman
20-176-08,"Now, on February 11th, Premier Ford declared a State of Emergency and invoked the Ontario Emergency Management and Civil Protection Act?",20-176-10,176,10,8,speaker_start,CROSS-EXAMINATION BY MR. BRENDAN van NIEJENHUIS,MR. BRENDAN van NIEJENHUIS,brendan van niejenhuis
20-176-11,Yes.,20-176-13,176,13,11,speaker_start,CROSS-EXAMINATION BY MR. BRENDAN van NIEJENHUIS,ADM IAN FREEMAN,adm. ian freeman
20-176-12,"And that was followed by regulations that actually implemented the measures, which did not happen until the 12th; correct?",20-176-14,176,14,12,speaker_start,CROSS-EXAMINATION BY MR. BRENDAN van NIEJENHUIS,MR. BRENDAN van NIEJENHUIS,brendan van niejenhuis
20-176-15,Yes.,20-176-17,176,17,15,speaker_start,CROSS-EXAMINATION BY MR. BRENDAN van NIEJENHUIS,ADM IAN FREEMAN,adm. ian freeman
20-176-16,And that was the Saturday of the third weekend of the convoy events?,20-176-18,176,18,16,speaker_start,CROSS-EXAMINATION BY MR. BRENDAN van NIEJENHUIS,MR. BRENDAN van NIEJENHUIS,brendan van niejenhuis
20-176-18,Yes.,20-176-20,176,20,18,speaker_start,CROSS-EXAMINATION BY MR. BRENDAN van NIEJENHUIS,ADM IAN FREEMAN,adm. ian freeman
20-176-19,You’ll agree with me that critical infrastructure defined in those regulations included 400 series highways?,20-176-21,176,21,19,speaker_start,CROSS-EXAMINATION BY MR. BRENDAN van NIEJENHUIS,MR. BRENDAN van NIEJENHUIS,brendan van niejenhuis
20-176-22,Yes.,20-176-24,176,24,22,speaker_start,CROSS-EXAMINATION BY MR. BRENDAN van NIEJENHUIS,ADM IAN FREEMAN,adm. ian freeman
20-176-23,It did not include municipal roads; right?,20-176-25,176,25,23,speaker_start,CROSS-EXAMINATION BY MR. BRENDAN van NIEJENHUIS,MR. BRENDAN van NIEJENHUIS,brendan van niejenhuis
20-176-25,"Well it did -- it did, in that -- and we went through this. We’d have to bring it up so I could describe, but it does include municipal roads. And those powers were deployed in the City of Ottawa, if that’s where you’re going.",20-176-27,176,27,25,speaker_start,CROSS-EXAMINATION BY MR. BRENDAN van NIEJENHUIS,ADM IAN FREEMAN,adm. ian freeman
20-177-02,Okay. Yeah. In terms of the power to order to leave or order to depart; right?,20-177-04,177,4,2,speaker_start,CROSS-EXAMINATION BY MR. BRENDAN van NIEJENHUIS,MR. BRENDAN van NIEJENHUIS,brendan van niejenhuis
20-177-04,"All provisions, including CVOR powers that were talked about previously.",20-177-06,177,6,4,speaker_start,CROSS-EXAMINATION BY MR. BRENDAN van NIEJENHUIS,ADM IAN FREEMAN,adm. ian freeman
20-177-06,"Okay. You’re aware that on February the 14th, at approximately 4:30 p.m., the Prime Minister announced the invocation of the Emergencies Act; right?",20-177-08,177,8,6,speaker_start,CROSS-EXAMINATION BY MR. BRENDAN van NIEJENHUIS,MR. BRENDAN van NIEJENHUIS,brendan van niejenhuis
20-177-09,Yes.,20-177-11,177,11,9,speaker_start,CROSS-EXAMINATION BY MR. BRENDAN van NIEJENHUIS,ADM IAN FREEMAN,adm. ian freeman
20-177-10,"And you’re aware that the Premier of Ontario, that morning, had expressed his support for the Emergencies Act being invoked during the First Minister’s meeting; yes?",20-177-12,177,12,10,speaker_start,CROSS-EXAMINATION BY MR. BRENDAN van NIEJENHUIS,MR. BRENDAN van NIEJENHUIS,brendan van niejenhuis
20-177-14,"I don’t recall that specifically, but.",20-177-16,177,16,14,speaker_start,CROSS-EXAMINATION BY MR. BRENDAN van NIEJENHUIS,ADM IAN FREEMAN,adm. ian freeman
20-177-16,"Are you aware that the Premier of Ontario has recently reaffirmed his support, saying that he stood shoulder to shoulder with the Prime Minister in making that decision?",20-177-18,177,18,16,speaker_start,CROSS-EXAMINATION BY MR. BRENDAN van NIEJENHUIS,MR. BRENDAN van NIEJENHUIS,brendan van niejenhuis
20-177-20,I did see that in the media.,20-177-22,177,22,20,speaker_start,CROSS-EXAMINATION BY MR. BRENDAN van NIEJENHUIS,ADM IAN FREEMAN,adm. ian freeman
20-177-21,"Okay. And if we could just go back very briefly to ONT.IR.0000001? Actually, I’m sorry, we can just skip that. Can we go back to ONT00000179? And this is my last point, Mr. Commissioner. I apologize. If we could just go to page 2, please? The top of the page? And if you want to look at the header, this is an email which refers to the 10 tow trucks you indicated were sourced for Ottawa when you corrected your witness statement at the beginning of your examination today; correct?",20-177-23,177,23,21,speaker_start,CROSS-EXAMINATION BY MR. BRENDAN van NIEJENHUIS,MR. BRENDAN van NIEJENHUIS,brendan van niejenhuis
20-178-05,Yes.,20-178-07,178,7,5,speaker_start,CROSS-EXAMINATION BY MR. BRENDAN van NIEJENHUIS,ADM IAN FREEMAN,adm. ian freeman
20-178-06,"And you’ll see, if you go down to page 3 in the bullet points, which is an email from earlier on the same day, February 16, there’s a third bullet point there that says: “Important: All three towing companies have requested [a] letter that the province […] will cover costs […] indemnity from [other] damage [and] claims [for] vehicles that are towed…” And so forth; right?",20-178-08,178,8,6,speaker_start,CROSS-EXAMINATION BY MR. BRENDAN van NIEJENHUIS,MR. BRENDAN van NIEJENHUIS,brendan van niejenhuis
20-178-16,Yes.,20-178-18,178,18,16,speaker_start,CROSS-EXAMINATION BY MR. BRENDAN van NIEJENHUIS,ADM IAN FREEMAN,adm. ian freeman
20-178-17,And it says that’s because: “…their insurance companies […] specifically told them that they will not cover [those] risks.” Right?,20-178-19,178,19,17,speaker_start,CROSS-EXAMINATION BY MR. BRENDAN van NIEJENHUIS,MR. BRENDAN van NIEJENHUIS,brendan van niejenhuis
20-178-23,"And if we go then, finally, back to the top of page 2, this is the evening of February the 16th. It indicates that one of the three towing companies has in fact dropped out, which is what gets you to the number 10, instead of 13 that you thought you had earlier that day; right?",20-178-25,178,25,23,speaker_start,CROSS-EXAMINATION BY MR. BRENDAN van NIEJENHUIS,ADM IAN FREEMAN,adm. ian freeman
20-178-28,Yes.,20-178-30,178,30,28,speaker_start,CROSS-EXAMINATION BY MR. BRENDAN van NIEJENHUIS,ADM IAN FREEMAN,adm. ian freeman
20-179-01,"And then, by now you know about the EA. The first bullet says: “Need [a] letter from the OPP requesting these two companies to provides services and stating that the Federal Act [that’s the Emergencies Act] will cover any damage […] and [indemnity]…” Correct?",20-179-03,179,3,1,speaker_start,CROSS-EXAMINATION BY MR. BRENDAN van NIEJENHUIS,MR. BRENDAN van NIEJENHUIS,brendan van niejenhuis
20-179-09,Yeah.,20-179-11,179,11,9,speaker_start,CROSS-EXAMINATION BY MR. BRENDAN van NIEJENHUIS,ADM IAN FREEMAN,adm. ian freeman
20-179-10,"And if we go to the very, very top, you’ll see that Jasan Boparai’s reporting that he’s told them, being the towing operators, that: “…[this] letter will come tomorrow. [And that] [t]hey [are] moving tonight based upon [him] and Steve’s commitment [and] credibility.” In the absence of that letter; correct?",20-179-12,179,12,10,speaker_start,CROSS-EXAMINATION BY MR. BRENDAN van NIEJENHUIS,MR. BRENDAN van NIEJENHUIS,brendan van niejenhuis
20-179-18,Yes.,20-179-20,179,20,18,speaker_start,CROSS-EXAMINATION BY MR. BRENDAN van NIEJENHUIS,ADM IAN FREEMAN,adm. ian freeman
20-179-19,"And we’ve been through that letter with Commissioner Carrique. Thank you, sir. Those are my questions. Thank you for your indulgence, Mr. Commissioner.",20-179-21,179,21,19,speaker_start,CROSS-EXAMINATION BY MR. BRENDAN van NIEJENHUIS,MR. BRENDAN van NIEJENHUIS,brendan van niejenhuis
20-179-23,Okay. Thank you. Next is the City of Windsor.,20-179-25,179,25,23,speaker_start,CROSS-EXAMINATION BY MR. BRENDAN van NIEJENHUIS,COMMISSIONER ROULEAU,commissioner rouleau
20-179-25,--- CROSS-EXAMINATION BY MS. JENNIFER KING:,20-179-27,179,27,25,section_header,CROSS-EXAMINATION BY MS. JENNIFER KING,NA,NA
20-179-26,"Good evening, Mr. Freeman. My name is Jennifer King. I’m legal counsel to the City of Windsor.",20-179-28,179,28,26,speaker_start,CROSS-EXAMINATION BY MS. JENNIFER KING,MS. JENNIFER KING,jennifer king
20-180-01,Hi.,20-180-03,180,3,1,speaker_start,CROSS-EXAMINATION BY MS. JENNIFER KING,ADM IAN FREEMAN,adm. ian freeman
20-180-02,"In your witness summary, and you’ve mentioned in your testimony, you state that you’re aware that MTO assisted the OPP in identifying contractor to place concrete barriers in Windsor?",20-180-04,180,4,2,speaker_start,CROSS-EXAMINATION BY MS. JENNIFER KING,MS. JENNIFER KING,jennifer king
20-180-06,Yes.,20-180-08,180,8,6,speaker_start,CROSS-EXAMINATION BY MS. JENNIFER KING,ADM IAN FREEMAN,adm. ian freeman
20-180-07,And this was at the direction of the OPP?,20-180-09,180,9,7,speaker_start,CROSS-EXAMINATION BY MS. JENNIFER KING,MS. JENNIFER KING,jennifer king
20-180-09,Yes.,20-180-11,180,11,9,speaker_start,CROSS-EXAMINATION BY MS. JENNIFER KING,ADM IAN FREEMAN,adm. ian freeman
20-180-10,I take it that you understand that this was to better manage future risk of vehicles being used for blockades and disruption of cross border movement of people and goods?,20-180-12,180,12,10,speaker_start,CROSS-EXAMINATION BY MS. JENNIFER KING,MS. JENNIFER KING,jennifer king
20-180-14,Yes.,20-180-16,180,16,14,speaker_start,CROSS-EXAMINATION BY MS. JENNIFER KING,ADM IAN FREEMAN,adm. ian freeman
20-180-15,Are you aware that there was confusion at MTO at the time as to who would pay for these barriers?,20-180-17,180,17,15,speaker_start,CROSS-EXAMINATION BY MS. JENNIFER KING,MS. JENNIFER KING,jennifer king
20-180-18,I’ve subsequently read in the documents that there was questions as to how it would be funded.,20-180-20,180,20,18,speaker_start,CROSS-EXAMINATION BY MS. JENNIFER KING,ADM IAN FREEMAN,adm. ian freeman
20-180-20,"Okay. So I’ll show you some documents. If you could please pull up, Mr. Clerk, ONT00000182? While this is coming up, Mr. Freeman, this is an email dated February 15th between Jasan Boparai of MTO and Supt. Dana Earley of the OPP. And Commissioners heard this week that Supt. Earley shared joint command of the police response to the blockade with Supt. Crowley of the Windsor Police. And you’ll see, if you could scroll down just a little bit, the first bullet, you’ll see that it says: “Upon request by the OPP, MTO has supplied Temporary Concrete Barriers […] through [a contractor].” And if you go to the sub-bullets, and you can see here, part way down: “Since these TCBs are being installed along a municipal roadway, MTO has requested the OPP to advise how compensation to the contractor can be arranged.” Next bullet states: “Preliminary thought from the OPP is that compensation would be through federal funds available to support the emergency response to re-open the Windsor-Detroit crossing.” Do you see that?",20-180-22,180,22,20,speaker_start,CROSS-EXAMINATION BY MS. JENNIFER KING,MS. JENNIFER KING,jennifer king
20-181-20,Yes.,20-181-22,181,22,20,speaker_start,CROSS-EXAMINATION BY MS. JENNIFER KING,ADM IAN FREEMAN,adm. ian freeman
20-181-21,Were you aware of that at the time?,20-181-23,181,23,21,speaker_start,CROSS-EXAMINATION BY MS. JENNIFER KING,MS. JENNIFER KING,jennifer king
20-181-23,"No, I didn’t have any involvement in this at the time.",20-181-25,181,25,23,speaker_start,CROSS-EXAMINATION BY MS. JENNIFER KING,ADM IAN FREEMAN,adm. ian freeman
20-181-25,Okay. And if you could just scroll up a bit? You’ll see that the estimate for the work is $1.3 million?,20-181-27,181,27,25,speaker_start,CROSS-EXAMINATION BY MS. JENNIFER KING,MS. JENNIFER KING,jennifer king
20-181-28,Yes.,20-181-30,181,30,28,speaker_start,CROSS-EXAMINATION BY MS. JENNIFER KING,ADM IAN FREEMAN,adm. ian freeman
20-182-01,"Okay. If you could please turn up ONT00000438? This is an internal email exchange at MTO dated February 16th, Mr. Freeman. And it’s involving Doug Jones. And by February 16th, he is Deputy Minister?",20-182-03,182,3,1,speaker_start,CROSS-EXAMINATION BY MS. JENNIFER KING,MS. JENNIFER KING,jennifer king
20-182-06,Yes. Likely his first week on the job.,20-182-08,182,8,6,speaker_start,CROSS-EXAMINATION BY MS. JENNIFER KING,ADM IAN FREEMAN,adm. ian freeman
20-182-08,"Okay. If we could scroll to page 3, please. Further down a bit, please. There you go. Thank you. So on February 16th, Doug Jones is writing to Stefano Oliviero. Who is that?",20-182-10,182,10,8,speaker_start,CROSS-EXAMINATION BY MS. JENNIFER KING,MS. JENNIFER KING,jennifer king
20-182-14,That would be an advisor in his office.,20-182-16,182,16,14,speaker_start,CROSS-EXAMINATION BY MS. JENNIFER KING,ADM IAN FREEMAN,adm. ian freeman
20-182-16,"Okay. And you’ll see that Doug Jones is talking about a conversation that he has with the CAO of Windsor. That’s Jason Raynar. And he talks about, again, this issue of costs of the concrete jersey barriers and a concern that has been raised by Jason Raynar about how much the city would be responsible to cover. And it’s not clear to me based on the -- because this is black and white -- who made the statement, but someone at MTO was under the impression that the total cost for the installation, removal and rental of the jersey barriers would be covered 100 percent by MTO. Do you see that?",20-182-18,182,18,16,speaker_start,CROSS-EXAMINATION BY MS. JENNIFER KING,MS. JENNIFER KING,jennifer king
20-182-27,Yeah. I read this as him asking that question.,20-182-29,182,29,27,speaker_start,CROSS-EXAMINATION BY MS. JENNIFER KING,ADM IAN FREEMAN,adm. ian freeman
20-183-01,"Okay. And so I’ll take you to one more document here, WIN00002143. So this an email exchange between CAO Raynar to individuals, so you wouldn’t have seen it at the time. Thank you. And if you could scroll all the way to the bottom, Mr. Clerk. Okay. And you’ll see here that he’s reporting to individuals at Windsor on February the 17th: “Just a quick update that I had a good call with DM Doug Jones, MTO, who is helping to coordinate a planning table with MTO, Sol-Gen, OPP, WPS and Windsor to discuss the long-term needs to protect our international crossings. I’ll let you know once I hear more.” And he continues: “The Deputy also indicated that he understood but was confirming that costs like the jersey barriers that were authorized by MTO staff at OPP’s request would be paid for by the Province.” Do you see that? So if you can scroll up, Mr. Clerk. And you’ll see an email from Mr. Raynar to the same group the next day, and it states: “It would appear that the new Deputy Minister MTO is finding out just how the Province works. He stepped back from both items today that we discussed earlier in the week. MTO will not be covering the costs of the barriers, although he said he would not be surprised to see an application for the Province to assist with those costs and others(?) at some point. No commitment to pay, though, at this time. The argument is that we are the road authority and we approved the deployment of the barriers, so therefore, responsible for the costs.” Do you see that?",20-183-03,183,3,1,speaker_start,CROSS-EXAMINATION BY MS. JENNIFER KING,MS. JENNIFER KING,jennifer king
20-184-15,Yes.,20-184-17,184,17,15,speaker_start,CROSS-EXAMINATION BY MS. JENNIFER KING,ADM IAN FREEMAN,adm. ian freeman
20-184-16,"The Commission heard from the Mayor of Windsor that Windsor has requested the Province reimburse their costs, including the costs of these barriers, but has not received a response. Do you have any information as to whether or not the Province will be reimbursing Windsor’s costs?",20-184-18,184,18,16,speaker_start,CROSS-EXAMINATION BY MS. JENNIFER KING,MS. JENNIFER KING,jennifer king
20-184-22,I haven’t seen the request and I don’t have any information. I’m sorry.,20-184-24,184,24,22,speaker_start,CROSS-EXAMINATION BY MS. JENNIFER KING,ADM IAN FREEMAN,adm. ian freeman
20-184-24,"Okay. And if -- further down, in the next paragraph, Mr. Raynar writes: “In terms of the intergovernmental planning table proposal, there’s no interest at this time, given the ongoing situation in Ottawa.” I won’t take it to you, but the Commissioner heard on Monday from Mayor Dilkens, who testified that he sent a letter in March requesting that all levels of government sit down to discuss working together to protect important international border crossings. It’s my understanding that there’s been no response from the Province to this request. Are you aware of any response to Windsor’s request?",20-184-26,184,26,24,speaker_start,CROSS-EXAMINATION BY MS. JENNIFER KING,MS. JENNIFER KING,jennifer king
20-185-10,"I’m not. I haven’t seen the request, either, nor would I in my current position.",20-185-12,185,12,10,speaker_start,CROSS-EXAMINATION BY MS. JENNIFER KING,ADM IAN FREEMAN,adm. ian freeman
20-185-12,Okay. Do you know if the Ministry of Transportation is planning to meet with appropriate agencies at all levels of government to discuss protecting critical border crossings in Ontario such as the Ambassador Bridge?,20-185-14,185,14,12,speaker_start,CROSS-EXAMINATION BY MS. JENNIFER KING,MS. JENNIFER KING,jennifer king
20-185-17,"I’m not aware of what the Ministry intends in this regard. Again, in my current position as in corporate services, it’s not something that I would be aware of. I do know that the Province ultimately did pass further legislation and I can’t speak to who was consulted on that.",20-185-19,185,19,17,speaker_start,CROSS-EXAMINATION BY MS. JENNIFER KING,ADM IAN FREEMAN,adm. ian freeman
20-185-24,Okay. So you don’t know if the Municipality of Windsor was consulted on that legislation?,20-185-26,185,26,24,speaker_start,CROSS-EXAMINATION BY MS. JENNIFER KING,MS. JENNIFER KING,jennifer king
20-185-26,"I wasn’t involved in it, so I can’t say.",20-185-28,185,28,26,speaker_start,CROSS-EXAMINATION BY MS. JENNIFER KING,ADM IAN FREEMAN,adm. ian freeman
20-185-28,Okay. I only have a few questions left for you. Do you know if the Ministry has an emergency plan pursuant to the Ontario Emergency Management and Civil Protection Act?,20-185-30,185,30,28,speaker_start,CROSS-EXAMINATION BY MS. JENNIFER KING,MS. JENNIFER KING,jennifer king
20-186-05,"Yes, we do have a plan.",20-186-07,186,7,5,speaker_start,CROSS-EXAMINATION BY MS. JENNIFER KING,ADM IAN FREEMAN,adm. ian freeman
20-186-06,Which Assistant Deputy Minister at the Ministry of Transportation is responsible for that emergency plan?,20-186-08,186,8,6,speaker_start,CROSS-EXAMINATION BY MS. JENNIFER KING,MS. JENNIFER KING,jennifer king
20-186-09,I expect it would be Eric Deutsch.,20-186-11,186,11,9,speaker_start,CROSS-EXAMINATION BY MS. JENNIFER KING,ADM IAN FREEMAN,adm. ian freeman
20-186-11,Okay. And what’s his title?,20-186-13,186,13,11,speaker_start,CROSS-EXAMINATION BY MS. JENNIFER KING,MS. JENNIFER KING,jennifer king
20-186-12,He’s the Assistant Deputy Minister of our operations division.,20-186-14,186,14,12,speaker_start,CROSS-EXAMINATION BY MS. JENNIFER KING,ADM IAN FREEMAN,adm. ian freeman
20-186-14,Okay. Do you know if the Ministry’s emergency plan addresses threats to critical transportation infrastructure like the Ambassador Bridge?,20-186-16,186,16,14,speaker_start,CROSS-EXAMINATION BY MS. JENNIFER KING,MS. JENNIFER KING,jennifer king
20-186-17,"I don’t know the full scope of the plan, so I can’t answer whether it does or not.",20-186-19,186,19,17,speaker_start,CROSS-EXAMINATION BY MS. JENNIFER KING,ADM IAN FREEMAN,adm. ian freeman
20-186-19,Okay. Thank you very much. Those are my questions.,20-186-21,186,21,19,speaker_start,CROSS-EXAMINATION BY MS. JENNIFER KING,MS. JENNIFER KING,jennifer king
20-186-21,Thank you. Next is the City of Ottawa.,20-186-23,186,23,21,speaker_start,CROSS-EXAMINATION BY MS. JENNIFER KING,COMMISSIONER ROULEAU,commissioner rouleau
20-186-23,--- CROSS-EXAMINATION BY MS. ANNE TARDIF:,20-186-25,186,25,23,section_header,CROSS-EXAMINATION BY MS. ANNE TARDIF,NA,NA
20-186-24,Good evening. My name is Anne Tardif. I’m one of the lawyers representing the City of Ottawa.,20-186-26,186,26,24,speaker_start,CROSS-EXAMINATION BY MS. ANNE TARDIF,MS. ANNE TARDIF,anne tardif
20-186-26,Hello.,20-186-28,186,28,26,speaker_start,CROSS-EXAMINATION BY MS. ANNE TARDIF,ADM IAN FREEMAN,adm. ian freeman
20-186-27,So we’ve explained that the CVOR is the Commercial Vehicle Operators Registration; right?,20-186-29,186,29,27,speaker_start,CROSS-EXAMINATION BY MS. ANNE TARDIF,MS. ANNE TARDIF,anne tardif
20-187-01,Yes.,20-187-03,187,3,1,speaker_start,CROSS-EXAMINATION BY MS. ANNE TARDIF,ADM IAN FREEMAN,adm. ian freeman
20-187-02,And you need one to operate a commercial vehicle in Ontario.,20-187-04,187,4,2,speaker_start,CROSS-EXAMINATION BY MS. ANNE TARDIF,MS. ANNE TARDIF,anne tardif
20-187-04,Correct.,20-187-06,187,6,4,speaker_start,CROSS-EXAMINATION BY MS. ANNE TARDIF,MS. ANNE TARDIF,anne tardif
20-187-05,And the CVOR program monitors and evaluates the operators’ safety records.,20-187-07,187,7,5,speaker_start,CROSS-EXAMINATION BY MS. ANNE TARDIF,MS. ANNE TARDIF,anne tardif
20-187-07,Yes.,20-187-09,187,9,7,speaker_start,CROSS-EXAMINATION BY MS. ANNE TARDIF,ADM IAN FREEMAN,adm. ian freeman
20-187-08,"And the CVOR operator, the person who holds the registration, can be either a person or a corporation responsible for the operation of the vehicle.",20-187-10,187,10,8,speaker_start,CROSS-EXAMINATION BY MS. ANNE TARDIF,MS. ANNE TARDIF,anne tardif
20-187-11,Yes.,20-187-13,187,13,11,speaker_start,CROSS-EXAMINATION BY MS. ANNE TARDIF,ADM IAN FREEMAN,adm. ian freeman
20-187-12,Right. And I take it it only applies to certain categories of vehicles.,20-187-14,187,14,12,speaker_start,CROSS-EXAMINATION BY MS. ANNE TARDIF,MS. ANNE TARDIF,anne tardif
20-187-14,"Yes, over a certain weight, I believe.",20-187-16,187,16,14,speaker_start,CROSS-EXAMINATION BY MS. ANNE TARDIF,ADM IAN FREEMAN,adm. ian freeman
20-187-16,"I have a note here that it’s 4,500 kilograms gross weight. Does that make sense?",20-187-18,187,18,16,speaker_start,CROSS-EXAMINATION BY MS. ANNE TARDIF,MS. ANNE TARDIF,anne tardif
20-187-18,"That sounds right, yeah.",20-187-20,187,20,18,speaker_start,CROSS-EXAMINATION BY MS. ANNE TARDIF,ADM IAN FREEMAN,adm. ian freeman
20-187-19,Perfect. And we -- certainly we’ve seen in the documents and in your witness summary reference to sort of a demerit point system; right?,20-187-21,187,21,19,speaker_start,CROSS-EXAMINATION BY MS. ANNE TARDIF,MS. ANNE TARDIF,anne tardif
20-187-23,Yes.,20-187-25,187,25,23,speaker_start,CROSS-EXAMINATION BY MS. ANNE TARDIF,ADM IAN FREEMAN,adm. ian freeman
20-187-24,And I take it that CVOR tracks the operators’ collisions; right?,20-187-26,187,26,24,speaker_start,CROSS-EXAMINATION BY MS. ANNE TARDIF,MS. ANNE TARDIF,anne tardif
20-187-26,Yes.,20-187-28,187,28,26,speaker_start,CROSS-EXAMINATION BY MS. ANNE TARDIF,ADM IAN FREEMAN,adm. ian freeman
20-187-27,Infractions.,20-187-29,187,29,27,speaker_start,CROSS-EXAMINATION BY MS. ANNE TARDIF,MS. ANNE TARDIF,anne tardif
20-187-28,"Yes, convictions. Yeah.",20-187-30,187,30,28,speaker_start,CROSS-EXAMINATION BY MS. ANNE TARDIF,ADM IAN FREEMAN,adm. ian freeman
20-188-01,Convictions.,20-188-03,188,3,1,speaker_start,CROSS-EXAMINATION BY MS. ANNE TARDIF,MS. ANNE TARDIF,anne tardif
20-188-02,Yeah.,20-188-04,188,4,2,speaker_start,CROSS-EXAMINATION BY MS. ANNE TARDIF,ADM IAN FREEMAN,adm. ian freeman
20-188-03,And any findings on safety inspections.,20-188-05,188,5,3,speaker_start,CROSS-EXAMINATION BY MS. ANNE TARDIF,MS. ANNE TARDIF,anne tardif
20-188-05,That’s right.,20-188-07,188,7,5,speaker_start,CROSS-EXAMINATION BY MS. ANNE TARDIF,ADM IAN FREEMAN,adm. ian freeman
20-188-06,"And over time, they rack up points until you get to a state where they have so many points that the Ministry may issue notice of the intent to either suspend or revoke the CVOR.",20-188-08,188,8,6,speaker_start,CROSS-EXAMINATION BY MS. ANNE TARDIF,MS. ANNE TARDIF,anne tardif
20-188-10,Correct. The only thing -- maybe the only thing I would just add to that is that’s -- there’s other interventions before it gets to that point.,20-188-12,188,12,10,speaker_start,CROSS-EXAMINATION BY MS. ANNE TARDIF,ADM IAN FREEMAN,adm. ian freeman
20-188-13,That’s the end of the process.,20-188-15,188,15,13,speaker_start,CROSS-EXAMINATION BY MS. ANNE TARDIF,MS. ANNE TARDIF,anne tardif
20-188-14,Yes.,20-188-16,188,16,14,speaker_start,CROSS-EXAMINATION BY MS. ANNE TARDIF,ADM IAN FREEMAN,adm. ian freeman
20-188-15,"Right. And you’ve talked about the notice requirements, the due process and the appeal rights that are embedded within the suspension.",20-188-17,188,17,15,speaker_start,CROSS-EXAMINATION BY MS. ANNE TARDIF,MS. ANNE TARDIF,anne tardif
