interjection_id,text_clean_combined,line_id,page,line,transcript_line_number,line_type,section_header,speaker,speaker_standardized
28-172-10,"Okay. I want to just move to one other area. You mentioned in your testimony when you were being questioned by Commission Counsel, and I think this is the first that we’ve heard about this, that -- and I think you said it was on the 13th, this was when Commission Counsel took you to the email from Commissioner Lucki that, you know, that laid out sort of the current status of things. And you talked about a private conversation that you had with Commissioner Lucki where she told you about the situation in Coutts and shared her concerns. And I think you said that was a threshold moment for you. So and I appreciate that that would be a frightening set of circumstances to hear about. The timeline of events is that we have the IRG on the 13th in the afternoon and then the Cabinet meeting the evening of the 13th. And then on the morning of the 14th, the First Ministers Meeting, and then the Act is invoked. First of all, there’s no Cabinet meeting between the First Ministers Meeting and the invocation of the Act? Is that correct?",28-172-12,172,12,10,speaker_start,CROSS-EXAMINATION BY MS. CARA ZWIBEL,MS. CARA ZWIBEL,cara zwibel
28-173-02,That’s right.,28-173-04,173,4,2,speaker_start,CROSS-EXAMINATION BY MS. CARA ZWIBEL,MINISTER MARCO MENDICINO,minister marco mendicino
28-173-03,"Okay. The morning of the 14th, I think you would have learned that the Ambassador Bridge blockade had been cleared and that arrests had been made and that police had executed a safe operation in Coutts leading to arrests?",28-173-05,173,5,3,speaker_start,CROSS-EXAMINATION BY MS. CARA ZWIBEL,MS. CARA ZWIBEL,cara zwibel
28-173-08,"That was true, but I would add that there were reports of flare ups. There was an exchange between the Mayor and I. There were also public reports following that and some information that we had received in subsequent briefings about the threat of the blockade coming back to the Ambassador Bridge. I would point out that it was a recurring theme over those two weeks that progress was not linear, that it was very much a wack-a-mole kind of dynamic and the idea was not only to restore public safety, but to maintain it. And the objective of invoking the Emergencies Act was to maintain law and order to stop the wack-a-mole.",28-173-10,173,10,8,speaker_start,CROSS-EXAMINATION BY MS. CARA ZWIBEL,MINISTER MARCO MENDICINO,minister marco mendicino
28-173-20,"Understood. I know you said in your testimony to Commission Counsel that one of the concerns about Coutts was that it could lead to a chain reaction. But would you agree with me that that didn’t happen? When the arrests were made in Coutts, actually many of the other protestors decided to leave because they actually weren’t comfortable being associated with that level of violence? They had different goals, and once they learned that that’s what was going on, they decided to voluntarily leave?",28-173-22,173,22,20,speaker_start,CROSS-EXAMINATION BY MS. CARA ZWIBEL,MS. CARA ZWIBEL,cara zwibel
28-174-01,"I agree. And I was relieved. But I was also dealing with the best information available to me at the time and surveying the landscape and being mindful that there were reports of guns and firearms that were present at other locations and not knowing exactly how it was that the operation in Coutts was going to play out at that time, and bearing in mind the sensitivities, the fact that the situation was combustible, that the individuals that were involved in Coutts were prepared to go down with a fight that could lead to the loss of life, that if that had happened and that occurred, it still remains an open question in my mind as to whether or not it would have triggered other events across the country. And so that’s why I -- in my mind, it was very much -- it was a threshold moment.",28-174-03,174,3,1,speaker_start,CROSS-EXAMINATION BY MS. CARA ZWIBEL,MINISTER MARCO MENDICINO,minister marco mendicino
28-174-16,"Okay. I understand -- I think I understand what you’re saying. And I just -- I know I’m out of time. I just want to just clarify. I understand you’re saying if that had happened. But would you agree with me that the arrests happened in Coutts and that didn’t happen? What happened is that people decided to voluntarily leave Coutts and that situation, at least that particular location, was resolved for the time being?",28-174-18,174,18,16,speaker_start,CROSS-EXAMINATION BY MS. CARA ZWIBEL,MS. CARA ZWIBEL,cara zwibel
28-174-24,"I think you may be putting it a little optimistically. I know that after the Coutts takedown, that there were still engagements there. I do agree that things did start to dissipate and disengage in Coutts, but I also recall that people were still very much dug in in other parts of the country, including here in the Nation’s capital.",28-174-26,174,26,24,speaker_start,CROSS-EXAMINATION BY MS. CARA ZWIBEL,MINISTER MARCO MENDICINO,minister marco mendicino
28-175-03,"Thank you, Minister. Thank you, Commission.",28-175-05,175,5,3,speaker_start,CROSS-EXAMINATION BY MS. CARA ZWIBEL,MS. CARA ZWIBEL,cara zwibel
28-175-05,"Next I’ll call on the City of Windsor, please.",28-175-07,175,7,5,speaker_start,CROSS-EXAMINATION BY MS. CARA ZWIBEL,COMMISSIONER ROULEAU,commissioner rouleau
28-175-07,"Mr. Commissioner, if I could just ask if -- I don’t know if people still use the expression, the division bells are ringing?",28-175-09,175,9,7,speaker_start,CROSS-EXAMINATION BY MS. CARA ZWIBEL,MR. GORDON CAMERON,gordon cameron
28-175-10,"Oh, so we need a short break?",28-175-12,175,12,10,speaker_start,CROSS-EXAMINATION BY MS. CARA ZWIBEL,COMMISSIONER ROULEAU,commissioner rouleau
28-175-12,"Yes. And fortunately the timing won’t be precise, but it would be timely now to break if we want to do it in-between examiners, because it appears that otherwise it would be right in the middle of the next examination.",28-175-14,175,14,12,speaker_start,CROSS-EXAMINATION BY MS. CARA ZWIBEL,MR. GORDON CAMERON,gordon cameron
28-175-17,Okay. So we’ll take 10 minutes. Is that all that’s needed or is it longer?,28-175-19,175,19,17,speaker_start,CROSS-EXAMINATION BY MS. CARA ZWIBEL,COMMISSIONER ROULEAU,commissioner rouleau
28-175-19,"I think 10 minutes is all that’s needed. We’re just at the end of a question period, and so we’ll alert if it’ll be any longer than that.",28-175-21,175,21,19,speaker_start,CROSS-EXAMINATION BY MS. CARA ZWIBEL,MR. GORDON CAMERON,gordon cameron
28-175-22,"Okay. Well I’ll -- we’ll take a 10-minute break. If it needs to be more, please ---",28-175-24,175,24,22,speaker_start,CROSS-EXAMINATION BY MS. CARA ZWIBEL,COMMISSIONER ROULEAU,commissioner rouleau
28-175-24,"Thanks, Your Honour. Otherwise you’d have to watch me vote digitally.",28-175-26,175,26,24,speaker_start,CROSS-EXAMINATION BY MS. CARA ZWIBEL,MINISTER MARCO MENDICINO,minister marco mendicino
28-175-26,I’m not sure I’d be allowed to do that.,28-175-28,175,28,26,speaker_start,CROSS-EXAMINATION BY MS. CARA ZWIBEL,COMMISSIONER ROULEAU,commissioner rouleau
28-175-28,The Commission is in recess for 10 minutes. La Commission est levée pour 10 minutes.,28-175-30,175,30,28,speaker_start,CROSS-EXAMINATION BY MS. CARA ZWIBEL,THE REGISTRAR,the registrar
28-176-02,--- Upon recessing at 3:14 p.m.,28-176-03,176,3,2,time_marker,CROSS-EXAMINATION BY MS. CARA ZWIBEL,NA,NA
28-176-03,--- Upon resuming at 3:36 p.m.,28-176-04,176,4,3,time_marker,CROSS-EXAMINATION BY MS. CARA ZWIBEL,NA,NA
28-176-04,The Commission is reconvened. La Commission reprend.,28-176-05,176,5,4,speaker_start,CROSS-EXAMINATION BY MS. CARA ZWIBEL,THE REGISTRAR,the registrar
28-176-06,"Okay. So I guess that -- where we at? Oh, but that counts. I called you already. So the time ---",28-176-07,176,7,6,speaker_start,CROSS-EXAMINATION BY MS. CARA ZWIBEL,COMMISSIONER ROULEAU,commissioner rouleau
28-176-09,"Commissioner, Alyssa Tomkins for the City of Ottawa. I’m very sad because the witness in fact once taught me cross-examination for a week at intensive trial advocacy and I was desperately hoping to try an impeachment on him, but my areas of questioning have all been canvassed. So I’m going to cede my time to the City of Windsor. And I just wanted to let her know before she steps.",28-176-10,176,10,9,speaker_start,CROSS-EXAMINATION BY MS. CARA ZWIBEL,MS. ALYSSA TOMKINS,alyssa tomkins
28-176-16,I’m going to change my end time.,28-176-17,176,17,16,speaker_start,CROSS-EXAMINATION BY MS. CARA ZWIBEL,MS. JENNIFER KING,jennifer king
28-176-18,"Can I take a moment though to make a point? Tomorrow we have a very full day. We will have a presentation on the public input. We have three witnesses, three Ministers. You may have already received the allocation of time. The allocation of time is arguably brutal. I won’t have much flexibility given the amount of time. So I would strongly urge that counsel talk amongst themselves. If you want to have a longer period of cross-examination with some of the witnesses that are limited to five minutes, try to work out a deal a bit like this one to have a longer period, because I know five minutes is hard to make a point in five minutes. I understand that. But I mean, we’re bound by the time limits we have. So there’s a long list of five-minute people and some may be willing to coordinate or allow. So I mention it so that you have time to do it maybe at the break. Obviously totally up to you. I’ve had to allocate essentially everyone who asked, but the allocation is, I recognize, small. And I’m simply signalling that given tomorrow’s schedule, it’s going to be hard to be flexible. So thanks for giving me that opportunity, but I think it’s important. I’d like you to think about it. Again, it’s up to you, obviously, but my interest is that people who want to get at an important point with any one of the three witnesses have the time. Okay. with that, you have fresh time. We'll start from zero. Okay.",28-176-19,176,19,18,speaker_start,CROSS-EXAMINATION BY MS. CARA ZWIBEL,COMMISSIONER ROULEAU,commissioner rouleau
28-177-16,"Thank you, Commissioner.",28-177-17,177,17,16,speaker_start,CROSS-EXAMINATION BY MS. CARA ZWIBEL,MS. JENNIFER KING,jennifer king
28-177-17,--- CROSS-EXAMINATION BY MS. JENNIFER KING:,28-177-18,177,18,17,section_header,CROSS-EXAMINATION BY MS. JENNIFER KING,NA,NA
28-177-18,"Good afternoon, it's still afternoon, Minister. My name is Jennifer King. I am legal counsel to the City of Windsor.",28-177-19,177,19,18,speaker_start,CROSS-EXAMINATION BY MS. JENNIFER KING,MS. JENNIFER KING,jennifer king
28-177-21,Good afternoon.,28-177-22,177,22,21,speaker_start,CROSS-EXAMINATION BY MS. JENNIFER KING,MINISTER MARCO MENDICINO,minister marco mendicino
28-177-22,"Hi. So yesterday, Minister Blair testified about the responsibility of all three orders of government to communicate and cooperate in responding to an event like the protests earlier this year. Do you agree with him that that's important?",28-177-23,177,23,22,speaker_start,CROSS-EXAMINATION BY MS. JENNIFER KING,MS. JENNIFER KING,jennifer king
28-177-27,Yes.,28-177-28,177,28,27,speaker_start,CROSS-EXAMINATION BY MS. JENNIFER KING,MINISTER MARCO MENDICINO,minister marco mendicino
28-177-28,"Yes. Minister, you and your staff had excellent communication with the City of Windsor; right?",28-177-29,177,29,28,speaker_start,CROSS-EXAMINATION BY MS. JENNIFER KING,MS. JENNIFER KING,jennifer king
28-178-03,Yes.,28-178-05,178,5,3,speaker_start,CROSS-EXAMINATION BY MS. JENNIFER KING,MINISTER MARCO MENDICINO,minister marco mendicino
28-178-04,"Mayor Dilkens texted you immediately after first learning of the potential of the slow roll, the potential of blocking the bridge, when he learned that from the Chief of Police on February the 4th; right?",28-178-06,178,6,4,speaker_start,CROSS-EXAMINATION BY MS. JENNIFER KING,MS. JENNIFER KING,jennifer king
28-178-08,Yes.,28-178-10,178,10,8,speaker_start,CROSS-EXAMINATION BY MS. JENNIFER KING,MINISTER MARCO MENDICINO,minister marco mendicino
28-178-09,And he kept in regular contact with you throughout.,28-178-11,178,11,9,speaker_start,CROSS-EXAMINATION BY MS. JENNIFER KING,MS. JENNIFER KING,jennifer king
28-178-11,He did.,28-178-13,178,13,11,speaker_start,CROSS-EXAMINATION BY MS. JENNIFER KING,MINISTER MARCO MENDICINO,minister marco mendicino
28-178-12,"And are you aware that once the blockade commenced Mayor Dilkens' Chief of Staff was in contact with his counterparts at the Federal Government, including your Chief of Staff, Mike Jones?",28-178-14,178,14,12,speaker_start,CROSS-EXAMINATION BY MS. JENNIFER KING,MS. JENNIFER KING,jennifer king
28-178-16,Yes.,28-178-18,178,18,16,speaker_start,CROSS-EXAMINATION BY MS. JENNIFER KING,MINISTER MARCO MENDICINO,minister marco mendicino
28-178-17,"And for example, on February 8th he told Mike Jones that Windsor Police had put in a request through policing channels for policing resources; right?",28-178-19,178,19,17,speaker_start,CROSS-EXAMINATION BY MS. JENNIFER KING,MS. JENNIFER KING,jennifer king
28-178-20,That's right.,28-178-22,178,22,20,speaker_start,CROSS-EXAMINATION BY MS. JENNIFER KING,MINISTER MARCO MENDICINO,minister marco mendicino
28-178-21,And he specifically told your Chief of Staff that the Chief of Police had asked for Public Order personnel; right?,28-178-23,178,23,21,speaker_start,CROSS-EXAMINATION BY MS. JENNIFER KING,MS. JENNIFER KING,jennifer king
28-178-24,"I believe that's correct, yes.",28-178-26,178,26,24,speaker_start,CROSS-EXAMINATION BY MS. JENNIFER KING,MINISTER MARCO MENDICINO,minister marco mendicino
28-178-26,"So early on, you were aware that Windsor Police Services required resources, specifically Public Order resources?",28-178-28,178,28,26,speaker_start,CROSS-EXAMINATION BY MS. JENNIFER KING,MS. JENNIFER KING,jennifer king
28-179-01,"Yes, that's my recollection.",28-179-03,179,3,1,speaker_start,CROSS-EXAMINATION BY MS. JENNIFER KING,MINISTER MARCO MENDICINO,minister marco mendicino
28-179-03,"And in fact, you assisted in amplifying that message to Commissioner Lucki?",28-179-05,179,5,3,speaker_start,CROSS-EXAMINATION BY MS. JENNIFER KING,MS. JENNIFER KING,jennifer king
28-179-05,I did.,28-179-07,179,7,5,speaker_start,CROSS-EXAMINATION BY MS. JENNIFER KING,MINISTER MARCO MENDICINO,minister marco mendicino
28-179-06,"So Windsor provided you and your ministry with important and timely updates throughout, before, during and after the blockades?",28-179-08,179,8,6,speaker_start,CROSS-EXAMINATION BY MS. JENNIFER KING,MS. JENNIFER KING,jennifer king
28-179-09,Yes.,28-179-11,179,11,9,speaker_start,CROSS-EXAMINATION BY MS. JENNIFER KING,MINISTER MARCO MENDICINO,minister marco mendicino
28-179-10,And you used this information from Windsor in your work at the federal level to respond to the blockades?,28-179-12,179,12,10,speaker_start,CROSS-EXAMINATION BY MS. JENNIFER KING,MS. JENNIFER KING,jennifer king
28-179-13,Yes.,28-179-15,179,15,13,speaker_start,CROSS-EXAMINATION BY MS. JENNIFER KING,MINISTER MARCO MENDICINO,minister marco mendicino
28-179-14,Did the protests this year then reinforce your view of the value of the importance of two-way communication and collaboration between the Federal Government and border municipalities with respect to the protection of border infrastructure?,28-179-16,179,16,14,speaker_start,CROSS-EXAMINATION BY MS. JENNIFER KING,MS. JENNIFER KING,jennifer king
28-179-19,"It really did, and especially because of the many unique aspects of this particular public order event.",28-179-21,179,21,19,speaker_start,CROSS-EXAMINATION BY MS. JENNIFER KING,MINISTER MARCO MENDICINO,minister marco mendicino
28-179-22,Minister Blair yesterday told us that the police operation in Windsor was a success. Do you agree?,28-179-24,179,24,22,speaker_start,CROSS-EXAMINATION BY MS. JENNIFER KING,MS. JENNIFER KING,jennifer king
28-179-25,"I think on the whole, yes.",28-179-27,179,27,25,speaker_start,CROSS-EXAMINATION BY MS. JENNIFER KING,MINISTER MARCO MENDICINO,minister marco mendicino
28-179-27,Okay. Windsor Police required an influx of policing resources that we just talked about and hard assets to respond to the event?,28-179-29,179,29,27,speaker_start,CROSS-EXAMINATION BY MS. JENNIFER KING,MS. JENNIFER KING,jennifer king
28-180-02,Yes.,28-180-04,180,4,2,speaker_start,CROSS-EXAMINATION BY MS. JENNIFER KING,MINISTER MARCO MENDICINO,minister marco mendicino
28-180-03,"Last week, we heard evidence from Deputy Minister Keenan, and Mr. Ossowski, the former President of the CBSA, regarding federal authority over the bridge. Were you able to listen to that testimony?",28-180-05,180,5,3,speaker_start,CROSS-EXAMINATION BY MS. JENNIFER KING,MS. JENNIFER KING,jennifer king
28-180-07,"I'm afraid I was not, sorry.",28-180-09,180,9,7,speaker_start,CROSS-EXAMINATION BY MS. JENNIFER KING,MINISTER MARCO MENDICINO,minister marco mendicino
28-180-09,"Okay. Well, we or I reviewed a CBSA document with Mr. Ossowski, and he confirmed that CBSA officers are not designated to enforce criminal arrest provisions and cannot directly engage in enforcement operations at prohibited public assemblies, even if they're on the bridge. You agree with him?",28-180-11,180,11,9,speaker_start,CROSS-EXAMINATION BY MS. JENNIFER KING,MS. JENNIFER KING,jennifer king
28-180-15,"Well, there were definitely gaps, and there are very specific mandated powers that are afforded to CBSA officers for the purposes of administering other statutes, for example, customs and the like. But one of the main -- there were two main concerns in addition to the one that you mentioned that he raised with me and with other Cabinet colleagues that was preventing foreign nationals where there were grounds to believe that they may support the blockade or the occupation; and secondly, the lack of authority to clear the roads leading to the bridge, which I think is very much in relationship to the point that you made.",28-180-17,180,17,15,speaker_start,CROSS-EXAMINATION BY MS. JENNIFER KING,MINISTER MARCO MENDICINO,minister marco mendicino
28-180-26,"Well, they didn't have that authority even on the bridge, did they?",28-180-28,180,28,26,speaker_start,CROSS-EXAMINATION BY MS. JENNIFER KING,MS. JENNIFER KING,jennifer king
28-180-28,"There are limitations as to how far they can go, and certainly if there are criminal charges or if there is criminal conduct that is occurring on the bridge itself they would have peace officer authorities to facilitate restoring control, that's one of the reasons why CBSA officers were ultimately granted the right to hold firearms, but ultimately they would pass those investigations onto local police of jurisdiction.",28-180-30,180,30,28,speaker_start,CROSS-EXAMINATION BY MS. JENNIFER KING,MINISTER MARCO MENDICINO,minister marco mendicino
28-181-08,"Right. So Mr. Ossowski told us that for any protest activity, even if it was occurring on the Ambassador Bridge or in the Plaza, the CBSA would rely on the police of jurisdiction.",28-181-10,181,10,8,speaker_start,CROSS-EXAMINATION BY MS. JENNIFER KING,MS. JENNIFER KING,jennifer king
28-181-12,"There were limitations to the authorities, yes.",28-181-14,181,14,12,speaker_start,CROSS-EXAMINATION BY MS. JENNIFER KING,MINISTER MARCO MENDICINO,minister marco mendicino
28-181-14,Right. And so it would be Windsor Police that would respond?,28-181-16,181,16,14,speaker_start,CROSS-EXAMINATION BY MS. JENNIFER KING,MS. JENNIFER KING,jennifer king
28-181-16,"It depends on which side of the bridge. So if it was on the Canadian side, then yes, then I would assume that he would have reported those to the Windsor Police.",28-181-18,181,18,16,speaker_start,CROSS-EXAMINATION BY MS. JENNIFER KING,MINISTER MARCO MENDICINO,minister marco mendicino
28-181-20,"Right. And Mr. Ossowski confirmed that even after the Emergencies Act was invoked the new Emergencies Act didn't change these authorities, and in fact, CBSA officers were directed not to directly engage in enforcement operations at prohibited public assemblies, whether on or off the bridge. Were you aware of that?",28-181-22,181,22,20,speaker_start,CROSS-EXAMINATION BY MS. JENNIFER KING,MS. JENNIFER KING,jennifer king
28-181-26,"That sounds generally consistent with my recollection, although there were other powers that we did afford under the Emergencies Act that were responsive to the gaps that John Ossowski, as the then President of the CBSA, had identified.",28-181-28,181,28,26,speaker_start,CROSS-EXAMINATION BY MS. JENNIFER KING,MINISTER MARCO MENDICINO,minister marco mendicino
28-182-03,Okay. So there is significant reliance on Windsor's police force to protect this piece of national infrastructure; right?,28-182-05,182,5,3,speaker_start,CROSS-EXAMINATION BY MS. JENNIFER KING,MS. JENNIFER KING,jennifer king
28-182-06,Yes.,28-182-08,182,8,6,speaker_start,CROSS-EXAMINATION BY MS. JENNIFER KING,MINISTER MARCO MENDICINO,minister marco mendicino
28-182-07,"And therefore, there's a significant reliance on Windsor and its taxpayers to protect this border crossing since they're ultimately responsible to fund Windsor's police force?",28-182-09,182,9,7,speaker_start,CROSS-EXAMINATION BY MS. JENNIFER KING,MS. JENNIFER KING,jennifer king
28-182-11,"No question about it. And Huron Church Road, which begins where the 401 ends as you're driving west into town, takes you right to the entry to the port of entry that then crosses into Detroit. So yes, the people of Windsor are very much, and the City administration, the Police Service very much share the responsibility of maintaining public safety.",28-182-13,182,13,11,speaker_start,CROSS-EXAMINATION BY MS. JENNIFER KING,MINISTER MARCO MENDICINO,minister marco mendicino
28-182-18,Okay. So would you agree with me that the issue of what respective authorities are available to the police of jurisdiction and to federal authorities at a port of entry should be understood and planned in advance so as to avoid any confusion over jurisdiction and roles during an event like this?,28-182-20,182,20,18,speaker_start,CROSS-EXAMINATION BY MS. JENNIFER KING,MS. JENNIFER KING,jennifer king
28-182-24,"I think that's a fair statement, and indeed, during the course of my conversations with Mayor Dilkens at the time, I did foreshadow that we may have to consider how it is that we maintain jurisdiction in the roads leading into the borders, certainly immediately adjacent to, so that the Federal Government could properly play a role in maintaining those critical supply chains that were compromised and ultimately blocked for extended periods of time, not only in Windsor but across the country. So yes, I do think that that is a -- an issue that merits conversation.",28-182-26,182,26,24,speaker_start,CROSS-EXAMINATION BY MS. JENNIFER KING,MINISTER MARCO MENDICINO,minister marco mendicino
28-183-06,And this planning should include who's responsible for those resources; right?,28-183-08,183,8,6,speaker_start,CROSS-EXAMINATION BY MS. JENNIFER KING,MS. JENNIFER KING,jennifer king
28-183-08,"I think that it goes hand in glove. I think that if you are going to talk about expanding the jurisdiction of the CBA to, let's say, roads which are otherwise provincial highways, that that is a conversation that has to occur with other levels of government, municipal authorities, and then if you're going to make any recalibration there, you're going to have to make sure that CBSA have the resources to enforce as well, or at a minimum engage in some kind of an understanding or an agreement with different levels of government and enforcement to make sure that we can protect our critical infrastructure, including our borders.",28-183-10,183,10,8,speaker_start,CROSS-EXAMINATION BY MS. JENNIFER KING,MINISTER MARCO MENDICINO,minister marco mendicino
28-183-19,And you'd agree that that plan should also include plans to protect the community that is around that critical infrastructure?,28-183-21,183,21,19,speaker_start,CROSS-EXAMINATION BY MS. JENNIFER KING,MS. JENNIFER KING,jennifer king
28-183-22,Yes.,28-183-24,183,24,22,speaker_start,CROSS-EXAMINATION BY MS. JENNIFER KING,MINISTER MARCO MENDICINO,minister marco mendicino
28-183-23,"So I'll have a couple more questions about planning, but I -- as a bit of an aside, in Windsor, RCMP are not the police of jurisdiction; right?",28-183-25,183,25,23,speaker_start,CROSS-EXAMINATION BY MS. JENNIFER KING,MS. JENNIFER KING,jennifer king
28-183-26,That's correct.,28-183-28,183,28,26,speaker_start,CROSS-EXAMINATION BY MS. JENNIFER KING,MINISTER MARCO MENDICINO,minister marco mendicino
28-183-27,"We heard from Commissioner Lucki last week that the RCMP ""O"" Division has a detachment in Windsor. Are you aware of that?",28-183-29,183,29,27,speaker_start,CROSS-EXAMINATION BY MS. JENNIFER KING,MS. JENNIFER KING,jennifer king
28-184-02,Yes.,28-184-04,184,4,2,speaker_start,CROSS-EXAMINATION BY MS. JENNIFER KING,MINISTER MARCO MENDICINO,minister marco mendicino
28-184-03,"She wasn't sure how many officers are there in Windsor. Minister Mendicino, do you know how many RCMP officers are in Windsor?",28-184-05,184,5,3,speaker_start,CROSS-EXAMINATION BY MS. JENNIFER KING,MS. JENNIFER KING,jennifer king
28-184-06,"I know that -- my best recollection is, is that we deployed approximately 75, I believe, or 100 RCMP officers, that's my recollection. Off the top of my head, I don't know how many are permanently stationed there at ""O"".",28-184-08,184,8,6,speaker_start,CROSS-EXAMINATION BY MS. JENNIFER KING,MINISTER MARCO MENDICINO,minister marco mendicino
