interjection_id,text_clean_combined,line_id,page,line,transcript_line_number,line_type,section_header,speaker,speaker_standardized
19-146-18,--- STATEMENT BY MS. LANI ROUILLARD:,19-146-19,146,19,18,section_header,STATEMENT BY MS. LANI ROUILLARD,NA,NA
19-146-19,"Hi, there. My name is -- oh.",19-146-20,146,20,19,speaker_start,STATEMENT BY MS. LANI ROUILLARD,MS. LANI ROUILLARD,lani rouillard
19-146-21,Go ahead.,19-146-22,146,22,21,speaker_start,STATEMENT BY MS. LANI ROUILLARD,COMMISSIONER ROULEAU,commissioner rouleau
19-146-22,My name is Lani Rouillard and I appear for Paul Leschied. And I'd just like to confirm prior to the proceeding with the witness that the protections of Section 9 of the Ontario Evidence Act and Section 5 of the Evidence Act of Canada are invoked for the witness.,19-146-23,146,23,22,speaker_start,STATEMENT BY MS. LANI ROUILLARD,MS. LANI ROUILLARD,lani rouillard
19-146-27,"Okay. Thank you. Just for the record, Mr. Leschied is under subpoena, and I deemed that -- I will deem that the witness has objected to answer each and every question on the ground that his answers may tend to incriminate or may tend to establish his liability to a civil proceeding at the instance of the Crown or of any other person, and if but for the Acts invoked, the witness would -- or this Act, the witness would therefore have to have been excused from answering the questions, then although the witness is by reason of this Act, or the federal and provincial Act compelled to answer, the answers so given shall not be used or admissible in evidence against him in any criminal trial or any other criminal proceeding against him thereafter taking place, other than a prosecution for perjury in the giving of that evidence or for the giving of contradictory evidence. So is that adequate then?",19-146-28,146,28,27,speaker_start,STATEMENT BY MS. LANI ROUILLARD,COMMISSIONER ROULEAU,commissioner rouleau
19-147-15,"Yes. Thank you, sir.",19-147-17,147,17,15,speaker_start,STATEMENT BY MS. LANI ROUILLARD,MS. LANI ROUILLARD,lani rouillard
19-147-16,"Okay. With that introduction, I think we can proceed with the examination. Go ahead.",19-147-18,147,18,16,speaker_start,STATEMENT BY MS. LANI ROUILLARD,COMMISSIONER ROULEAU,commissioner rouleau
19-147-19,Thank you very much.,19-147-21,147,21,19,speaker_start,STATEMENT BY MS. LANI ROUILLARD,MS. ALLISON McMAHON,allison mcmahon
19-147-20,--- EXAMINATION IN-CHIEF BY MS. ALLISON McMAHON:,19-147-22,147,22,20,section_header,EXAMINATION IN-CHIEF BY MS. ALLISON McMAHON,NA,NA
19-147-21,"Mr. Leschied, you were interviewed by Commission Counsel on October 4th; is that correct?",19-147-23,147,23,21,speaker_start,EXAMINATION IN-CHIEF BY MS. ALLISON McMAHON,MS. ALLISON McMAHON,allison mcmahon
19-147-24,Yes.,19-147-26,147,26,24,speaker_start,EXAMINATION IN-CHIEF BY MS. ALLISON McMAHON,MR. PAUL LESCHIED,paul leschied
19-147-25,"And, Mr. Registrar, if we could please pull up WTS00000049? Mr. Leschied, is that the -- a summary of the interview?",19-147-27,147,27,25,speaker_start,EXAMINATION IN-CHIEF BY MS. ALLISON McMAHON,MS. ALLISON McMAHON,allison mcmahon
19-148-01,Yes.,19-148-03,148,3,1,speaker_start,EXAMINATION IN-CHIEF BY MS. ALLISON McMAHON,MR. PAUL LESCHIED,paul leschied
19-148-02,And have you had an opportunity to review this summary?,19-148-04,148,4,2,speaker_start,EXAMINATION IN-CHIEF BY MS. ALLISON McMAHON,MS. ALLISON McMAHON,allison mcmahon
19-148-04,Yeah.,19-148-06,148,6,4,speaker_start,EXAMINATION IN-CHIEF BY MS. ALLISON McMAHON,MR. PAUL LESCHIED,paul leschied
19-148-05,And do you have any corrections to it?,19-148-07,148,7,5,speaker_start,EXAMINATION IN-CHIEF BY MS. ALLISON McMAHON,MS. ALLISON McMAHON,allison mcmahon
19-148-07,No.,19-148-09,148,9,7,speaker_start,EXAMINATION IN-CHIEF BY MS. ALLISON McMAHON,MR. PAUL LESCHIED,paul leschied
19-148-08,"Okay. Then we'll ask that it be entered as an exhibit. Mr. Leschied, you live in McGregor, Ontario; is that right?",19-148-10,148,10,8,speaker_start,EXAMINATION IN-CHIEF BY MS. ALLISON McMAHON,MS. ALLISON McMAHON,allison mcmahon
19-148-12,"Yeah, correct.",19-148-14,148,14,12,speaker_start,EXAMINATION IN-CHIEF BY MS. ALLISON McMAHON,MR. PAUL LESCHIED,paul leschied
19-148-13,And that's about 15 kilometres from downtown Windsor?,19-148-15,148,15,13,speaker_start,EXAMINATION IN-CHIEF BY MS. ALLISON McMAHON,MS. ALLISON McMAHON,allison mcmahon
19-148-15,"Fifteen (15) to 20 kilometres from downtown Windsor, yeah.",19-148-17,148,17,15,speaker_start,EXAMINATION IN-CHIEF BY MS. ALLISON McMAHON,MR. PAUL LESCHIED,paul leschied
19-148-17,Okay. And what do you do for a living?,19-148-19,148,19,17,speaker_start,EXAMINATION IN-CHIEF BY MS. ALLISON McMAHON,MS. ALLISON McMAHON,allison mcmahon
19-148-19,I co-own a contracting business that serves the greater Windsor-Essex County area.,19-148-21,148,21,19,speaker_start,EXAMINATION IN-CHIEF BY MS. ALLISON McMAHON,MR. PAUL LESCHIED,paul leschied
19-148-21,Okay. And have you been a life-long resident of the Essex County area?,19-148-23,148,23,21,speaker_start,EXAMINATION IN-CHIEF BY MS. ALLISON McMAHON,MS. ALLISON McMAHON,allison mcmahon
19-148-23,"I've lived in Essex County area for the better part of the last 44 years, other than the time I spent at university and briefly in Alberta for a -- as a commercial helicopter pilot.",19-148-25,148,25,23,speaker_start,EXAMINATION IN-CHIEF BY MS. ALLISON McMAHON,MR. PAUL LESCHIED,paul leschied
19-148-27,And can you please tell the Commissioner about how you became involved with protests against COVID-19 public health mandates?,19-148-29,148,29,27,speaker_start,EXAMINATION IN-CHIEF BY MS. ALLISON McMAHON,MS. ALLISON McMAHON,allison mcmahon
19-149-02,"I would just say, like many other Canadians, I'd grown a little wary with the -- I guess the direction of our basic fundamental rights and freedoms kind of being transformed into privileges that can be granted or revoked based upon our personal compliance with whatever the latest mandate or bylaw that's being passed down by our federal, provincial or municipal leaders. That led me to be a little concerned as a father of three young children, the direction that this country's heading in, and so I participated in several peaceful, lawful protests, so that people's voices could be heard with these same concerns.",19-149-04,149,4,2,speaker_start,EXAMINATION IN-CHIEF BY MS. ALLISON McMAHON,MR. PAUL LESCHIED,paul leschied
19-149-13,And can you tell us about those protests?,19-149-15,149,15,13,speaker_start,EXAMINATION IN-CHIEF BY MS. ALLISON McMAHON,MS. ALLISON McMAHON,allison mcmahon
19-149-15,"I mean, we had various fundraisers for people that have been negatively impacted, or had job losses, or had their businesses somewhat run into the ground, or not being able to make ends meet. We've had various freedom rallies at the flag, I guess that you would call it, at the downtown Windsor area of Riverside and Ouellette Avenue.",19-149-17,149,17,15,speaker_start,EXAMINATION IN-CHIEF BY MS. ALLISON McMAHON,MR. PAUL LESCHIED,paul leschied
19-149-21,And are those the sort of weekly rallies that would take place starting in September ---,19-149-23,149,23,21,speaker_start,EXAMINATION IN-CHIEF BY MS. ALLISON McMAHON,MS. ALLISON McMAHON,allison mcmahon
19-149-23,I wouldn't say I was there for the weekly rallies. There have been weekly rallies and I was -- I did my part to offer whatever assistance or support that I could at several of these events over the last couple years.,19-149-25,149,25,23,speaker_start,EXAMINATION IN-CHIEF BY MS. ALLISON McMAHON,MR. PAUL LESCHIED,paul leschied
19-149-28,Okay. And how would you typically hear about protests that you would attend or fundraisers or rallies?,19-149-30,149,30,28,speaker_start,EXAMINATION IN-CHIEF BY MS. ALLISON McMAHON,MS. ALLISON McMAHON,allison mcmahon
19-150-03,"I mean, I just I've made a lot of friends and that would attend some of these rallies in the area that have similar concerns that I do. So, you know, through text message, periodic meetups where people might be discussing what they would like to do or what action maybe they would like to take next.",19-150-05,150,5,3,speaker_start,EXAMINATION IN-CHIEF BY MS. ALLISON McMAHON,MR. PAUL LESCHIED,paul leschied
19-150-09,And would you post about it on social media or sort of join -- did you join any groups related to ---,19-150-11,150,11,9,speaker_start,EXAMINATION IN-CHIEF BY MS. ALLISON McMAHON,MS. ALLISON McMAHON,allison mcmahon
19-150-12,"More just, like, personal interactions with friends that were involved in the same sort of things.",19-150-14,150,14,12,speaker_start,EXAMINATION IN-CHIEF BY MS. ALLISON McMAHON,MR. PAUL LESCHIED,paul leschied
19-150-15,Okay. So you weren't part of any sort of formal organizations?,19-150-17,150,17,15,speaker_start,EXAMINATION IN-CHIEF BY MS. ALLISON McMAHON,MS. ALLISON McMAHON,allison mcmahon
19-150-17,I wouldn't say that there was very many formal organizations. It was kind of a loose organization with people coming and going and that would be about it.,19-150-19,150,19,17,speaker_start,EXAMINATION IN-CHIEF BY MS. ALLISON McMAHON,MR. PAUL LESCHIED,paul leschied
19-150-21,And a loose organization in the sense of just you have this network of friends who ---,19-150-23,150,23,21,speaker_start,EXAMINATION IN-CHIEF BY MS. ALLISON McMAHON,MS. ALLISON McMAHON,allison mcmahon
19-150-23,"I mean, like I said, it would be some people that were involved with this maybe prior to me getting involved, and then I would meet certain people over the course of these events, and ---",19-150-25,150,25,23,speaker_start,EXAMINATION IN-CHIEF BY MS. ALLISON McMAHON,MR. PAUL LESCHIED,paul leschied
19-150-27,M'hm.,19-150-29,150,29,27,speaker_start,EXAMINATION IN-CHIEF BY MS. ALLISON McMAHON,MS. ALLISON McMAHON,allison mcmahon
19-150-28,--- that would be about it.,19-150-30,150,30,28,speaker_start,EXAMINATION IN-CHIEF BY MS. ALLISON McMAHON,MR. PAUL LESCHIED,paul leschied
19-151-01,Okay. And did you help plan any of these rallies or ---,19-151-03,151,3,1,speaker_start,EXAMINATION IN-CHIEF BY MS. ALLISON McMAHON,MS. ALLISON McMAHON,allison mcmahon
19-151-03,"I mean, I offered support where I could. I thought I was a calming influence on a lot of these events when perhaps maybe things got contentious or, you know, offer support in terms of setting things up. You know, we would have a sound stage, perhaps, and you know, I would offer support, and moving things from Point A to Point B, or hauling things from somewhere to wherever the venue happened to be at.",19-151-05,151,5,3,speaker_start,EXAMINATION IN-CHIEF BY MS. ALLISON McMAHON,MR. PAUL LESCHIED,paul leschied
19-151-10,"Okay. And I understand that in January 2022, and continuing into early February, there were slow roll protests on Huron Church Avenue. Is that right?",19-151-12,151,12,10,speaker_start,EXAMINATION IN-CHIEF BY MS. ALLISON McMAHON,MS. ALLISON McMAHON,allison mcmahon
19-151-13,Yes.,19-151-15,151,15,13,speaker_start,EXAMINATION IN-CHIEF BY MS. ALLISON McMAHON,MR. PAUL LESCHIED,paul leschied
19-151-14,And were you aware of those protests?,19-151-16,151,16,14,speaker_start,EXAMINATION IN-CHIEF BY MS. ALLISON McMAHON,MS. ALLISON McMAHON,allison mcmahon
19-151-16,"I was aware of those, yes.",19-151-18,151,18,16,speaker_start,EXAMINATION IN-CHIEF BY MS. ALLISON McMAHON,MR. PAUL LESCHIED,paul leschied
19-151-17,Did you participate in them?,19-151-19,151,19,17,speaker_start,EXAMINATION IN-CHIEF BY MS. ALLISON McMAHON,MS. ALLISON McMAHON,allison mcmahon
19-151-19,"No, I did not.",19-151-21,151,21,19,speaker_start,EXAMINATION IN-CHIEF BY MS. ALLISON McMAHON,MR. PAUL LESCHIED,paul leschied
19-151-20,Like attend them in any way or anything like that?,19-151-22,151,22,20,speaker_start,EXAMINATION IN-CHIEF BY MS. ALLISON McMAHON,MS. ALLISON McMAHON,allison mcmahon
19-151-22,No.,19-151-24,151,24,22,speaker_start,EXAMINATION IN-CHIEF BY MS. ALLISON McMAHON,MR. PAUL LESCHIED,paul leschied
19-151-23,Okay. And were you at that time following what was happening in Ottawa with the Freedom Convoy?,19-151-25,151,25,23,speaker_start,EXAMINATION IN-CHIEF BY MS. ALLISON McMAHON,MS. ALLISON McMAHON,allison mcmahon
19-151-26,Yes.,19-151-28,151,28,26,speaker_start,EXAMINATION IN-CHIEF BY MS. ALLISON McMAHON,MR. PAUL LESCHIED,paul leschied
19-151-27,"Okay. And how were you monitoring that? Was it through social media, through traditional media?",19-151-29,151,29,27,speaker_start,EXAMINATION IN-CHIEF BY MS. ALLISON McMAHON,MS. ALLISON McMAHON,allison mcmahon
19-152-02,"Mostly social media, and then, you know, I had a couple of friends that were heading up there at various points during the Ottawa demonstrations.",19-152-04,152,4,2,speaker_start,EXAMINATION IN-CHIEF BY MS. ALLISON McMAHON,MR. PAUL LESCHIED,paul leschied
19-152-05,Okay. And we'll come back to that. But you didn't participate in any of the events in Ottawa did you?,19-152-07,152,7,5,speaker_start,EXAMINATION IN-CHIEF BY MS. ALLISON McMAHON,MS. ALLISON McMAHON,allison mcmahon
19-152-08,No.,19-152-10,152,10,8,speaker_start,EXAMINATION IN-CHIEF BY MS. ALLISON McMAHON,MR. PAUL LESCHIED,paul leschied
19-152-09,"So the blockade starts -- at the Ambassador Bridge starts on February 7th as I understand it. In the days leading up to that, were you aware that there might a protest in that area?",19-152-11,152,11,9,speaker_start,EXAMINATION IN-CHIEF BY MS. ALLISON McMAHON,MS. ALLISON McMAHON,allison mcmahon
19-152-13,No.,19-152-15,152,15,13,speaker_start,EXAMINATION IN-CHIEF BY MS. ALLISON McMAHON,MR. PAUL LESCHIED,paul leschied
19-152-14,So we have heard evidence over the last day-and-a-half that there were social media posts about a slow roll and potential blockade. But that was not something that you saw?,19-152-16,152,16,14,speaker_start,EXAMINATION IN-CHIEF BY MS. ALLISON McMAHON,MS. ALLISON McMAHON,allison mcmahon
19-152-18,"I knew that there was slow rolls going on. Was there rumours about this event or that event going on? There's all kinds of things being shared across social media, but I was not aware of any organisation for an event that was going to start on February 7th.",19-152-20,152,20,18,speaker_start,EXAMINATION IN-CHIEF BY MS. ALLISON McMAHON,MR. PAUL LESCHIED,paul leschied
19-152-23,Was a blockade of the Ambassador Bridge something that you had heard rumours about?,19-152-25,152,25,23,speaker_start,EXAMINATION IN-CHIEF BY MS. ALLISON McMAHON,MS. ALLISON McMAHON,allison mcmahon
19-152-25,"Very loosely. Like, I mean, you might have heard somebody suggest, ""Oh, well that would be a -- that would be an interesting idea"", but nothing that would ever have been something that I was involved in discussing.",19-152-27,152,27,25,speaker_start,EXAMINATION IN-CHIEF BY MS. ALLISON McMAHON,MR. PAUL LESCHIED,paul leschied
19-153-01,Okay. And you attended the blockade for the first time on the evening of February 7th; is that right?,19-153-03,153,3,1,speaker_start,EXAMINATION IN-CHIEF BY MS. ALLISON McMAHON,MS. ALLISON McMAHON,allison mcmahon
19-153-04,Correct.,19-153-06,153,6,4,speaker_start,EXAMINATION IN-CHIEF BY MS. ALLISON McMAHON,MR. PAUL LESCHIED,paul leschied
19-153-05,And around what time would you have arrived?,19-153-07,153,7,5,speaker_start,EXAMINATION IN-CHIEF BY MS. ALLISON McMAHON,MS. ALLISON McMAHON,allison mcmahon
19-153-07,I'd estimate round 9:00 p.m.,19-153-09,153,9,7,speaker_start,EXAMINATION IN-CHIEF BY MS. ALLISON McMAHON,MR. PAUL LESCHIED,paul leschied
19-153-08,And for the rest of the week would you typically attend around the same time?,19-153-10,153,10,8,speaker_start,EXAMINATION IN-CHIEF BY MS. ALLISON McMAHON,MS. ALLISON McMAHON,allison mcmahon
19-153-10,"Yeah, I would usually go after my young children were put to bed, and I would head down from between the hours of eight and nine until maybe twelve to one o'clock in the morning.",19-153-12,153,12,10,speaker_start,EXAMINATION IN-CHIEF BY MS. ALLISON McMAHON,MR. PAUL LESCHIED,paul leschied
19-153-14,"Okay. And so on that first evening, on February 7th, where were the protesters located?",19-153-16,153,16,14,speaker_start,EXAMINATION IN-CHIEF BY MS. ALLISON McMAHON,MS. ALLISON McMAHON,allison mcmahon
19-153-16,"So where I went was at the intersection of Girardot and Huron Church Avenue, which is approximately a half kilometre south of the egress point of the Ambassador Bridge southbound on Huron Church.",19-153-18,153,18,16,speaker_start,EXAMINATION IN-CHIEF BY MS. ALLISON McMAHON,MR. PAUL LESCHIED,paul leschied
19-153-20,"Okay. And Mr. Registrar, could we please pull up the map of Windsor, just so that we can see where that is? And so as I understand it, the egress point, as you referred to it, is north of College on Huron Church; is that right?",19-153-22,153,22,20,speaker_start,EXAMINATION IN-CHIEF BY MS. ALLISON McMAHON,MS. ALLISON McMAHON,allison mcmahon
19-153-26,Correct.,19-153-28,153,28,26,speaker_start,EXAMINATION IN-CHIEF BY MS. ALLISON McMAHON,MR. PAUL LESCHIED,paul leschied
19-153-27,So would that be in the vicinity of that purple icon?,19-153-29,153,29,27,speaker_start,EXAMINATION IN-CHIEF BY MS. ALLISON McMAHON,MS. ALLISON McMAHON,allison mcmahon
19-154-01,"Yeah. Yeah, somewhere between the purple and maybe just a little bit south of that.",19-154-03,154,3,1,speaker_start,EXAMINATION IN-CHIEF BY MS. ALLISON McMAHON,MR. PAUL LESCHIED,paul leschied
19-154-03,"Okay. And Girardot, that's down the -- that's ---",19-154-05,154,5,3,speaker_start,EXAMINATION IN-CHIEF BY MS. ALLISON McMAHON,MS. ALLISON McMAHON,allison mcmahon
19-154-05,"So Girardot would be if you see the second cross street, I see you there as a little -- where it says Dot Avenue beside it and you see like an intersection there, that would be where the intersection of Girardot and Huron Church would be.",19-154-07,154,7,5,speaker_start,EXAMINATION IN-CHIEF BY MS. ALLISON McMAHON,MR. PAUL LESCHIED,paul leschied
19-154-10,And that's about halfway between College and Tecumseh?,19-154-12,154,12,10,speaker_start,EXAMINATION IN-CHIEF BY MS. ALLISON McMAHON,MS. ALLISON McMAHON,allison mcmahon
19-154-12,Correct.,19-154-14,154,14,12,speaker_start,EXAMINATION IN-CHIEF BY MS. ALLISON McMAHON,MR. PAUL LESCHIED,paul leschied
19-154-13,"And so when you arrived at the protest that night, were vehicles blocking the intersection?",19-154-15,154,15,13,speaker_start,EXAMINATION IN-CHIEF BY MS. ALLISON McMAHON,MS. ALLISON McMAHON,allison mcmahon
19-154-15,There was probably three to four pickup trucks blocking or straddling both sides of Huron Church Avenue north and southbound at that intersection.,19-154-17,154,17,15,speaker_start,EXAMINATION IN-CHIEF BY MS. ALLISON McMAHON,MR. PAUL LESCHIED,paul leschied
19-154-18,"And so were they driving down Girardot, I'm sorry I'm going to butcher that street name - --",19-154-20,154,20,18,speaker_start,EXAMINATION IN-CHIEF BY MS. ALLISON McMAHON,MS. ALLISON McMAHON,allison mcmahon
19-154-21,No.,19-154-23,154,23,21,speaker_start,EXAMINATION IN-CHIEF BY MS. ALLISON McMAHON,MR. PAUL LESCHIED,paul leschied
19-154-22,--- or were they driving down Huron Church?,19-154-24,154,24,22,speaker_start,EXAMINATION IN-CHIEF BY MS. ALLISON McMAHON,MS. ALLISON McMAHON,allison mcmahon
19-154-24,"See, they weren't driving when I got there, they were just kind of straddled across, like perpendicular to Huron Church Avenue so that they were impeding the traffic at Girardot and Huron Church.",19-154-26,154,26,24,speaker_start,EXAMINATION IN-CHIEF BY MS. ALLISON McMAHON,MR. PAUL LESCHIED,paul leschied
19-154-28,And approximately how many vehicles were blocking the intersection?,19-154-30,154,30,28,speaker_start,EXAMINATION IN-CHIEF BY MS. ALLISON McMAHON,MS. ALLISON McMAHON,allison mcmahon
19-155-02,I would say three to four.,19-155-04,155,4,2,speaker_start,EXAMINATION IN-CHIEF BY MS. ALLISON McMAHON,MR. PAUL LESCHIED,paul leschied
19-155-03,And did you participate in that blockade?,19-155-05,155,5,3,speaker_start,EXAMINATION IN-CHIEF BY MS. ALLISON McMAHON,MS. ALLISON McMAHON,allison mcmahon
19-155-05,No. I parked much further away on a side street.,19-155-07,155,7,5,speaker_start,EXAMINATION IN-CHIEF BY MS. ALLISON McMAHON,MR. PAUL LESCHIED,paul leschied
19-155-07,And so then you walked in?,19-155-09,155,9,7,speaker_start,EXAMINATION IN-CHIEF BY MS. ALLISON McMAHON,MS. ALLISON McMAHON,allison mcmahon
19-155-08,Yes.,19-155-10,155,10,8,speaker_start,EXAMINATION IN-CHIEF BY MS. ALLISON McMAHON,MR. PAUL LESCHIED,paul leschied
19-155-09,And were there -- were most people in their cars or were they on foot?,19-155-11,155,11,9,speaker_start,EXAMINATION IN-CHIEF BY MS. ALLISON McMAHON,MS. ALLISON McMAHON,allison mcmahon
19-155-11,"They would be on foot. Other than those three to four cars that were involved there, everybody else would be on foot.",19-155-13,155,13,11,speaker_start,EXAMINATION IN-CHIEF BY MS. ALLISON McMAHON,MR. PAUL LESCHIED,paul leschied
19-155-14,Roughly how many other protesters were...,19-155-16,155,16,14,speaker_start,EXAMINATION IN-CHIEF BY MS. ALLISON McMAHON,MS. ALLISON McMAHON,allison mcmahon
19-155-16,"When I got there, maybe 40, 50, somewhere in that range.",19-155-18,155,18,16,speaker_start,EXAMINATION IN-CHIEF BY MS. ALLISON McMAHON,MR. PAUL LESCHIED,paul leschied
19-155-18,"They were standing in the intersection, on the sidewalks?",19-155-20,155,20,18,speaker_start,EXAMINATION IN-CHIEF BY MS. ALLISON McMAHON,MS. ALLISON McMAHON,allison mcmahon
19-155-20,"On the sidewalks, some in the intersection of that area.",19-155-22,155,22,20,speaker_start,EXAMINATION IN-CHIEF BY MS. ALLISON McMAHON,MR. PAUL LESCHIED,paul leschied
19-155-22,Okay. And were there police present?,19-155-24,155,24,22,speaker_start,EXAMINATION IN-CHIEF BY MS. ALLISON McMAHON,MS. ALLISON McMAHON,allison mcmahon
19-155-24,Yes.,19-155-26,155,26,24,speaker_start,EXAMINATION IN-CHIEF BY MS. ALLISON McMAHON,MR. PAUL LESCHIED,paul leschied
19-155-25,What were they doing?,19-155-27,155,27,25,speaker_start,EXAMINATION IN-CHIEF BY MS. ALLISON McMAHON,MS. ALLISON McMAHON,allison mcmahon
19-155-26,"So there would have been police vehicles at the intersection near, I guess on the east side of that road where the Assumption High School area is.",19-155-28,155,28,26,speaker_start,EXAMINATION IN-CHIEF BY MS. ALLISON McMAHON,MR. PAUL LESCHIED,paul leschied
19-156-01,And had they set up blockades anywhere?,19-156-03,156,3,1,speaker_start,EXAMINATION IN-CHIEF BY MS. ALLISON McMAHON,MS. ALLISON McMAHON,allison mcmahon
19-156-03,"So I didn't discover that until after I left that evening, and then I had seen that there was Windsor Police vehicles at several of the intersections surrounding the general area.",19-156-05,156,5,3,speaker_start,EXAMINATION IN-CHIEF BY MS. ALLISON McMAHON,MR. PAUL LESCHIED,paul leschied
19-156-07,And that's on February the 7th?,19-156-09,156,9,7,speaker_start,EXAMINATION IN-CHIEF BY MS. ALLISON McMAHON,MS. ALLISON McMAHON,allison mcmahon
19-156-09,Yes.,19-156-11,156,11,9,speaker_start,EXAMINATION IN-CHIEF BY MS. ALLISON McMAHON,MR. PAUL LESCHIED,paul leschied
19-156-10,And yesterday we saw evidence that protesters had started setting up a camp on the first night and had told police that they were staying put and not moving. Is that someth8ing that you observed?,19-156-12,156,12,10,speaker_start,EXAMINATION IN-CHIEF BY MS. ALLISON McMAHON,MS. ALLISON McMAHON,allison mcmahon
19-156-14,"I didn't observe that at the Girardot intersection, which is the only spot that I really walked.",19-156-16,156,16,14,speaker_start,EXAMINATION IN-CHIEF BY MS. ALLISON McMAHON,MR. PAUL LESCHIED,paul leschied
19-156-17,"Okay. So you weren't at College Street, for example?",19-156-19,156,19,17,speaker_start,EXAMINATION IN-CHIEF BY MS. ALLISON McMAHON,MS. ALLISON McMAHON,allison mcmahon
19-156-19,"Not on February 7th, no.",19-156-21,156,21,19,speaker_start,EXAMINATION IN-CHIEF BY MS. ALLISON McMAHON,MR. PAUL LESCHIED,paul leschied
19-156-20,And you didn't sort of walk by there when you were ---,19-156-22,156,22,20,speaker_start,EXAMINATION IN-CHIEF BY MS. ALLISON McMAHON,MS. ALLISON McMAHON,allison mcmahon
19-156-22,"Well, my impressions at Girardot was that there was semi-trucks backed up on both north and southbound lanes for as far as my eyes could see. So I had no reason to really walk along all of the other semi-trucks on the road that were just sitting there idling.",19-156-24,156,24,22,speaker_start,EXAMINATION IN-CHIEF BY MS. ALLISON McMAHON,MR. PAUL LESCHIED,paul leschied
19-156-27,And was your impression that they were backed up because of the blockade at Girardot?,19-156-29,156,29,27,speaker_start,EXAMINATION IN-CHIEF BY MS. ALLISON McMAHON,MS. ALLISON McMAHON,allison mcmahon
19-157-01,"Yes, that's correct.",19-157-03,157,3,1,speaker_start,EXAMINATION IN-CHIEF BY MS. ALLISON McMAHON,MR. PAUL LESCHIED,paul leschied
19-157-02,Okay. And what time did you leave the protest on that first night?,19-157-04,157,4,2,speaker_start,EXAMINATION IN-CHIEF BY MS. ALLISON McMAHON,MS. ALLISON McMAHON,allison mcmahon
19-157-04,I would estimate one o'clock in the morning.,19-157-06,157,6,4,speaker_start,EXAMINATION IN-CHIEF BY MS. ALLISON McMAHON,MR. PAUL LESCHIED,paul leschied
19-157-06,Did you expect that the protesters would stay overnight?,19-157-08,157,8,6,speaker_start,EXAMINATION IN-CHIEF BY MS. ALLISON McMAHON,MS. ALLISON McMAHON,allison mcmahon
19-157-08,"When I left, there was probably a dozen or so protesters left there, and I had assumed that that would be a one-off type of event and it would be over by the next morning, or later that night.",19-157-10,157,10,8,speaker_start,EXAMINATION IN-CHIEF BY MS. ALLISON McMAHON,MR. PAUL LESCHIED,paul leschied
19-157-12,So while you were there you hadn't discussed with anybody that they might stay there overnight?,19-157-14,157,14,12,speaker_start,EXAMINATION IN-CHIEF BY MS. ALLISON McMAHON,MS. ALLISON McMAHON,allison mcmahon
