interjection_id,text_clean_combined,line_id,page,line,transcript_line_number,line_type,section_header,speaker,speaker_standardized
01-025-08,--- OPENING REMARKS BY MS. SHANTONA CHAUDHURY:,01-025-10,25,10,8,section_header,OPENING REMARKS BY MS. SHANTONA CHAUDHURY,NA,NA
01-025-09,"Thank you, Commissioner. Good morning, everyone. My name is Shantona Chaudhury. I’m co-lead counsel to the Public Order Emergency Commission. Bonjour tout le monde. Je m’appelle Shantona Chaudhury et je suis coprocureure en chef de la Commission sur l’état d’urgence. I’m going to take the next few minutes to explain to you how the coming hearings will unfold. I’ll start by describing the schedule for the next two days in some detail, and then I’ll give you a broad overview of how the evidence will be led in the coming weeks. So, starting with this morning. This morning will consist of introductions to the parties who have been granted standing before the Commission and the counsel representing them. Each set of counsel have been invited to prepare a brief statement of no more than three to five minutes introducing themselves and explaining in broad terms their party’s interest in the mandate of the Commission. Given the number of parties and counsel involved, we’ve allocated approximately two hours to these introductions and we’re very much looking forward to hearing from all of you. This afternoon, Commission Counsel will present a series of overview reports and presentations designed to assist the parties and the public in understanding the issues before the Commission and the context of the evidence that you’re about to hear. So these will consist of, first, an overview report on the emergence of COVID-19 and the various public health measures implemented across Canada in response to it. Second, there will be an overview report on early protests and legal challenges to the various public health measures put in place in response to the pandemic. Third, there will be an overview report consisting of a timeline of the key events leading up to the invocation of the Emergencies Act. Quatre, il y aura une présentation qui trace les grandes lignes de la Loi sur les mesures d’urgence et de son cadre juridique. Fifth, there will be a presentation of the explanation provided by the Government of Canada to Parliament, pursuant to section 58 of the Emergencies Act, regarding its reasons for declaring a public order emergency. Now, you will frequently hear this document referred to throughout these proceedings as the Section 58 explanation. Part of the Commission’s mandate is to evaluate and test the explanation provided by the Government for invoking the Act. Ces rapports sommaires et ces présentations ont été préparés par les avocats et les avocates de la Commission. Il convient toutefois de souligner la distinction entre un rapport sommaire d’un côté et d’une présentation de l’autre. Les rapports sommaires seront formellement déposés en preuve et feront partie de l’ensemble des preuves sur lequel le commissaire pourra s’appuyer pour formuler ses conclusions de fait et ses recommandations. Avant d’être finalisés, les rapports sommaires ont été partagés avec toutes les parties afin qu’elles puissent commenter leur exactitude. Les présentations pour leur part ne sont pas des éléments de preuve, elles sont simplement des documents explicatifs créés par la Commission pour aider les parties et le public à comprendre les enjeux que la Commission abordera au cours des prochaines semaines, elles ne font pas partie de l’ensemble des preuves présentées aux commissaires. So that will be day one of the hearings and that takes us to tomorrow, day two, which is the day that the Commission's going to begin hearing its evidence. Now I should explain that when witnesses are called to testify before the Commission, they will generally be examined first by Commission Counsel, a rotating cast of Commission Counsel, as the Commissioner explained, then by Counsel for the parties, and then by the witness's own Counsel. The order in which evidence will be called over the next six weeks is as follows. And actually, I should pause and preface this by saying that the order of evidence I'm about to describe is approximate and it's subject to change as the hearings unfold. However, in broad terms, first, we're going to deal with the Ottawa protest. So the first broad area that will be examined is the protests that occurred here in Ottawa from late January to mid February 2022. These events will be examined from the perspective of the residents and the community, the municipal government, the police, and the protesters. So that evidence will begin tomorrow with three panels of witnesses speaking to their lived experience during the protests. These panelists will include residents of Ottawa, Ottawa businesses and Ottawa City counsellors. Next week, the Commission expects to spend the first part of the week hearing from various municipal officials involved in the City of Ottawa's response to the protest. We'll then spend several days hearing evidence on the police response to the Ottawa protest. Finally, the Commission anticipates calling a number of organizers and participants in the Ottawa protest. Bon, la Commission quittera ensuite Ottawa — au sens figuré, bien entendu — pour la frontière canado-américaine. Elle se penchera alors sur ce qu’on pourrait appeler de manière générale les manifestations aux postes frontaliers. Plusieurs jours seront consacrés aux témoignages des manifestants, de policiers et de responsables municipaux pour faire la lumière sur les manifestations qui se sont déroulées dans les environs de Windsor et du pont Ambassador ainsi qu’aux alentours de Coutts en Alberta. Après ça, troisièmement, il y a… ça nous amène aux gouvernements provinciaux. La Commission entend ensuite recevoir des témoignages sur la manière dont les provinces ont réagi aux manifestations en faisant témoigner des représentants de plusieurs gouvernements provinciaux, dont ceux de l’Alberta et de l’Ontario. Finally, the last two weeks, give or take, of the hearing will be spent hearing evidence from the federal government about its response to the protests and its decision to invoke the Emergencies Act. The witnesses called will include senior officials from the federal departments and agencies, as well as cabinets ministers and the Prime Minister. That will conclude the fact-finding portion of the public hearings. By the time the hearings end, the Commission will have heard from over 60 witnesses, presenting all the different points of view that I've just outlined. In addition to all of the oral evidence that will be called, the Commission will be adducing a significant amount of written evidence in relation to all the areas mentioned above, including relevant documents that have been produced by parties, institutional reports that have been prepared by parties, and overview reports that have been prepared by the Commission, which consist of largely uncontroversial evidence. Introducing all of this evidence in writing will expedite the hearing, which is a necessity given the extraordinarily tight timelines under which the Commission's operating, but it's important to keep in mind that the body of evidence before the Commissioner includes not just the oral evidence, but all of the written evidence we will be adducing as well. As the Commissioner mentioned, the fact-finding hearings will be followed by a week of policy round tables discussing the many and varied policy issues arising out of the Commission's mandate and the evidence it has heard. As a reminder, the Commission has published a series of Commission papers as part of its policy review program, as the Commissioner mentioned, and parties have 30 days from a date a paper is posted to provide comments on it. With that, I echo the Commissioner in thanking the parties very much for their cooperation and their contribution to the Commission's work thus far, and especially over the next few weeks. I'll now turn the floor over to my co- lead Counsel to introduce our team of Commission Counsel.",01-025-11,25,11,9,speaker_start,OPENING REMARKS BY MS. SHANTONA CHAUDHURY,MS. SHANTONA CHAUDHURY,shantona chaudhury
01-030-14,--- OPENING REMAKRS BY MR. JEFFREY LEON:,01-030-16,30,16,14,section_header,OPENING REMAKRS BY MR. JEFFREY LEON,NA,NA
01-030-15,"Good morning. My name's Jeff Leon, and I am a co-lead Counsel of the Commissioner. Commissioner, I have the pleasant task of introducing by name to those assembled and those watching online our Commission Counsel. These Counsel are the lawyers who are justly credited for the exceptional work that you and others have mentioned. Their professional biographies are available on the Commission's website for review. But first let me introduce our senior Counsel, who are responsible for the different aspects of dossiers of our investigation that you have just heard about. Senior Counsel will lead much of the evidence over the coming weeks. So the Senior Counsel of the Commission are Frank Au; Erin Dann, who regrettably can't join us for the hearings; Gabriel Poliquin; Natalia Rodriguez; and Daniel Sheppard. We have also had the valued assistance of three regional Counsel from across Canada. They are Mona Duckett, QC from Alberta, Sacha Paul from Manitoba, and Maia Tsurumi from British Columbia. And we have a group of, if I may say, most talented and dedicated Counsel, who came together from several Canadian provinces, and who have assisted with the investigation and with preparing for these hearings. Their effort has been nothing short of extraordinary. They are the engines that have driven our investigation. First, in addition to the work they have done on the investigation and in hearing preparation, I want to introduce Eric Brousseau and John Mather, who assumed the legal operations function of the Commission that has enabled this facility and our process and procedures to result in a fully functional space and our being ready for the commencement of these hearings. The other Counsel, who as mentioned have been a key part of our investigation, are Stephen Armstrong, Misha Boutilier, Sajeda Hedaraly, Alexandra Heine, Nusra Khan, Étienne Lacombe, Allison McMahon, Jean-Simon Schoenholz, Dhalia Shuhaibar, and Guillaume Sirois-Gingras. Mr. Commissioner, if I may say, it has been an honour to work with these talented Counsel. Thank you.",01-030-17,30,17,15,speaker_start,OPENING REMAKRS BY MR. JEFFREY LEON,MR. JEFFREY LEON,jeffrey leon
01-031-25,"Thank you very much. So that introduction I think has been very helpful. We have a little time to get started in -- if parties are willing. Today is a little bit lighter than the days that are coming. I can assure you, you're going to have to be prepared to work hard. Alors, peut-être qu’on peut commencer avec la présentation des différentes parties. À moins d’autres suggestions, je vais juste suivre l’ordre que j’ai devant moi. Unless there's any objection and people want to arm-wrestle, I suggest I'll just follow the order on the sheet in front of me and call on the various parties to briefly introduce themselves, three to five minutes, if you wish, so that I and the public will know who is participating in the hearing. So starting with the Government of Canada, if I could ask, I'm not sure if it's Mr. MacKinnon or who will be presenting, but go ahead.",01-031-27,31,27,25,speaker_start,OPENING REMAKRS BY MR. JEFFREY LEON,COMMISSIONER ROULEAU,commissioner rouleau
01-032-15,Here?,01-032-16,32,16,15,speaker_start,OPENING REMAKRS BY MR. JEFFREY LEON,MR. ROBERT MacKINNON,robert mackinnon
01-032-16,"Well, perhaps you can do it over there. It's -- it might be better for the -- getting the visual, if that's okay. And you don't have to face me, you can face the crowd. That's -- like the counsel did.",01-032-17,32,17,16,speaker_start,OPENING REMAKRS BY MR. JEFFREY LEON,COMMISSIONER ROULEAU,commissioner rouleau
01-032-20,--- OPENING REMARKS BY MR. ROBERT MacKINNON:,01-032-21,32,21,20,section_header,OPENING REMARKS BY MR. ROBERT MacKINNON,NA,NA
01-032-21,"Good morning, Mr. Commissioner. My name is Robert MacKinnon, and I, along with Donnaree Nygard, who is sitting beside me, are the co-lead counsel for the Government of Canada. Also on our counsel team are Brendan van Niejenhuis, Andrea Gonsalves, and Andrew Gibbs. There will also be times during the hearing when other counsel from our team will be appearing before you. The Government of Canada looks forward to assisting the Commission in discharging its important mandate. As we have already heard, having a rigorous, thorough examination of the circumstances that led to the declaration of a Public Order Emergency under the Emergencies Act by an independent third party is very important to the accuracy of the historical record and to the public's understanding of these events. The Commission's recommendations will provide valuable guidance for the government on several current and complex issues, such as the impact on domestic and foreign funding, including crowdsourcing platforms; the role of misinformation, disinformation and social media in these events. It is evident that the Government of Canada considers the Commission's work of great significance, as it has allowed exceptional access to information that would normally be protected by Cabinet confidence in an almost unprecedented manner. As you have made reference, Mr. Commissioner, of the 371 federal Commissions of Inquiry, only three others since Confederation were provided access to documents provided by evidence. Factual and background information, options, and analyses brought to the attention of Ministers in the context of Cabinet and committee discussions have been exceptionally disclosed so that the Commission has access to the facts that were considered by decision-makers in declaring a public order emergency. It is important for Canadians to understand the unprecedented critical situation that the country was facing earlier this year. The evidence will show that the invocation of the Emergencies Act was a reasonable and necessary decision given the escalating volatile and urgent circumstances across the country. The evidence of the Government witnesses will detail the facts and events leading to the decision to declare a public order emergency. They will describe the country-wide threats to the security of Canada; the illegal blockades; the disruption and intimidation experienced by Ottawa residents; the threats at our borders and ports of entry; and the real impacts on Canada's trade, international reputation, and the economic well-being of Canadians. The Government witnesses will outline the deliberate, step-by-step process in which careful consideration was given to all the available options which led to the declaration of a public order emergency as a matter of last resort. The witnesses will also provide evidence on how the measures taken for dealing with the emergency were proportional, effective, and time-limited. In closing, I would like to note that given the statutory deadline imposed by the Act, the Commission and all the parties have had an incredible amount of work to do in a very limited amount of time. The Government appreciates the cooperation of everyone involved in working together to assist the Commission to fulfill its important mandate, and we look forward to continuing to assist the Commission in its work.",01-032-22,32,22,21,speaker_start,OPENING REMARKS BY MR. ROBERT MacKINNON,MR. ROBERT MacKINNON,robert mackinnon
01-034-27,"Thank you, Mr. MacKinnon. Now, I'm not sure, some parties may not be here in person, and I'm not sure mechanically how we're going to do this, so let me see how it works. Is the Government of Saskatchewan here? And if not, are they going to present by video? There we go.",01-034-29,34,29,27,speaker_start,OPENING REMARKS BY MR. ROBERT MacKINNON,COMMISSIONER ROULEAU,commissioner rouleau
01-035-05,They should appear on ---,01-035-06,35,6,5,speaker_start,OPENING REMARKS BY MR. ROBERT MacKINNON,UNIDENTIFIED MALE SPEAKER,unidentified speaker
01-035-07,"Okay. If the Government of Saskatchewan can go ahead, and I'm not sure if it's Mr. McAdam or Morris?",01-035-08,35,8,7,speaker_start,OPENING REMARKS BY MR. ROBERT MacKINNON,COMMISSIONER ROULEAU,commissioner rouleau
01-035-10,--- OPENING REMARKS BY MR. MICHAEL MORRIS:,01-035-11,35,11,10,section_header,OPENING REMARKS BY MR. MICHAEL MORRIS,NA,NA
01-035-11,"Good morning. My name is Mike Morris, and I'm the Director of Litigation for the Civil Law Branch of Saskatchewan's Ministry of Justice. I'm appearing with my colleague, Mitch McAdam, who is the Director of the Ministry's Constitutional Law Branch. The Government of Saskatchewan has been granted full standing before the Commission and intends to participate in both the evidentiary phase and the policy phase for the proceedings. February 14th was a very significant day from the Government of Saskatchewan's perspective. On the morning of February 14th, a First Ministers call was held. The phone call was chaired by the Prime Minister. That phone call was the first time the Federal Government told the Government of Saskatchewan that it was considering invoking the Emergencies Act and declaring a Public Order Emergency. The Government of Saskatchewan indicated that it did not want the emergency declaration applying within the province, and other provincial governments did the same. Later that day, the Federal Government proclaimed a Public Order Emergency. It was not geographically limited, as requested by Saskatchewan, and other provinces, and as we know, it remained in effect until February 23rd. For its part, the Government of Saskatchewan is primarily interested in four areas, which will be explored in this Inquiry: The first area is whether there were reasonable grounds to believe that circumstances amounting to a public order emergency existed on February 14th. The second area concerns whether the consultation requirement under section 25 of the Act was met. Saskatchewan's position is that the Federal Government had already determined that a nationwide emergency would be declared before the First Ministers' call on February 14th. The call was not so much about consulting, as it was about telling. The third area concerns whether the emergency measures were overbroad. The financial measures, for example, imposed broad responsibilities on financial institutions, with little guidance, and they created offences for not complying with those new responsibilities. The final area concerns to what extent Saskatchewan residents were impacted by the emergency measures. The Government is concerned that residents' rights may have been unnecessarily infringed by these measures. The Government looks forward to participating in the Commission and assisting the Commission in fulfilling its mandate. Thank you.",01-035-12,35,12,11,speaker_start,OPENING REMARKS BY MR. MICHAEL MORRIS,MR. MICHAEL MORRIS,michael morris
01-037-02,"Thank you very much. So the next I have on my list is the Government of Manitoba. Again, I'm not sure if they're online rather than in person. I suspect they're online. Maybe not. Okay, if -- there may be technical issues, so I’m not sure what the status is.",01-037-04,37,4,2,speaker_start,OPENING REMARKS BY MR. MICHAEL MORRIS,COMMISSIONER ROULEAU,commissioner rouleau
01-037-08,"Mr. Commissioner, they don’t appear to be online right now. If they’re listening to this, they can email me and we’ll get them up at a later time. But I think it’s appropriate to move to the next party.",01-037-10,37,10,8,speaker_start,OPENING REMARKS BY MR. MICHAEL MORRIS,MR. JOHN MATHER,john mather
01-037-12,"Okay. So it’s -- that was John Mather who was making that. So if Manitoba is online, they can email Mr. Mather. Next is the Government of Alberta. Again, believe they were supposed to be online. Here they are.",01-037-14,37,14,12,speaker_start,OPENING REMARKS BY MR. MICHAEL MORRIS,COMMISSIONER ROULEAU,commissioner rouleau
01-037-17,Yeah.,01-037-19,37,19,17,speaker_start,OPENING REMARKS BY MR. MICHAEL MORRIS,MS. MANDY ENGLAND,mandy england
01-037-18,"And I’m not sure if that’s -- who is speaking, but I’m sure you’ll introduce yourself. Go ahead.",01-037-20,37,20,18,speaker_start,OPENING REMARKS BY MR. MICHAEL MORRIS,COMMISSIONER ROULEAU,commissioner rouleau
01-037-21,--- OPENING REMARKS BY MS. MANDY ENGLAND:,01-037-23,37,23,21,section_header,OPENING REMARKS BY MS. MANDY ENGLAND,NA,NA
01-037-22,"Good morning. My name is Mandy England and I’m here with my co-lead counsel, Stephanie Bowes. We are lawyers from the Legal Services Division of Alberta Justice and Solicitor General and we represent the Government of Alberta, together with our colleagues, Hana Laura Yamamoto, Peter Buijs, and Shaheer Meenai, who will also be attending as counsel during these hearings. The Government of Alberta applied for standing as a party before this Inquiry for two main reasons. First, Alberta believes it is important to share with Canadians the facts about how Alberta was able to effectively deal with the international border blockade in Coutts, Alberta, prior to the invocation of the Federal Emergencies Act. Alberta’s evidence will show that the existing law enforcement tools that were already in place were completely sufficient and they were successfully used to peacefully restore the flow of traffic at the Coutts Border Crossing and to disperse the protest to a legal protest site. None of the powers that were created under the Federal Emergencies Act were necessary, nor were any of them used in Alberta to resolve the Coutts blockade. Alberta is also here to participate in the process of holding the Federal Government accountable for its decision to invoke the Emergencies Act. Alberta has many questions about how and when that decision was reached, a decision that was made despite the objections that Alberta and other provinces expressed during a phone call placed to the First Ministers on the morning of February 14th, 2022, just hours prior to the announcement that the Federal Emergencies Act would be invoked. Since the Federal Government proclaimed that a public order emergency existed throughout Canada, the Act requires that all of the provinces must be consulted before it can be invoked in that manner, yet Alberta’s views were only asked for after the decision was apparently made, and they were basically ignored. The impact of these measures on the rights of Albertans is of great concern to the Government of Alberta. Alberta is here to find answers for its citizens and for all Canadians. We thank the Commissioner for this opportunity to appear as a party and we look forward to working with the Commission in the weeks to come.",01-037-24,37,24,22,speaker_start,OPENING REMARKS BY MS. MANDY ENGLAND,MS. MANDY ENGLAND,mandy england
01-039-08,"Thank you, Ms. England. So that’s -- those are the provinces who’ve, so far, sought and obtained intervenor or party status. So now I’ll go to the various municipalities, starting with the City of Ottawa. Commençons avec la ville d’Ottawa.",01-039-10,39,10,8,speaker_start,OPENING REMARKS BY MS. MANDY ENGLAND,COMMISSIONER ROULEAU,commissioner rouleau
01-039-14,--- OPENING REMARKS BY MS. ANNE TARDIF:,01-039-16,39,16,14,section_header,OPENING REMARKS BY MS. ANNE TARDIF,NA,NA
01-039-15,"Bonjour. Merci, Monsieur le commissaire pour cette opportunité de nous présenter. My name is Anne Tardif and I’m here with my colleagues, Alyssa Tomkins and Daniel Chomski. We’re all lawyers with the law firm of Gowling WLG and we represent the City of Ottawa. The City is pleased to participate in this public inquiry. And again, we thank the Commissioner for that opportunity. As you are no doubt all aware, the first convoy participants arrived in Ottawa, not far at all, actually, from where we sit today, on January 28th, and they remained in our city for approximately three weeks. I expect you will hear from witnesses about the significant impacts on the City’s residents and businesses, and you will also hear about the City’s efforts to support the police-led response to the convoy, and to mitigate impacts on city services. We’re pleased to be here and we look forward to continuing to assist the Commission with its mandate. Merci.",01-039-17,39,17,15,speaker_start,OPENING REMARKS BY MS. ANNE TARDIF,MS. ANNE TARDIF,anne tardif
01-040-07,"Merci, Maitre Tardif. Alors, la prochaine municipalité… the next city is the City of Windsor, who is also a party.",01-040-09,40,9,7,speaker_start,OPENING REMARKS BY MS. ANNE TARDIF,COMMISSIONER ROULEAU,commissioner rouleau
01-040-10,Good morning.,01-040-12,40,12,10,speaker_start,OPENING REMARKS BY MS. ANNE TARDIF,MS. JENNIFER KING,jennifer king
01-040-11,Good morning.,01-040-13,40,13,11,speaker_start,OPENING REMARKS BY MS. ANNE TARDIF,COMMISSIONER ROULEAU,commissioner rouleau
01-040-12,--- OPENING REMARKS BY MS. JENNIFER KING:,01-040-14,40,14,12,section_header,OPENING REMARKS BY MS. JENNIFER KING,NA,NA
