interjection_id,text_clean_combined,line_id,page,line,transcript_line_number,line_type,section_header,speaker,speaker_standardized
19-078-20,"I don’t think there was really clear direction as to who had to do it, when did it have to be done, could it be done remotely, did it have to be done with them in person? So there was a lot of phone calls back and forth with myself, along with Windsor Police Service, at a time where really we should have just been left alone to focus on the incident itself. So that’s what I mean by more streamlined before RCMP officers arrived to assist.",19-078-22,78,22,20,speaker_start,EXAMINATION IN-CHIEF BY MS. SAJEDA HEDARALY,SUPT. DANA EARLEY,supt. dana earley
19-078-28,And did it cause any delay that you had to change your plan to pair RCMP officers with OPP or Windsor Police Service officers?,19-078-30,78,30,28,speaker_start,EXAMINATION IN-CHIEF BY MS. SAJEDA HEDARALY,MS. SAJEDA HEDARALY,sajeda hedaraly
19-079-03,"No, we just looked for a different option, because obviously we needed them on the frontline. So that’s what we did instead.",19-079-05,79,5,3,speaker_start,EXAMINATION IN-CHIEF BY MS. SAJEDA HEDARALY,SUPT. DANA EARLEY,supt. dana earley
19-079-06,"So if we go to the next day, on February 14th, the Emergencies Act was invoked by the Federal Government.",19-079-08,79,8,6,speaker_start,EXAMINATION IN-CHIEF BY MS. SAJEDA HEDARALY,MS. SAJEDA HEDARALY,sajeda hedaraly
19-079-09,Yes.,19-079-11,79,11,9,speaker_start,EXAMINATION IN-CHIEF BY MS. SAJEDA HEDARALY,SUPT. DANA EARLEY,supt. dana earley
19-079-10,"In your view, did it have any impact on the situation in Windsor?",19-079-12,79,12,10,speaker_start,EXAMINATION IN-CHIEF BY MS. SAJEDA HEDARALY,MS. SAJEDA HEDARALY,sajeda hedaraly
19-079-12,"Well, things were much different then because the traffic was flowing and it’s hard to say if it had any difference. But I do know that, again, it was communicated through our media strategy that people were aware of the additional Act being legislated and what it meant to them, and the definition of certain things, obviously a bridge that fell under the Act.",19-079-14,79,14,12,speaker_start,EXAMINATION IN-CHIEF BY MS. SAJEDA HEDARALY,SUPT. DANA EARLEY,supt. dana earley
19-079-19,Yesterday Deputy Chief Crowley mentioned that it may have been dissuasive to the protestors ---,19-079-21,79,21,19,speaker_start,EXAMINATION IN-CHIEF BY MS. SAJEDA HEDARALY,MS. SAJEDA HEDARALY,sajeda hedaraly
19-079-22,To return.,19-079-24,79,24,22,speaker_start,EXAMINATION IN-CHIEF BY MS. SAJEDA HEDARALY,SUPT. DANA EARLEY,supt. dana earley
19-079-23,--- to come back. Would you agree?,19-079-25,79,25,23,speaker_start,EXAMINATION IN-CHIEF BY MS. SAJEDA HEDARALY,MS. SAJEDA HEDARALY,sajeda hedaraly
19-079-25,"I agree. M’hm. Again, it was another tool that we were able to use.",19-079-27,79,27,25,speaker_start,EXAMINATION IN-CHIEF BY MS. SAJEDA HEDARALY,SUPT. DANA EARLEY,supt. dana earley
19-079-27,Was there a clear plan that you were aware of that the protestors wanted to re-blockade the Ambassador Bridge after it was cleared on the 12th and the 13th?,19-079-29,79,29,27,speaker_start,EXAMINATION IN-CHIEF BY MS. SAJEDA HEDARALY,MS. SAJEDA HEDARALY,sajeda hedaraly
19-080-02,"Yes, we continued to observe and receive intelligence that indicated, I think it was on the date of -- I know it’s in my notes, on the date of the 15th or 16th, there was a Facebook posting that was called Take Back the Bridge, and it was associated to all the things that had -- were then transpiring in Ottawa, and basically the posts were saying, you know, ""everybody's -- all the police are gone to Ottawa, so let's take back the bridge."" That's something that we watched very closely. Also, Windsor Police had had a group of protesters on a regular basis, and I think Deputy Chief Crowley spoke to that, that would meeting during the convoys on a regular basis. So we maintained kind of Intelligence on, you know, what will that group bring. But certainly there was the fear that they would think that numbers were being deployed to Ottawa and then try to take advantage of that and take back the bridge.",19-080-04,80,4,2,speaker_start,EXAMINATION IN-CHIEF BY MS. SAJEDA HEDARALY,SUPT. DANA EARLEY,supt. dana earley
19-080-19,"I think your notes, and I can put them up if that would be helpful, also mention that once the injunction is expired they are looking to blockade again.",19-080-21,80,21,19,speaker_start,EXAMINATION IN-CHIEF BY MS. SAJEDA HEDARALY,MS. SAJEDA HEDARALY,sajeda hedaraly
19-080-22,Yes.,19-080-24,80,24,22,speaker_start,EXAMINATION IN-CHIEF BY MS. SAJEDA HEDARALY,SUPT. DANA EARLEY,supt. dana earley
19-080-23,Was that also a consideration that the injunction was going to expire?,19-080-25,80,25,23,speaker_start,EXAMINATION IN-CHIEF BY MS. SAJEDA HEDARALY,MS. SAJEDA HEDARALY,sajeda hedaraly
19-080-25,"Yes. There was Intelligence that indicated that, that that's what they were considering.",19-080-27,80,27,25,speaker_start,EXAMINATION IN-CHIEF BY MS. SAJEDA HEDARALY,SUPT. DANA EARLEY,supt. dana earley
19-080-27,So did you think that the renewal of the injunction on February 18th was helpful in preventing that?,19-080-29,80,29,27,speaker_start,EXAMINATION IN-CHIEF BY MS. SAJEDA HEDARALY,MS. SAJEDA HEDARALY,sajeda hedaraly
19-081-02,"Well, to those who, yeah, were going to try to take it back after it expired, yes.",19-081-04,81,4,2,speaker_start,EXAMINATION IN-CHIEF BY MS. SAJEDA HEDARALY,SUPT. DANA EARLEY,supt. dana earley
19-081-04,"So as of February 20th, I understand that you adopted a Demobilisation Plan?",19-081-06,81,6,4,speaker_start,EXAMINATION IN-CHIEF BY MS. SAJEDA HEDARALY,MS. SAJEDA HEDARALY,sajeda hedaraly
19-081-06,Correct.,19-081-08,81,8,6,speaker_start,EXAMINATION IN-CHIEF BY MS. SAJEDA HEDARALY,SUPT. DANA EARLEY,supt. dana earley
19-081-07,What is a Demobilisation Plan?,19-081-09,81,9,7,speaker_start,EXAMINATION IN-CHIEF BY MS. SAJEDA HEDARALY,MS. SAJEDA HEDARALY,sajeda hedaraly
19-081-09,"It was a plan to obviously demobilise our resources, not only for officers but just kind of give the incident entirely to Windsor Police Service as soon as they could kind of sustain it themselves. Also, keeping in mind and respecting the fact of that they had calls for service, they had a city to police as well, so we did it in a staged approach. It also included demobilising certain areas of the Traffic Plan. So on a daily basis, sometimes on a, you know, an hourly basis, we would monitor the traffic flow, along with the Intelligence, along with the reports from our Provincial Liaison Team, and what the frontline was seeing, to see if there was areas where we could perhaps remove some of the barriers. So we evaluated that constantly and opened intersections a point at a time. You can see in the Demobilisation Plan that we actually had some dates set out for each intersection to be considered. Some of those dates were met, other dates were actually opened intersections earlier than we anticipated.",19-081-11,81,11,9,speaker_start,EXAMINATION IN-CHIEF BY MS. SAJEDA HEDARALY,SUPT. DANA EARLEY,supt. dana earley
19-081-27,Maybe for the record we could put it up. It's WPS000000719. I believe at page 4. Perhaps scroll down a little bit. Is this what you were referring to?,19-081-29,81,29,27,speaker_start,EXAMINATION IN-CHIEF BY MS. SAJEDA HEDARALY,MS. SAJEDA HEDARALY,sajeda hedaraly
19-082-04,That's correct.,19-082-06,82,6,4,speaker_start,EXAMINATION IN-CHIEF BY MS. SAJEDA HEDARALY,SUPT. DANA EARLEY,supt. dana earley
19-082-05,So I see that the latest potential reopening date is March 13th?,19-082-07,82,7,5,speaker_start,EXAMINATION IN-CHIEF BY MS. SAJEDA HEDARALY,MS. SAJEDA HEDARALY,sajeda hedaraly
19-082-07,Yes.,19-082-09,82,9,7,speaker_start,EXAMINATION IN-CHIEF BY MS. SAJEDA HEDARALY,SUPT. DANA EARLEY,supt. dana earley
19-082-08,Why would it take about three weeks to clear all the intersections?,19-082-10,82,10,8,speaker_start,EXAMINATION IN-CHIEF BY MS. SAJEDA HEDARALY,MS. SAJEDA HEDARALY,sajeda hedaraly
19-082-10,"We -- that was sort of kind of a review of -- based on the information we had when the plan was created. Those two -- the last two intersections were the heavier intersections in regards to protests, and those are the two that are obviously closest to the bridge entrance, so that's why they were kind of put until the end to see how the community as well as the intel and all of that what we were receiving to see how the other intersections were being cleared. Was it being received well? Did we have any other threat of a protest? So that's why it was kind of spanned along that amount of time.",19-082-12,82,12,10,speaker_start,EXAMINATION IN-CHIEF BY MS. SAJEDA HEDARALY,SUPT. DANA EARLEY,supt. dana earley
19-082-20,"Do you know when they were ultimately reopened, the last intersection?",19-082-22,82,22,20,speaker_start,EXAMINATION IN-CHIEF BY MS. SAJEDA HEDARALY,MS. SAJEDA HEDARALY,sajeda hedaraly
19-082-22,I don't. Sorry.,19-082-24,82,24,22,speaker_start,EXAMINATION IN-CHIEF BY MS. SAJEDA HEDARALY,SUPT. DANA EARLEY,supt. dana earley
19-082-23,I understand you stopped being Critical Incident Commander in Windsor on February 23rd?,19-082-25,82,25,23,speaker_start,EXAMINATION IN-CHIEF BY MS. SAJEDA HEDARALY,MS. SAJEDA HEDARALY,sajeda hedaraly
19-082-25,That's correct.,19-082-27,82,27,25,speaker_start,EXAMINATION IN-CHIEF BY MS. SAJEDA HEDARALY,SUPT. DANA EARLEY,supt. dana earley
19-082-26,How was the transition of command from yourself to the Windsor Police Service?,19-082-28,82,28,26,speaker_start,EXAMINATION IN-CHIEF BY MS. SAJEDA HEDARALY,MS. SAJEDA HEDARALY,sajeda hedaraly
19-082-28,"Again, it was seamless. And we worked every day, every night side by side, so really, it was seamless when we left. We just wanted to make sure that Windsor had the proper amount of resources to be able to deal with anything if it should occur. And of course some of our officers remained there until the end of the month, end of February.",19-082-30,82,30,28,speaker_start,EXAMINATION IN-CHIEF BY MS. SAJEDA HEDARALY,SUPT. DANA EARLEY,supt. dana earley
19-083-06,I'd like to take you back to another of your recommendations before we end. You mentioned that the Critical Incident Commander should visit frontline officers and ask them what they need.,19-083-08,83,8,6,speaker_start,EXAMINATION IN-CHIEF BY MS. SAJEDA HEDARALY,MS. SAJEDA HEDARALY,sajeda hedaraly
19-083-10,M'hm.,19-083-12,83,12,10,speaker_start,EXAMINATION IN-CHIEF BY MS. SAJEDA HEDARALY,SUPT. DANA EARLEY,supt. dana earley
19-083-11,I understand that that's something that you did ---,19-083-13,83,13,11,speaker_start,EXAMINATION IN-CHIEF BY MS. SAJEDA HEDARALY,MS. SAJEDA HEDARALY,sajeda hedaraly
19-083-13,"I did, yes.",19-083-15,83,15,13,speaker_start,EXAMINATION IN-CHIEF BY MS. SAJEDA HEDARALY,SUPT. DANA EARLEY,supt. dana earley
19-083-14,--- in Windsor?,19-083-16,83,16,14,speaker_start,EXAMINATION IN-CHIEF BY MS. SAJEDA HEDARALY,MS. SAJEDA HEDARALY,sajeda hedaraly
19-083-15,Yes.,19-083-17,83,17,15,speaker_start,EXAMINATION IN-CHIEF BY MS. SAJEDA HEDARALY,SUPT. DANA EARLEY,supt. dana earley
19-083-16,Is this uncommon?,19-083-18,83,18,16,speaker_start,EXAMINATION IN-CHIEF BY MS. SAJEDA HEDARALY,MS. SAJEDA HEDARALY,sajeda hedaraly
19-083-17,"I think that every Critical Incident Commander attempts to go on ground, it's just because of, again, the dynamic situation, it's not always to do. So once I had an opportunity I did make a point of visiting the different checkpoints to check on the wellness of our members, and when I say ""our members"" I mean any police officer that was out there. I also asked them for their input, if there was anything else that we needed to get done or that we could do better. It was from one of those visits that the interactive posts in regards to the Traffic Plan and updating on a regular basis it came from a frontline officer, saying, you know, ""I'm dealing with a local resident who wasn't sure where the crosswalks were. So could we post it and keep it up-to-date?"" So I took that right back to the Command Post and made sure that that was done right away so that a member of the public at any time just could click on a link and know where the cross the road. So it's those things as well. And most importantly, it's a way to thank them for their efforts, considering that a lot of them had been away from home for quite sometime, and know that their efforts were having an impact.",19-083-19,83,19,17,speaker_start,EXAMINATION IN-CHIEF BY MS. SAJEDA HEDARALY,SUPT. DANA EARLEY,supt. dana earley
19-084-11,"This is the last document that I'll take you to today. If we could please put up OPP00004552, page 26. Those are the scribe notes from February 13th. At 12:17... So if we can scroll down a little bit. ...Commissioner Carrique thanked you for having performed to perfection on world stage. What for you made the Windsor Operation such a success?",19-084-13,84,13,11,speaker_start,EXAMINATION IN-CHIEF BY MS. SAJEDA HEDARALY,MS. SAJEDA HEDARALY,sajeda hedaraly
19-084-20,"The team. Absolutely the team. It was a remarkable collaboration and cooperation. It didn't matter what uniform you were wearing, what rank you were, what role you had, it was a tremendous effort by a remarkable team.",19-084-22,84,22,20,speaker_start,EXAMINATION IN-CHIEF BY MS. SAJEDA HEDARALY,SUPT. DANA EARLEY,supt. dana earley
19-084-25,Is there anything else that you would like to say to the Commission that we haven't asked you this morning?,19-084-27,84,27,25,speaker_start,EXAMINATION IN-CHIEF BY MS. SAJEDA HEDARALY,MS. SAJEDA HEDARALY,sajeda hedaraly
19-084-28,I don't think so at this point. Thank you.,19-084-30,84,30,28,speaker_start,EXAMINATION IN-CHIEF BY MS. SAJEDA HEDARALY,SUPT. DANA EARLEY,supt. dana earley
19-085-02,"Those are all my questions for you, Superintendent. Thank you very much for your time.",19-085-04,85,4,2,speaker_start,EXAMINATION IN-CHIEF BY MS. SAJEDA HEDARALY,MS. SAJEDA HEDARALY,sajeda hedaraly
19-085-04,Thank you.,19-085-06,85,6,4,speaker_start,EXAMINATION IN-CHIEF BY MS. SAJEDA HEDARALY,SUPT. DANA EARLEY,supt. dana earley
19-085-05,"Okay, thank you very much. So I'd like to first call on the Government of Canada. Do you have any questions?",19-085-07,85,7,5,speaker_start,EXAMINATION IN-CHIEF BY MS. SAJEDA HEDARALY,COMMISSIONER ROULEAU,commissioner rouleau
19-085-08,"Thank you, Commissioner.",19-085-10,85,10,8,speaker_start,EXAMINATION IN-CHIEF BY MS. SAJEDA HEDARALY,MS. ANDREA GONSALVES,andrea gonsalves
19-085-09,--- CROSS-EXAMINATION BY MS. ANDREA GONSALVES:,19-085-11,85,11,9,section_header,CROSS-EXAMINATION BY MS. ANDREA GONSALVES,NA,NA
19-085-10,"Good morning, Superintendent.",19-085-12,85,12,10,speaker_start,CROSS-EXAMINATION BY MS. ANDREA GONSALVES,MS. ANDREA GONSALVES,andrea gonsalves
19-085-12,Good morning.,19-085-14,85,14,12,speaker_start,CROSS-EXAMINATION BY MS. ANDREA GONSALVES,SUPT. DANA EARLEY,supt. dana earley
19-085-13,"My name is Andrea Gonsalves, and I am one of the lawyers representing the Government of Canada in this Inquiry. I just want to begin by going back to the information you received, I guess it was late, you had many late nights, so late night on February 9th as to the state of play in Windsor when you were assigned the role of Critical Incident Commander. And in response to questions from Commission Counsel, you'll recall that he pulled up the bullet point email that you sent to the two deputies.",19-085-15,85,15,13,speaker_start,CROSS-EXAMINATION BY MS. ANDREA GONSALVES,MS. ANDREA GONSALVES,andrea gonsalves
19-085-23,Yes.,19-085-25,85,25,23,speaker_start,CROSS-EXAMINATION BY MS. ANDREA GONSALVES,SUPT. DANA EARLEY,supt. dana earley
19-085-24,"And one of the concerns that was raised with you early on, I gather, was the dynamics of the crowd that was engaged in the protest activity; right?",19-085-26,85,26,24,speaker_start,CROSS-EXAMINATION BY MS. ANDREA GONSALVES,MS. ANDREA GONSALVES,andrea gonsalves
19-085-27,Yes.,19-085-29,85,29,27,speaker_start,CROSS-EXAMINATION BY MS. ANDREA GONSALVES,SUPT. DANA EARLEY,supt. dana earley
19-085-28,"Under your direction, PLT teams became engaged early on trying to identify leaders; right?",19-085-30,85,30,28,speaker_start,CROSS-EXAMINATION BY MS. ANDREA GONSALVES,MS. ANDREA GONSALVES,andrea gonsalves
19-086-02,Yes.,19-086-04,86,4,2,speaker_start,CROSS-EXAMINATION BY MS. ANDREA GONSALVES,SUPT. DANA EARLEY,supt. dana earley
19-086-03,"But as you understood from the PLT teams, the protesters were disjointed, disorganised I think were your words; right?",19-086-05,86,5,3,speaker_start,CROSS-EXAMINATION BY MS. ANDREA GONSALVES,MS. ANDREA GONSALVES,andrea gonsalves
19-086-06,Yes; correct.,19-086-08,86,8,6,speaker_start,CROSS-EXAMINATION BY MS. ANDREA GONSALVES,SUPT. DANA EARLEY,supt. dana earley
19-086-07,"And in this kind of a situation, police don't know whether the group will even listen to someone who puts themselves forward as a leader; right?",19-086-09,86,9,7,speaker_start,CROSS-EXAMINATION BY MS. ANDREA GONSALVES,MS. ANDREA GONSALVES,andrea gonsalves
19-086-10,"That's correct, and especially in this instance because we -- nobody was really being identified as a leader.",19-086-12,86,12,10,speaker_start,CROSS-EXAMINATION BY MS. ANDREA GONSALVES,SUPT. DANA EARLEY,supt. dana earley
19-086-13,"Right. And there was -- I understand you spoke about the three groups, there was some infighting among them?",19-086-15,86,15,13,speaker_start,CROSS-EXAMINATION BY MS. ANDREA GONSALVES,MS. ANDREA GONSALVES,andrea gonsalves
19-086-16,Yes.,19-086-18,86,18,16,speaker_start,CROSS-EXAMINATION BY MS. ANDREA GONSALVES,SUPT. DANA EARLEY,supt. dana earley
19-086-17,"And the demands of the group, to the extent they were even known, were problematic.",19-086-19,86,19,17,speaker_start,CROSS-EXAMINATION BY MS. ANDREA GONSALVES,MS. ANDREA GONSALVES,andrea gonsalves
19-086-19,Yes.,19-086-21,86,21,19,speaker_start,CROSS-EXAMINATION BY MS. ANDREA GONSALVES,SUPT. DANA EARLEY,supt. dana earley
19-086-20,Right? I think I saw in your notes of February 10th at OPP00004543 that the protesters had no desire to leave and wanted to remain until all restrictions were lifted. That was your understanding?,19-086-22,86,22,20,speaker_start,CROSS-EXAMINATION BY MS. ANDREA GONSALVES,MS. ANDREA GONSALVES,andrea gonsalves
19-086-24,Yes.,19-086-26,86,26,24,speaker_start,CROSS-EXAMINATION BY MS. ANDREA GONSALVES,SUPT. DANA EARLEY,supt. dana earley
19-086-25,"Your bullet point note to the Deputy Chiefs also talked about the crowd being agitated, and that was true at various times through the protest; right?",19-086-27,86,27,25,speaker_start,CROSS-EXAMINATION BY MS. ANDREA GONSALVES,MS. ANDREA GONSALVES,andrea gonsalves
19-086-28,That's correct.,19-086-30,86,30,28,speaker_start,CROSS-EXAMINATION BY MS. ANDREA GONSALVES,SUPT. DANA EARLEY,supt. dana earley
19-087-01,"In your notes again February 10th, I saw that you described a wilder crowd arriving at night?",19-087-03,87,3,1,speaker_start,CROSS-EXAMINATION BY MS. ANDREA GONSALVES,MS. ANDREA GONSALVES,andrea gonsalves
19-087-04,Yes.,19-087-06,87,6,4,speaker_start,CROSS-EXAMINATION BY MS. ANDREA GONSALVES,SUPT. DANA EARLEY,supt. dana earley
19-087-05,That's when the drinking and the pot smoking would begin?,19-087-07,87,7,5,speaker_start,CROSS-EXAMINATION BY MS. ANDREA GONSALVES,MS. ANDREA GONSALVES,andrea gonsalves
19-087-07,Yes.,19-087-09,87,9,7,speaker_start,CROSS-EXAMINATION BY MS. ANDREA GONSALVES,SUPT. DANA EARLEY,supt. dana earley
19-087-08,Yes. And Inspector Younan described the crowd dynamics as being violent; do you remember that?,19-087-10,87,10,8,speaker_start,CROSS-EXAMINATION BY MS. ANDREA GONSALVES,MS. ANDREA GONSALVES,andrea gonsalves
19-087-11,Yes.,19-087-13,87,13,11,speaker_start,CROSS-EXAMINATION BY MS. ANDREA GONSALVES,SUPT. DANA EARLEY,supt. dana earley
19-087-12,"We heard evidence from Deputy Chief Crowley yesterday, but I just want to confirm, you were also aware from the briefings you received that there had been threats to surround and storm police station?",19-087-14,87,14,12,speaker_start,CROSS-EXAMINATION BY MS. ANDREA GONSALVES,MS. ANDREA GONSALVES,andrea gonsalves
19-087-16,"Yes, as well as the tunnel.",19-087-18,87,18,16,speaker_start,CROSS-EXAMINATION BY MS. ANDREA GONSALVES,SUPT. DANA EARLEY,supt. dana earley
19-087-17,The tunnel? Right. Officers were swarmed when they tried to arrest the individual whose car jumped the curb?,19-087-19,87,19,17,speaker_start,CROSS-EXAMINATION BY MS. ANDREA GONSALVES,MS. ANDREA GONSALVES,andrea gonsalves
19-087-20,That's correct.,19-087-22,87,22,20,speaker_start,CROSS-EXAMINATION BY MS. ANDREA GONSALVES,SUPT. DANA EARLEY,supt. dana earley
19-087-21,There had been threats when attempts were made to tow two vehicles prior to your arrival?,19-087-23,87,23,21,speaker_start,CROSS-EXAMINATION BY MS. ANDREA GONSALVES,MS. ANDREA GONSALVES,andrea gonsalves
19-087-24,Yes.,19-087-26,87,26,24,speaker_start,CROSS-EXAMINATION BY MS. ANDREA GONSALVES,SUPT. DANA EARLEY,supt. dana earley
19-087-25,You heard about a possible protest at the Windsor Airport?,19-087-27,87,27,25,speaker_start,CROSS-EXAMINATION BY MS. ANDREA GONSALVES,MS. ANDREA GONSALVES,andrea gonsalves
19-087-27,That I did not.,19-087-29,87,29,27,speaker_start,CROSS-EXAMINATION BY MS. ANDREA GONSALVES,SUPT. DANA EARLEY,supt. dana earley
19-087-28,Okay.,19-087-30,87,30,28,speaker_start,CROSS-EXAMINATION BY MS. ANDREA GONSALVES,MS. ANDREA GONSALVES,andrea gonsalves
19-088-01,No.,19-088-03,88,3,1,speaker_start,CROSS-EXAMINATION BY MS. ANDREA GONSALVES,SUPT. DANA EARLEY,supt. dana earley
19-088-02,You heard about a smoke bomb that was set off by demonstrators at one point?,19-088-04,88,4,2,speaker_start,CROSS-EXAMINATION BY MS. ANDREA GONSALVES,MS. ANDREA GONSALVES,andrea gonsalves
19-088-04,Yes.,19-088-06,88,6,4,speaker_start,CROSS-EXAMINATION BY MS. ANDREA GONSALVES,SUPT. DANA EARLEY,supt. dana earley
19-088-05,"And a bit later on in the piece, but there was a bomb threat called in about a bomb that was behind the police lines; is that correct?",19-088-07,88,7,5,speaker_start,CROSS-EXAMINATION BY MS. ANDREA GONSALVES,MS. ANDREA GONSALVES,andrea gonsalves
19-088-08,That is correct.,19-088-10,88,10,8,speaker_start,CROSS-EXAMINATION BY MS. ANDREA GONSALVES,SUPT. DANA EARLEY,supt. dana earley
19-088-09,"There had also been threats made to the mayor, his address was posted online. You knew about that?",19-088-11,88,11,9,speaker_start,CROSS-EXAMINATION BY MS. ANDREA GONSALVES,MS. ANDREA GONSALVES,andrea gonsalves
19-088-12,"Yes, I was aware.",19-088-14,88,14,12,speaker_start,CROSS-EXAMINATION BY MS. ANDREA GONSALVES,SUPT. DANA EARLEY,supt. dana earley
19-088-13,"And this was all, you would accurately say -- or you'd say this was accurately described as a volatile situation?",19-088-15,88,15,13,speaker_start,CROSS-EXAMINATION BY MS. ANDREA GONSALVES,MS. ANDREA GONSALVES,andrea gonsalves
19-088-16,Yes.,19-088-18,88,18,16,speaker_start,CROSS-EXAMINATION BY MS. ANDREA GONSALVES,SUPT. DANA EARLEY,supt. dana earley
19-088-17,There -- then you throw into the mix the presence of children; right?,19-088-19,88,19,17,speaker_start,CROSS-EXAMINATION BY MS. ANDREA GONSALVES,MS. ANDREA GONSALVES,andrea gonsalves
19-088-19,Correct.,19-088-21,88,21,19,speaker_start,CROSS-EXAMINATION BY MS. ANDREA GONSALVES,SUPT. DANA EARLEY,supt. dana earley
19-088-20,One of your biggest concerns throughout the piece?,19-088-22,88,22,20,speaker_start,CROSS-EXAMINATION BY MS. ANDREA GONSALVES,MS. ANDREA GONSALVES,andrea gonsalves
19-088-22,Yes.,19-088-24,88,24,22,speaker_start,CROSS-EXAMINATION BY MS. ANDREA GONSALVES,SUPT. DANA EARLEY,supt. dana earley
19-088-23,And I take it that the concern about the presence of children was based on what officers were seeing actually happening on the ground at the protest site; right?,19-088-25,88,25,23,speaker_start,CROSS-EXAMINATION BY MS. ANDREA GONSALVES,MS. ANDREA GONSALVES,andrea gonsalves
19-088-27,That's correct.,19-088-29,88,29,27,speaker_start,CROSS-EXAMINATION BY MS. ANDREA GONSALVES,SUPT. DANA EARLEY,supt. dana earley
19-088-28,Not just information being collected online?,19-088-30,88,30,28,speaker_start,CROSS-EXAMINATION BY MS. ANDREA GONSALVES,MS. ANDREA GONSALVES,andrea gonsalves
19-089-02,"No, we were witnessing it.",19-089-04,89,4,2,speaker_start,CROSS-EXAMINATION BY MS. ANDREA GONSALVES,SUPT. DANA EARLEY,supt. dana earley
19-089-03,"You were witnessing it. Yesterday, in questions to Deputy Chief Crowley, one of the counsel for one of the parties pulled up a situation report that was dated 0400 hours that indicated no children were observed on scene. That was 0400 hours on February 12th. Can you explain how that reconciles, if it does, with the information you received of children on site?",19-089-05,89,5,3,speaker_start,CROSS-EXAMINATION BY MS. ANDREA GONSALVES,MS. ANDREA GONSALVES,andrea gonsalves
19-089-10,"It was always very apparent the children on site were at certain times in the day and that they were not staying overnight. So the information at 0400, the children were not present did not surprise me because information before revealed that the children were going home at night and not returning until sometimes 9, 10 a.m.",19-089-12,89,12,10,speaker_start,CROSS-EXAMINATION BY MS. ANDREA GONSALVES,SUPT. DANA EARLEY,supt. dana earley
19-089-16,Okay. You also spoke -- you testified in response to questions from Commission Counsel about the increased risk of counter protests.,19-089-18,89,18,16,speaker_start,CROSS-EXAMINATION BY MS. ANDREA GONSALVES,MS. ANDREA GONSALVES,andrea gonsalves
19-089-19,"Yes, right.",19-089-21,89,21,19,speaker_start,CROSS-EXAMINATION BY MS. ANDREA GONSALVES,SUPT. DANA EARLEY,supt. dana earley
