interjection_id,text_clean_combined,line_id,page,line,transcript_line_number,line_type,section_header,speaker,speaker_standardized
02-250-27,"And then at page 1, we see -- so rolling up. There’s a picture there that we’re rolling up. And you said: “Hi, Chief. See below. What can we do? These seem to be extremely dangerous, life safety, and emergency response challenges. Not sure why OPS wouldn’t have accessed Château Laurier via Saint Patrick and Mackenzie Avenue.” (As read) Did you ever get a substantive response to that, sir?",02-250-29,250,29,27,speaker_start,CROSS-EXAMINATION BY MR. PAUL CHAMP,MR. PAUL CHAMP,paul champ
02-251-10,No.,02-251-12,251,12,10,speaker_start,CROSS-EXAMINATION BY MR. PAUL CHAMP,COUNCILLOR MATHIEU FLEURY,councillor mathieu fleury
02-251-11,"Thank you. Hearing Clerk, Ottawa 8282. Thank you very much. And I’ll take you on this one to the third page, if I could, Hearing Clerk. Keep going. Yeah, there we go. Perfect. There we go. So this is an email from Mr. Brian O’Hoski again from the Rideau Centre to yourself and Andrew Peck, that’s with the Downtown Rideau BIA, on February 15th. And here, Mr. O’Hoski is setting out that issue, he’s setting out a number of issues, problems with the Rideau/Sussex intersection. And then he says: “On a side note, Lamoureux Pumping had parked a red pick-up truck in my underground parking with a diesel fuel supply tank in the back and protesters were going back and forth filling portable gas cans and carrying them out to the demonstration.” (As read) The last sentence is: “That truck is still in my parking lot and I was not supported by bylaw. It’s been over 24 hours.” (As read) That’s the incident you were telling us about before, Councillor Fleury?",02-251-13,251,13,11,speaker_start,CROSS-EXAMINATION BY MR. PAUL CHAMP,MR. PAUL CHAMP,paul champ
02-252-07,"Yeah, correct. This says a 9-1-1 call that went un-responded to.",02-252-09,252,9,7,speaker_start,CROSS-EXAMINATION BY MR. PAUL CHAMP,COUNCILLOR MATHIEU FLEURY,councillor mathieu fleury
02-252-09,"Then you get an email from the Council Liaison saying, “Hello, Councillor Fleury,” and then a few other things. And then it says: “The tow was booked for this evening. However, the vehicle left the parking lot beforehand. We’ll continue to monitor the situation.” (As read) And your response to that is -- if you roll up? That’s great right there. No, down a bit. “Thanks for the support, Mat. Obviously I’m glad the truck is gone, but this does raise some major concerns for us. Between the three groups, OPS, Bylaw, and Regulatory Services, still couldn’t manage to tow a single pedestrian vehicle that was engaged in illegal activity from a private lot in a 36-hour window.” (As read) So that was your understanding? It was there for 36 hours?",02-252-11,252,11,9,speaker_start,CROSS-EXAMINATION BY MR. PAUL CHAMP,MR. PAUL CHAMP,paul champ
02-253-01,Yes. And not removed by authorities.,02-253-03,253,3,1,speaker_start,CROSS-EXAMINATION BY MR. PAUL CHAMP,COUNCILLOR MATHIEU FLEURY,councillor mathieu fleury
02-253-03,"Thank God no one was injured there. You then -- or pardon me, that’s actually from Mr. O’Hoski. That’s not you. That’s Mr. -- that’s the Rideau Centre saying that.",02-253-05,253,5,3,speaker_start,CROSS-EXAMINATION BY MR. PAUL CHAMP,MR. PAUL CHAMP,paul champ
02-253-08,Correct.,02-253-10,253,10,8,speaker_start,CROSS-EXAMINATION BY MR. PAUL CHAMP,COUNCILLOR MATHIEU FLEURY,councillor mathieu fleury
02-253-09,"You then forward that on to Mr. Ayotte: “See below from the Rideau Centre. What should I answer him? I think he raises a fair point.” (As read) And Mr. Ayotte then writes this longish sort of email to you, and you respond -- if you just go up a bit, roll up, there’s the long from Mr. Ayotte, and then just roll up just a little bit more there. Great. And you just, in a one word -- sentence in response, that says: “I don’t believe this to be satisfactory.” (As read) What was -- why weren’t you happy with that email or why did you find it to be unsatisfactory?",02-253-11,253,11,9,speaker_start,CROSS-EXAMINATION BY MR. PAUL CHAMP,MR. PAUL CHAMP,paul champ
02-253-24,It’s not the type of relationship I’m accustomed to between an important stakeholder and the City of Ottawa.,02-253-26,253,26,24,speaker_start,CROSS-EXAMINATION BY MR. PAUL CHAMP,COUNCILLOR MATHIEU FLEURY,councillor mathieu fleury
02-253-27,And then Mr. Ayotte responds: “This is the answer and I’ll leave it up to you to decide if you want to send it.” (As read) So was that a little bit of the tone of your communications with your own Manager of Emergency Operations?,02-253-29,253,29,27,speaker_start,CROSS-EXAMINATION BY MR. PAUL CHAMP,MR. PAUL CHAMP,paul champ
02-254-05,Yes.,02-254-07,254,7,5,speaker_start,CROSS-EXAMINATION BY MR. PAUL CHAMP,COUNCILLOR MATHIEU FLEURY,councillor mathieu fleury
02-254-06,"Ottawa 7352. Great. And just roll down a little bit. Perfect. So this is an email that you received from Mr. O’Hoski again on February 15th about -- raising concerns about the Rideau -- sorry, that was the one we just had.",02-254-08,254,8,6,speaker_start,CROSS-EXAMINATION BY MR. PAUL CHAMP,MR. PAUL CHAMP,paul champ
02-254-11,That’s the same ---,02-254-13,254,13,11,speaker_start,CROSS-EXAMINATION BY MR. PAUL CHAMP,COUNCILLOR MATHIEU FLEURY,councillor mathieu fleury
02-254-12,"Sorry about that. Apologies. But just up a bit. “Hi Diane and Deputy Chief Bell.” So you decided after those exchanges with Ms. Ayotte, you wanted to forward it on to Ms. Deans, the Chair of the ---",02-254-14,254,14,12,speaker_start,CROSS-EXAMINATION BY MR. PAUL CHAMP,MR. PAUL CHAMP,paul champ
02-254-17,Police Services Board.,02-254-19,254,19,17,speaker_start,CROSS-EXAMINATION BY MR. PAUL CHAMP,COUNCILLOR MATHIEU FLEURY,councillor mathieu fleury
02-254-19,And Deputy Chief Bell; why did you send it on to them?,02-254-21,254,21,19,speaker_start,CROSS-EXAMINATION BY MR. PAUL CHAMP,MR. PAUL CHAMP,paul champ
02-254-21,"I’m not known to give up on things that I think are incorrect. I mean I felt that the response not only was inadequate for the seriousness of the situation, but also raised a number of other risk factors that could go unanswered.",02-254-23,254,23,21,speaker_start,CROSS-EXAMINATION BY MR. PAUL CHAMP,COUNCILLOR MATHIEU FLEURY,councillor mathieu fleury
02-254-26,"Just for time, Councillor, there’s a couple of other documents I was going to put to you but I’m not going to do that, about some concerns about schools, that there was some concerns that schools are raising about the convoy, or it seems to be convoy associated trucks. Can you just tell us what you knew about that?",02-254-28,254,28,26,speaker_start,CROSS-EXAMINATION BY MR. PAUL CHAMP,MR. PAUL CHAMP,paul champ
02-255-04,"All the -- so I am francophone and the francophone -- both the francophone boards did connect with me. There are schools in both of our areas and they were wondering what was police recommending, if they should operate or not, they had issues for their staff to get to work, parents were raising concerns and there were a number of incidents where their parking lot was used by a pick-up with flags in the context of the school; and there had been on social media a number of threats of “go attack the school; go around the schools” and, you know, that sort of drove a lot of the concerns from the school boards. And we heard it separately from parents on those same issues. And the Ottawa Police Liaison Team did connect with them in this case. They were -- in the two or three schools that I can think about that were most concerned, the OPS liaison did meet with the principal and I don’t know what ensued of that, but -- the rare communication I got back and forth with police on, in that specific instances, they did take it serious.",02-255-06,255,6,4,speaker_start,CROSS-EXAMINATION BY MR. PAUL CHAMP,COUNCILLOR MATHIEU FLEURY,councillor mathieu fleury
02-255-22,"Councillor McKenney, on that issue, on schools in your ward, were you hearing concerns about that from those schools or parents with children in those schools?",02-255-24,255,24,22,speaker_start,CROSS-EXAMINATION BY MR. PAUL CHAMP,MR. PAUL CHAMP,paul champ
02-255-26,"Yes, from Centennial, which is close to ---",02-255-28,255,28,26,speaker_start,CROSS-EXAMINATION BY MR. PAUL CHAMP,COUNCILLOR CATHERINE McKENNEY,councillor catherine mckenney
02-255-28,About six blocks?,02-255-30,255,30,28,speaker_start,CROSS-EXAMINATION BY MR. PAUL CHAMP,MR. PAUL CHAMP,paul champ
02-256-01,"It’s about six blocks from here, yes. And also Devonshire, which is not in the Ward I represent, it’s just on the -- just to the west a block or two. But after Pat King had encouraged, you know, people -- his supporters to go around schools, I heard from several parents that that was actually happening in and around Devonshire and I brought that to the attention of Chief Sloly.",02-256-03,256,3,1,speaker_start,CROSS-EXAMINATION BY MR. PAUL CHAMP,COUNCILLOR CATHERINE McKENNEY,councillor catherine mckenney
02-256-08,"And Pat King, that’s one of the organizers that we’ll be hearing from later in the Inquiry. If I could get document Ottawa 30002. Now, Councillors, while I’m waiting for this document, I want to ask you both about like the diesel fumes and so forth that was happening downtown. I’ll just ask you first, Councillor Fleury, were you hearing anything from City staff about any concerns about air quality or the health impacts of diesel fumes in downtown Ottawa from these 400 odd trucks arriving all the time?",02-256-10,256,10,8,speaker_start,CROSS-EXAMINATION BY MR. PAUL CHAMP,MR. PAUL CHAMP,paul champ
02-256-17,"No, we were worried. That is one of the aspects around noise and fumes where Council was pretty supportive of our request saying what are the strategies, what are the risks? And the media and experts in that world sort of were speaking publicly to that matter, but we saw few actions to -- other than the injunction, to actually resolve that.",02-256-19,256,19,17,speaker_start,CROSS-EXAMINATION BY MR. PAUL CHAMP,COUNCILLOR MATHIEU FLEURY,councillor mathieu fleury
02-256-24,"And Councillor McKenney, the same for you. Were you hearing from City staff about issues around air quality because of the diesel fumes in downtown Ottawa?",02-256-26,256,26,24,speaker_start,CROSS-EXAMINATION BY MR. PAUL CHAMP,MR. PAUL CHAMP,paul champ
02-256-28,"No, I never heard from City staff on that issue.",02-256-30,256,30,28,speaker_start,CROSS-EXAMINATION BY MR. PAUL CHAMP,COUNCILLOR CATHERINE McKENNEY,councillor catherine mckenney
02-257-02,And what about -- but were you hearing from residents about what they were experiencing?,02-257-04,257,4,2,speaker_start,CROSS-EXAMINATION BY MR. PAUL CHAMP,MR. PAUL CHAMP,paul champ
02-257-04,"Oh, absolutely. The smell of diesel fumes on Kent Street and in that, you know, the center of the occupation, was actually -- made you feel ill after you were there about half an hour or an hour or so. I heard from residents daily about their concerns.",02-257-06,257,6,4,speaker_start,CROSS-EXAMINATION BY MR. PAUL CHAMP,COUNCILLOR CATHERINE McKENNEY,councillor catherine mckenney
02-257-09,"So this document that I’ve pulled up, it’s an email that you guys did not get, but we see some of the people in on the to’s and the from’s, a Kelly Cochrane, a Todd Piper, Trisha Karam -- that was with the Ottawa Police –- Staff Roberts of the police, Michelle Ferguson with Ottawa. Do you know some of those people, are you familiar with any of those officials or police officers?",02-257-11,257,11,9,speaker_start,CROSS-EXAMINATION BY MR. PAUL CHAMP,MR. PAUL CHAMP,paul champ
02-257-16,I’m not.,02-257-18,257,18,16,speaker_start,CROSS-EXAMINATION BY MR. PAUL CHAMP,COUNCILLOR MATHIEU FLEURY,councillor mathieu fleury
02-257-17,I’m familiar with one of the ---,02-257-19,257,19,17,speaker_start,CROSS-EXAMINATION BY MR. PAUL CHAMP,COUNCILLOR CATHERINE McKENNEY,councillor catherine mckenney
02-257-19,The Public Health.,02-257-21,257,21,19,speaker_start,CROSS-EXAMINATION BY MR. PAUL CHAMP,COUNCILLOR MATHIEU FLEURY,councillor mathieu fleury
02-257-20,"The Public Health names, but ---",02-257-22,257,22,20,speaker_start,CROSS-EXAMINATION BY MR. PAUL CHAMP,COUNCILLOR CATHERINE McKENNEY,councillor catherine mckenney
02-257-22,"So this is an email that was sent, disclosed by the City of Ottawa, sent on February the 18th: “Subject: Message from Ottawa Public Health Regarding Convoy- related Air Quality Concerns” and the author writes: “Good morning; sharing with you messaging that OPH ...” (As read) Ottawa Public Health: “... requested that we share with our colleagues who are working or travelling in the P-Z.” (As read) I’m not sure if you know what -- is that a City acronym or something, the P-Z”?",02-257-24,257,24,22,speaker_start,CROSS-EXAMINATION BY MR. PAUL CHAMP,MR. PAUL CHAMP,paul champ
02-258-06,I’ve never heard it before I saw this.,02-258-08,258,8,6,speaker_start,CROSS-EXAMINATION BY MR. PAUL CHAMP,COUNCILLOR CATHERINE McKENNEY,councillor catherine mckenney
02-258-08,"And here is a long email; you’ve had a chance to see this and then I’ll be sharing -- that there’s concerns here about the air quality and about the health impacts from Health Canada as noted, as well as Ottawa Public Health. Had that information been shared with you at the time?",02-258-10,258,10,8,speaker_start,CROSS-EXAMINATION BY MR. PAUL CHAMP,MR. PAUL CHAMP,paul champ
02-258-15,No.,02-258-17,258,17,15,speaker_start,CROSS-EXAMINATION BY MR. PAUL CHAMP,COUNCILLOR MATHIEU FLEURY,councillor mathieu fleury
02-258-16,No.,02-258-18,258,18,16,speaker_start,CROSS-EXAMINATION BY MR. PAUL CHAMP,COUNCILLOR CATHERINE McKENNEY,councillor catherine mckenney
02-258-17,"About the potential: “... the protest become entrenched and had become an ongoing occupation and potential risk and exposure of diesel exhaust and well documented health concerns has increased for those in the impacted areas. As a result, we would like to bring this to your attention and ask that you share this with any agency conducting health and safety risk assessments during the event.” (As read) So that wasn’t brought to your attention?",02-258-19,258,19,17,speaker_start,CROSS-EXAMINATION BY MR. PAUL CHAMP,MR. PAUL CHAMP,paul champ
02-259-02,No.,02-259-04,259,4,2,speaker_start,CROSS-EXAMINATION BY MR. PAUL CHAMP,COUNCILLOR CATHERINE McKENNEY,councillor catherine mckenney
02-259-03,"Councillor McKenney, can I get a document, Ottawa OTT364? While we’re waiting for that, I’d just like to ask you, Councillor Fleury, you’ve told us a bit about the personal impact to you and it was after you had gone on social media talking about fundraising; is that right?",02-259-05,259,5,3,speaker_start,CROSS-EXAMINATION BY MR. PAUL CHAMP,MR. PAUL CHAMP,paul champ
02-259-09,"Yeah, I was saying the only way we’re going to see an end to this, is to stop funding -- stop the funding.",02-259-11,259,11,9,speaker_start,CROSS-EXAMINATION BY MR. PAUL CHAMP,COUNCILLOR MATHIEU FLEURY,councillor mathieu fleury
02-259-12,All right. And who were you trying to communicate to when you put that message out on social media?,02-259-14,259,14,12,speaker_start,CROSS-EXAMINATION BY MR. PAUL CHAMP,MR. PAUL CHAMP,paul champ
02-259-15,"I’m a local City Councillor who represents the residents in my community and businesses and within our City. So it’s hard to control that within social media, I hear you, but my communication is to my residents and businesses.",02-259-17,259,17,15,speaker_start,CROSS-EXAMINATION BY MR. PAUL CHAMP,COUNCILLOR MATHIEU FLEURY,councillor mathieu fleury
02-259-20,And you were referring to the millions of dollars that was being raised on gofundme to support and keep the protestors here in Ottawa; is that right?,02-259-22,259,22,20,speaker_start,CROSS-EXAMINATION BY MR. PAUL CHAMP,MR. PAUL CHAMP,paul champ
02-259-23,Correct.,02-259-25,259,25,23,speaker_start,CROSS-EXAMINATION BY MR. PAUL CHAMP,COUNCILLOR MATHIEU FLEURY,councillor mathieu fleury
02-259-24,"And you were looking for some solutions, and whether the City could do something to stop the flow of that money to those individuals?",02-259-26,259,26,24,speaker_start,CROSS-EXAMINATION BY MR. PAUL CHAMP,MR. PAUL CHAMP,paul champ
02-259-27,Correct.,02-259-29,259,29,27,speaker_start,CROSS-EXAMINATION BY MR. PAUL CHAMP,COUNCILLOR MATHIEU FLEURY,councillor mathieu fleury
02-259-28,All right. And then how far did that social media go that you heard about?,02-259-30,259,30,28,speaker_start,CROSS-EXAMINATION BY MR. PAUL CHAMP,MR. PAUL CHAMP,paul champ
02-260-03,"Yeah, I mean we had to shut down the platforms and as I said, a few hours later people showed up at my house -- again, I’m a local City Councillor finding myself on Fox News and gets to describe the situation.",02-260-05,260,5,3,speaker_start,CROSS-EXAMINATION BY MR. PAUL CHAMP,COUNCILLOR MATHIEU FLEURY,councillor mathieu fleury
02-260-08,"We have this document up, Councillor McKenney, it’s an email from a Jessica Bradley; who is that?",02-260-10,260,10,8,speaker_start,CROSS-EXAMINATION BY MR. PAUL CHAMP,MR. PAUL CHAMP,paul champ
02-260-11,Jessica is the Assistant to Diane Deans.,02-260-13,260,13,11,speaker_start,CROSS-EXAMINATION BY MR. PAUL CHAMP,COUNCILLOR CATHERINE McKENNEY,councillor catherine mckenney
02-260-13,"And this is an email on February the 4th, 2022, “Subject: Block through Centertown” and it’s addressed “Catherine, Sean and Jeff”; those are two other City Councillors saying: “I’m writing this morning to strongly encourage you not to move forward with your planned walk through Centretown today.” (As read) Just for time, not to go through the whole thing, but what was the message you were getting from Councillor Dean’s office as the representative from the Ottawa Police Services Board?",02-260-15,260,15,13,speaker_start,CROSS-EXAMINATION BY MR. PAUL CHAMP,MR. PAUL CHAMP,paul champ
02-260-24,"Yes, I believe this came from Councillor Deans through Jessica Bradley’s email, but we were -- we were organizing walks; this would have been the first one that we were organizing. And Councillor Deans did have, you know, certainly concerns, serious concerns that, you know, they would – it would cause resources to be redirected from other areas that police were focussed on. And, you know, she also called me to explain that, you know, she understands why I was doing and why I felt I needed to do what I was doing, but that she was afraid that it would encourage further violence.",02-260-26,260,26,24,speaker_start,CROSS-EXAMINATION BY MR. PAUL CHAMP,COUNCILLOR CATHERINE McKENNEY,councillor catherine mckenney
02-261-07,"Councillor Fleury, there’s one other question I was going to ask you about the By-law, and both of you a little bit. The way you were kind of describing it, outside the red zone there was some enforcement of by-law that you were observing but it seemed to be selective?",02-261-09,261,9,7,speaker_start,CROSS-EXAMINATION BY MR. PAUL CHAMP,MR. PAUL CHAMP,paul champ
02-261-13,Correct.,02-261-15,261,15,13,speaker_start,CROSS-EXAMINATION BY MR. PAUL CHAMP,COUNCILLOR MATHIEU FLEURY,councillor mathieu fleury
02-261-14,A bit of selective enforcement that it seems trucks associated with the convey weren’t getting tickets but residents in Ottawa were getting tickets?,02-261-16,261,16,14,speaker_start,CROSS-EXAMINATION BY MR. PAUL CHAMP,MR. PAUL CHAMP,paul champ
02-261-17,"I described it the other way, but your assumptions align with what I’ve been describing. Correct.",02-261-19,261,19,17,speaker_start,CROSS-EXAMINATION BY MR. PAUL CHAMP,COUNCILLOR MATHIEU FLEURY,councillor mathieu fleury
02-261-20,"I’d like to get document Ottawa 29762. Now, Councillors, I want to ask you about one big event that occurred part way through, and that was the removal of the Chair of the Ottawa Police Services Board, and another member of the Police Services Board by motion, and then -- which led to then a few others resigning. That event, as you may recall, there was an Ottawa City Council meeting on February 16th, 2022. We’ve got the in-camera minutes now for that. You participated in that debate that day?",02-261-22,261,22,20,speaker_start,CROSS-EXAMINATION BY MR. PAUL CHAMP,MR. PAUL CHAMP,paul champ
02-262-02,I did.,02-262-04,262,4,2,speaker_start,CROSS-EXAMINATION BY MR. PAUL CHAMP,COUNCILLOR MATHIEU FLEURY,councillor mathieu fleury
02-262-03,Yes.,02-262-05,262,5,3,speaker_start,CROSS-EXAMINATION BY MR. PAUL CHAMP,COUNCILLOR CATHERINE McKENNEY,councillor catherine mckenney
02-262-04,"Councillors, this was a motion brought by one of your colleagues, Councillor Moffatt, to remove Councillor Deans from the Police Services Board? Is that right, Councillor Fleury?",02-262-06,262,6,4,speaker_start,CROSS-EXAMINATION BY MR. PAUL CHAMP,MR. PAUL CHAMP,paul champ
02-262-08,Correct.,02-262-10,262,10,8,speaker_start,CROSS-EXAMINATION BY MR. PAUL CHAMP,COUNCILLOR MATHIEU FLEURY,councillor mathieu fleury
02-262-09,"And Councillor McKenney, you participated in that debate that day?",02-262-11,262,11,9,speaker_start,CROSS-EXAMINATION BY MR. PAUL CHAMP,MR. PAUL CHAMP,paul champ
02-262-11,"Yes, I did.",02-262-13,262,13,11,speaker_start,CROSS-EXAMINATION BY MR. PAUL CHAMP,COUNCILLOR CATHERINE McKENNEY,councillor catherine mckenney
02-262-12,"Okay. And just for point of time, we’ve seen some of the comments that you’ve made, both of you, but I do have one -- or a couple of questions for each of you. If I could go to page 4? And down near the bottom. Yeah, that’s perfect. You’ll see there: “Councillor McKenney noted that save for a few councillors that had reached out to them and offered help, other members had done nothing. They indicated they’d not received any calls from the City Manager or the General Manager of Emergency, Protected Services. The councillor noted that Councillor Deans had reached out. Councillor McKenney expressed opposition to the motion to remove members from the Ottawa Police Board, arguing it was a power grab.” (As read) Can you tell us -- oh, I apologize, it goes over to the next page. Sorry.",02-262-14,262,14,12,speaker_start,CROSS-EXAMINATION BY MR. PAUL CHAMP,MR. PAUL CHAMP,paul champ
02-263-05,Scroll down ---,02-263-07,263,7,5,speaker_start,CROSS-EXAMINATION BY MR. PAUL CHAMP,COMMISSIONER ROULEAU,commissioner rouleau
02-263-06,"Scroll down to the next page. I apologize. Can you tell us, what was the point that you were making there, Councillor McKenney? What was your concern about the removal of the Chair of the Ottawa Police Services Board in the middle of this crisis in the city?",02-263-08,263,8,6,speaker_start,CROSS-EXAMINATION BY MR. PAUL CHAMP,MR. PAUL CHAMP,paul champ
02-263-12,"Well this was February 16th. This was the day that I called into council from Kent Street and then I rushed home on LRT to get back in time for in-camera. I had to be in the secure space. So I had just gotten back to my home. The notion that Councillor Deans would be removed as Chair of the Police Services Board in what was the middle of, you know, a crisis in our city, we had a police chief who had resigned, we needed action. We needed stability. I was terrified of going into another weekend where, you know, the actions of harassment and intimidation were just increasing every weekend. And I felt very strongly that the Mayor and some members of council, but certainly the Mayor, was using this to take away any influence that Councillor Deans had vis a vie the Police Services Board and I referred to it as a power grab.",02-263-14,263,14,12,speaker_start,CROSS-EXAMINATION BY MR. PAUL CHAMP,COUNCILLOR CATHERINE McKENNEY,councillor catherine mckenney
02-263-27,Do you recall how much did you have about this motion and what its objective or purpose was?,02-263-29,263,29,27,speaker_start,CROSS-EXAMINATION BY MR. PAUL CHAMP,MR. PAUL CHAMP,paul champ
02-264-01,"Not -- in that afternoon -- that afternoon, I figured it was coming. I had been in contact with Councillor Deans. I was trying to do everything I could to get resolution to what was happening. So I did have -- there was some indication that, you know, that there was something happening. I wasn’t brought into those conversations, of course, but when the motion dropped, it was -- it had never been communicated to me anyway.",02-264-03,264,3,1,speaker_start,CROSS-EXAMINATION BY MR. PAUL CHAMP,COUNCILLOR CATHERINE McKENNEY,councillor catherine mckenney
02-264-09,"And this has been -- sorry, Councillor Fleury.",02-264-11,264,11,9,speaker_start,CROSS-EXAMINATION BY MR. PAUL CHAMP,MR. PAUL CHAMP,paul champ
02-264-11,"I just think, you know, we see it maybe a bit differently for different reasons, but you have to consider the day.",02-264-13,264,13,11,speaker_start,CROSS-EXAMINATION BY MR. PAUL CHAMP,COUNCILLOR MATHIEU FLEURY,councillor mathieu fleury
02-264-14,Yeah.,02-264-16,264,16,14,speaker_start,CROSS-EXAMINATION BY MR. PAUL CHAMP,MR. PAUL CHAMP,paul champ
02-264-15,"We have a council meeting that’s booked early afternoon with the Police Services Board in the morning. That Police Services Board pushes this into the evening. When we get out of that -- when they get out of that Police Services Board, we’re informed that the Chief is no longer the Chief.",02-264-17,264,17,15,speaker_start,CROSS-EXAMINATION BY MR. PAUL CHAMP,COUNCILLOR MATHIEU FLEURY,councillor mathieu fleury
02-264-21,Right.,02-264-23,264,23,21,speaker_start,CROSS-EXAMINATION BY MR. PAUL CHAMP,MR. PAUL CHAMP,paul champ
