interjection_id,text_clean_combined,line_id,page,line,transcript_line_number,line_type,section_header,speaker,speaker_standardized
27-099-25,"What we've testified to is that we did not made a determination that the event itself -- we -- and I think it's part of our testimony, yes.",27-099-27,99,27,25,speaker_start,CROSS-EXAMINATION BY MR. HATIM KHEIR,MR. DAVID VIGNEAULT,david vigneault
27-099-28,Okay. And yet you still advised the Prime Minister to invoke the Emergencies Act?,27-099-30,99,30,28,speaker_start,CROSS-EXAMINATION BY MR. HATIM KHEIR,MR. HATIM KHEIR,hatim kheir
27-100-02,"Yes, I did.",27-100-04,100,4,2,speaker_start,CROSS-EXAMINATION BY MR. HATIM KHEIR,MR. DAVID VIGNEAULT,david vigneault
27-100-03,"And you did that not because you thought that there was -- the protest posed the threat to the security of Canada as defined in section 2 of the CSIS Act, but because you were reassured the threat to the security of Canada had a different meaning under the -- in the context of the Emergencies Act?",27-100-05,100,5,3,speaker_start,CROSS-EXAMINATION BY MR. HATIM KHEIR,MR. HATIM KHEIR,hatim kheir
27-100-09,"I think my testimony was in part that, but it was also based on all of the other information that, you know, I became aware of during all of the interdepartmental meetings and Cabinet meetings I participated in. So it was -- I was provided -- that opinion was provided, if you want, as a national security advisor as opposed to a -- the Director of CSIS specifically.",27-100-11,100,11,9,speaker_start,CROSS-EXAMINATION BY MR. HATIM KHEIR,MR. DAVID VIGNEAULT,david vigneault
27-100-16,"Okay. And when you say that information that you had received, you're referring to your earlier comment that you were reassured that that definition had a broader meaning under the Emergencies Act?",27-100-18,100,18,16,speaker_start,CROSS-EXAMINATION BY MR. HATIM KHEIR,MR. HATIM KHEIR,hatim kheir
27-100-20,"I was referring to that, but also more specifically to whether events in Canada, events, you know, in Ottawa that, you know, convinced me to say that, you know, the powers under the Act would be necessary.",27-100-22,100,22,20,speaker_start,CROSS-EXAMINATION BY MR. HATIM KHEIR,MR. DAVID VIGNEAULT,david vigneault
27-100-24,Okay. So just my final question.,27-100-26,100,26,24,speaker_start,CROSS-EXAMINATION BY MR. HATIM KHEIR,MR. HATIM KHEIR,hatim kheir
27-100-26,"Well, you better get at it ---",27-100-28,100,28,26,speaker_start,CROSS-EXAMINATION BY MR. HATIM KHEIR,COMMISSIONER ROULEAU,commissioner rouleau
27-100-28,"The very last question. The -- this determination then that the Emergencies Act standard is a -- the definition is broader under the Emergencies Act than with respect to under the CSIS Act, that was not the product of you reading the Emergencies Act and developing your own assessment. That was something -- that was advice that you had received?",27-100-30,100,30,28,speaker_start,CROSS-EXAMINATION BY MR. HATIM KHEIR,MR. HATIM KHEIR,hatim kheir
27-101-07,That's correct.,27-101-09,101,9,7,speaker_start,CROSS-EXAMINATION BY MR. HATIM KHEIR,MR. DAVID VIGNEAULT,david vigneault
27-101-08,"Okay. Thank you very much, and thank you for the indulgence, Mr. Commissioner.",27-101-10,101,10,8,speaker_start,CROSS-EXAMINATION BY MR. HATIM KHEIR,MR. HATIM KHEIR,hatim kheir
27-101-10,"Thank you. CCLA, please.",27-101-12,101,12,10,speaker_start,CROSS-EXAMINATION BY MR. HATIM KHEIR,COMMISSIONER ROULEAU,commissioner rouleau
27-101-12,--- CROSS-EXAMINATION BY MS. CARA ZWIBEL:,27-101-14,101,14,12,section_header,CROSS-EXAMINATION BY MS. CARA ZWIBEL,NA,NA
27-101-13,"Good morning. My name is Cara Zwibel. I am Counsel for the Canadian Civil Liberties Association. I just maybe want to pick up where my friend just left off. And maybe we could pull up the summary of -- the public version of the summary of the hearing that took place, the in-camera hearing, which is WTS.00000079, please? And I think it’s page 8 that we want to go to. Thank you, Mr. Clerk. And you can just scroll down to the bottom. So this statement, Mr. Vigneault, and I’m going to direct my questions to you, but if your colleagues have things they’d like to add, please do. This statement that your: “…understanding that the Emergencies Act definition of threat to the security of Canada was broader than the CSIS Act, …” Where did you get that understanding? I know Mr. Cameron said maybe we’d hear about it later, but I’d like to hear about it now.",27-101-15,101,15,13,speaker_start,CROSS-EXAMINATION BY MS. CARA ZWIBEL,MS. CARA ZWIBEL,cara zwibel
27-102-05,So I asked for a legal interpretation.,27-102-07,102,7,5,speaker_start,CROSS-EXAMINATION BY MS. CARA ZWIBEL,MR. DAVID VIGNEAULT,david vigneault
27-102-07,Okay. You asked the Department of Justice?,27-102-09,102,9,7,speaker_start,CROSS-EXAMINATION BY MS. CARA ZWIBEL,MS. CARA ZWIBEL,cara zwibel
27-102-09,I did.,27-102-11,102,11,9,speaker_start,CROSS-EXAMINATION BY MS. CARA ZWIBEL,MR. DAVID VIGNEAULT,david vigneault
27-102-10,"Okay. Thank you. Now, I just want to -- if we could scroll down a little bit more? This is maybe a grammar or a language point that I want to understand. It says: “…he advised the Prime Minister of his belief that it was indeed required to invoke the Act.” Is that “it” referring to the Government? That the Government was required to invoke the Act? Or that the Prime Minister? Or?",27-102-12,102,12,10,speaker_start,CROSS-EXAMINATION BY MS. CARA ZWIBEL,MS. CARA ZWIBEL,cara zwibel
27-102-20,"I’m not sure, ---",27-102-22,102,22,20,speaker_start,CROSS-EXAMINATION BY MS. CARA ZWIBEL,MR. DAVID VIGNEAULT,david vigneault
27-102-21,Okay.,27-102-23,102,23,21,speaker_start,CROSS-EXAMINATION BY MS. CARA ZWIBEL,MS. CARA ZWIBEL,cara zwibel
27-102-22,--- honestly.,27-102-24,102,24,22,speaker_start,CROSS-EXAMINATION BY MS. CARA ZWIBEL,MR. DAVID VIGNEAULT,david vigneault
27-102-23,But your view was that ---,27-102-25,102,25,23,speaker_start,CROSS-EXAMINATION BY MS. CARA ZWIBEL,MS. CARA ZWIBEL,cara zwibel
27-102-24,Yeah. I think ---,27-102-26,102,26,24,speaker_start,CROSS-EXAMINATION BY MS. CARA ZWIBEL,MR. DAVID VIGNEAULT,david vigneault
27-102-25,--- based on this broader understanding ---,27-102-27,102,27,25,speaker_start,CROSS-EXAMINATION BY MS. CARA ZWIBEL,MS. CARA ZWIBEL,cara zwibel
27-102-27,Yes.,27-102-29,102,29,27,speaker_start,CROSS-EXAMINATION BY MS. CARA ZWIBEL,MR. DAVID VIGNEAULT,david vigneault
27-102-28,"--- of threats to the security of Canada, the Act should be invoked?",27-102-30,102,30,28,speaker_start,CROSS-EXAMINATION BY MS. CARA ZWIBEL,MS. CARA ZWIBEL,cara zwibel
27-103-02,Yes.,27-103-04,103,4,2,speaker_start,CROSS-EXAMINATION BY MS. CARA ZWIBEL,MR. DAVID VIGNEAULT,david vigneault
27-103-03,"Okay. So I just want to go through -- and Mr. Cameron went through some of the timeline here. You had an interview with Commission Counsel on, I believe it was August 29th? And in that interview, you noted that you had only learned that the Emergencies Act referred to the CSIS definition of threats to the security of Canada when the Government started to explore the possibility of invoking the Act? Is that right?",27-103-05,103,5,3,speaker_start,CROSS-EXAMINATION BY MS. CARA ZWIBEL,MS. CARA ZWIBEL,cara zwibel
27-103-11,"Yes, that’s accurate.",27-103-13,103,13,11,speaker_start,CROSS-EXAMINATION BY MS. CARA ZWIBEL,MR. DAVID VIGNEAULT,david vigneault
27-103-12,"Okay. And then Commission Counsel prepared a summary of that meeting, that interview, with you and your colleagues. We’ve seen that and that was produced earlier. And then you had this in-camera proceeding that took place. And I understand that again you confirmed that it was CSIS’ view that the definition of threats to the security of Canada in the CSIS Act was not met during the convoy?",27-103-14,103,14,12,speaker_start,CROSS-EXAMINATION BY MS. CARA ZWIBEL,MS. CARA ZWIBEL,cara zwibel
27-103-20,Yes.,27-103-22,103,22,20,speaker_start,CROSS-EXAMINATION BY MS. CARA ZWIBEL,MR. DAVID VIGNEAULT,david vigneault
27-103-21,"Okay. And then under examination from the Government of Canada, this information that you advised the Prime Minister of your view that the Act should be invoked was disclosed for the first time? Is that right?",27-103-23,103,23,21,speaker_start,CROSS-EXAMINATION BY MS. CARA ZWIBEL,MS. CARA ZWIBEL,cara zwibel
27-103-25,"Yes, I believe it is, yeah.",27-103-27,103,27,25,speaker_start,CROSS-EXAMINATION BY MS. CARA ZWIBEL,MR. DAVID VIGNEAULT,david vigneault
27-103-26,"So you said in your initial witness statement that you felt it was important to communicate at the IRG and to Cabinet that under CSIS’ analysis, there wasn’t a section 2 threat?",27-103-28,103,28,26,speaker_start,CROSS-EXAMINATION BY MS. CARA ZWIBEL,MS. CARA ZWIBEL,cara zwibel
27-104-02,"What I wanted to be very clear, Mr. Commissioner, is that because it was very dynamic environment, very -- you know, a lot of moving parts, as we say, and I wanted people to be clear about how CSIS, we were analysing the situation. And so people were talking about using different words in the media, everywhere, and we just wanted to bring a level of clarity. So that’s why we said our assessment was very dynamic, and we continued to assess, but throughout that period, we wanted to make sure that people did not misinterpret based on everything that, you know, was being mentioned, that CSIS, we saw a threat to national security based on our Act. So that was the purpose of us being very deliberate about that approach.",27-104-04,104,4,2,speaker_start,CROSS-EXAMINATION BY MS. CARA ZWIBEL,MR. DAVID VIGNEAULT,david vigneault
27-104-15,"Okay. I guess -- I mean, you understand that the purpose -- one of the purposes of this Commission is to assess whether the Act was properly invoked? Sorry, can you just answer audibly?",27-104-17,104,17,15,speaker_start,CROSS-EXAMINATION BY MS. CARA ZWIBEL,MS. CARA ZWIBEL,cara zwibel
27-104-19,Yes.,27-104-21,104,21,19,speaker_start,CROSS-EXAMINATION BY MS. CARA ZWIBEL,MR. DAVID VIGNEAULT,david vigneault
27-104-20,Thank you. And I guess I’m wondering why you didn’t think it was relevant when you met with Commission Counsel in August to note that you had in fact advised the Prime Minister that you believed the Act should be invoked?,27-104-22,104,22,20,speaker_start,CROSS-EXAMINATION BY MS. CARA ZWIBEL,MS. CARA ZWIBEL,cara zwibel
27-104-25,"I think there are probably two reasons. I would say one is that very simply the question was not asked, and so just, you know, when you go through the dynamic, you know, process of the interview, so it did not -- I was not specifically asked. But it was also at that point, you know, lack of clarity in my head about what still a Cabinet confidence and what would be what I was able to say as a participant in Cabinet meetings. So that was further clarified throughout that period. And that’s why I think, again, Ms. Zwibel, you mentioned, you know, the nature of this Commission. As a senior official in government, you know, we’re never allowed to speak about Cabinet confidences. We’re never allowed, in the case of CSIS, to produce, you know, a number of the information that has been, you know, put in front of -- in public for Commission and for Canadians to see. Normally that would not be public. So just needed to ascertain, you know, what were the limits of what we’re able to do. And when it was clarified with me that indeed I was able to speak to that, I did.",27-104-27,104,27,25,speaker_start,CROSS-EXAMINATION BY MS. CARA ZWIBEL,MR. DAVID VIGNEAULT,david vigneault
27-105-17,"Okay. But when you met with Commission Counsel in August, you felt that -- you didn’t feel that Cabinet confidence prevented you from advising that you had advised Cabinet and the IRG that you did not believe there was a threat within the meaning of the CSIS Act?",27-105-19,105,19,17,speaker_start,CROSS-EXAMINATION BY MS. CARA ZWIBEL,MS. CARA ZWIBEL,cara zwibel
27-105-22,"That had been clarified with me, yes.",27-105-24,105,24,22,speaker_start,CROSS-EXAMINATION BY MS. CARA ZWIBEL,MR. DAVID VIGNEAULT,david vigneault
27-105-24,"Okay. Because I would put to you that those two pieces of information are really two sides of the same coin, that if one is not subject to Cabinet confidentiality, the other one also would not be?",27-105-26,105,26,24,speaker_start,CROSS-EXAMINATION BY MS. CARA ZWIBEL,MS. CARA ZWIBEL,cara zwibel
27-105-28,"I understand that analysis, but I would say that this referred back to what I said, we never discuss Cabinet confidences and, you know, the information, the way that the information was communicated to witnesses in terms of what would be possible to disclose and not, in terms of Cabinet confidences, just became clearer with the passage of time, you know, between, you know, August and our ex-party interview.",27-105-30,105,30,28,speaker_start,CROSS-EXAMINATION BY MS. CARA ZWIBEL,MR. DAVID VIGNEAULT,david vigneault
27-106-08,Okay. Thank you. I don’t know if you had an opportunity to review the testimony given by Ms. Thomas? The National Security and Intelligence Advisor?,27-106-10,106,10,8,speaker_start,CROSS-EXAMINATION BY MS. CARA ZWIBEL,MS. CARA ZWIBEL,cara zwibel
27-106-11,"I briefly saw some of the key extracts, yes.",27-106-13,106,13,11,speaker_start,CROSS-EXAMINATION BY MS. CARA ZWIBEL,MR. DAVID VIGNEAULT,david vigneault
27-106-13,Okay. So one of the things that Ms. Thomas said was that the CSIS definition of threats to the security of Canada is quite narrow. Do you agree with that? That it’s a narrow definition?,27-106-15,106,15,13,speaker_start,CROSS-EXAMINATION BY MS. CARA ZWIBEL,MS. CARA ZWIBEL,cara zwibel
27-106-17,"I would say that the CSIS Act was enacted in 1984 and I think that the world has evolved considerably since then, and that looking at the threat environment today is indeed, you know, requires probably a new look, modernizing, you knew, view of this. That’s one thing. The second thing is that we also, through jurisprudence, through Federal Court rulings, Commission of Inquiries, and review bodies who have access to all of our information, that understanding of the Act was very much more clarified, and so very -- with a lot of specificity, if you want, in many aspects. And so between, you know, experts at CSIS and DOJ counsel, I think, you know, there is a very specific interpretation of the Act which is, in this specific case with the Commission, different than the Emergencies Act.",27-106-19,106,19,17,speaker_start,CROSS-EXAMINATION BY MS. CARA ZWIBEL,MR. DAVID VIGNEAULT,david vigneault
27-107-03,"Okay. So and I mean, you understand, of course, why, and I think you’ve alluded to this in other statements that you’ve made here today and in your witness statement, that there should be a high threshold before our intelligence services start surveilling or targeting Canadians? Would you agree with that?",27-107-05,107,5,3,speaker_start,CROSS-EXAMINATION BY MS. CARA ZWIBEL,MS. CARA ZWIBEL,cara zwibel
27-107-09,"Yes, I do agree.",27-107-11,107,11,9,speaker_start,CROSS-EXAMINATION BY MS. CARA ZWIBEL,MR. DAVID VIGNEAULT,david vigneault
27-107-10,Okay. The holding or expressing of unpopular political views should not be enough to engage CSIS’ mandate?,27-107-12,107,12,10,speaker_start,CROSS-EXAMINATION BY MS. CARA ZWIBEL,MS. CARA ZWIBEL,cara zwibel
27-107-13,"Absolutely not. And I would say that there is an expression that we use, which is awful but lawful. And that means that some of the opinions expressed verbally or online, you know, are not, by default, even if they can be extremely violent, are not, by default, something that, you know, would allow or necessitate CSIS to investigate.",27-107-15,107,15,13,speaker_start,CROSS-EXAMINATION BY MS. CARA ZWIBEL,MR. DAVID VIGNEAULT,david vigneault
27-107-20,"Okay. And do you understand why -- now, I know you take the view that the definition in the Emergencies Act is broader, but would you agree that the threshold to invoke the use of the Emergencies Act should also be a high one?",27-107-22,107,22,20,speaker_start,CROSS-EXAMINATION BY MS. CARA ZWIBEL,MS. CARA ZWIBEL,cara zwibel
27-107-25,"I would say that with anything, any exercise of power by the state, you know, there is a high threshold. I’m not a legal expert to say, you know, what should be the threshold of the Emergencies Act.",27-107-27,107,27,25,speaker_start,CROSS-EXAMINATION BY MS. CARA ZWIBEL,MR. DAVID VIGNEAULT,david vigneault
27-108-01,Okay. But you understand that the Emergencies Act allows the government to rule by executive order for a period of time?,27-108-03,108,3,1,speaker_start,CROSS-EXAMINATION BY MS. CARA ZWIBEL,MS. CARA ZWIBEL,cara zwibel
27-108-04,I do.,27-108-06,108,6,4,speaker_start,CROSS-EXAMINATION BY MS. CARA ZWIBEL,MR. DAVID VIGNEAULT,david vigneault
27-108-05,"Okay. And that the Public Order Emergency Section of the Emergencies Act allows those orders to let the Government assume control of public utilities, for example?",27-108-07,108,7,5,speaker_start,CROSS-EXAMINATION BY MS. CARA ZWIBEL,MS. CARA ZWIBEL,cara zwibel
27-108-09,Yes.,27-108-11,108,11,9,speaker_start,CROSS-EXAMINATION BY MS. CARA ZWIBEL,MR. DAVID VIGNEAULT,david vigneault
27-108-10,"And it allows the government to direct individuals to render certain services, like was done in this case with the tow trucks.",27-108-12,108,12,10,speaker_start,CROSS-EXAMINATION BY MS. CARA ZWIBEL,MS. CARA ZWIBEL,cara zwibel
27-108-13,"That’s my understanding, but again, I do not want to give the Commission the impression that I’m an expert on the Emergencies Act.",27-108-15,108,15,13,speaker_start,CROSS-EXAMINATION BY MS. CARA ZWIBEL,MR. DAVID VIGNEAULT,david vigneault
27-108-16,"Okay. And you understand that it can prohibit travel to, from, or within any specified area; that’s one of the things that the Public Order Emergency section allows?",27-108-18,108,18,16,speaker_start,CROSS-EXAMINATION BY MS. CARA ZWIBEL,MS. CARA ZWIBEL,cara zwibel
27-108-20,"I would say yes, with the same caveat I just provided.",27-108-22,108,22,20,speaker_start,CROSS-EXAMINATION BY MS. CARA ZWIBEL,MR. DAVID VIGNEAULT,david vigneault
27-108-22,Okay.,27-108-24,108,24,22,speaker_start,CROSS-EXAMINATION BY MS. CARA ZWIBEL,MS. CARA ZWIBEL,cara zwibel
27-108-23,"Okay, you’re now out of time.",27-108-25,108,25,23,speaker_start,CROSS-EXAMINATION BY MS. CARA ZWIBEL,COMMISSIONER ROULEAU,commissioner rouleau
27-108-25,Oh. Thank you.,27-108-27,108,27,25,speaker_start,CROSS-EXAMINATION BY MS. CARA ZWIBEL,MS. CARA ZWIBEL,cara zwibel
27-108-26,So if you could wrap up.,27-108-28,108,28,26,speaker_start,CROSS-EXAMINATION BY MS. CARA ZWIBEL,COMMISSIONER ROULEAU,commissioner rouleau
27-108-27,"Just one last question. The placement that you were taken to by Ms. Khan that talked about the IMVE, the nature of ideologically motivated violent extremism, two of those of elements were willingness to kill or willingness to engage in serious violence. Would you agree with me that without those two elements, you just have people who care a lot about something and want to make a change?",27-108-29,108,29,27,speaker_start,CROSS-EXAMINATION BY MS. CARA ZWIBEL,MS. CARA ZWIBEL,cara zwibel
27-109-06,"I’ll answer that question. That’s exactly why we developed the criteria as to what should be looked at in this space, in this IMVE space, was to ensure that those criteria were met before we opened an investigation.",27-109-08,109,8,6,speaker_start,CROSS-EXAMINATION BY MS. CARA ZWIBEL,MS. MICHELLE TESSIER,michelle tessier
27-109-11,"Thank you. Thank you, Commissioner.",27-109-13,109,13,11,speaker_start,CROSS-EXAMINATION BY MS. CARA ZWIBEL,MS. CARA ZWIBEL,cara zwibel
27-109-13,"Okay. Thank you. We’re ready to go? Okay. Convoy organizers, please. (SHORT PAUSE)",27-109-15,109,15,13,speaker_start,CROSS-EXAMINATION BY MS. CARA ZWIBEL,COMMISSIONER ROULEAU,commissioner rouleau
27-109-17,"Robert MacKinnon, Government of Canada. We just received what I think my friend is going to put up on the screen, and it is not what had been agreed to. It has commentary; it has statements, along with the document. If that’s what is going to be put up, at least -- it was just sent around by the Freedom Corp. just a few minutes ago.",27-109-19,109,19,17,speaker_start,CROSS-EXAMINATION BY MS. CARA ZWIBEL,MR. ROBERT MacKINNON,robert mackinnon
27-109-24,"Lesser version of the one we sent earlier and took out everything except simple facts. There’s some documents that are such that I can’t just copy and paste them into a document, they’re PDFs and things, so I had to type them out, but they’re verbatim. So if my friend wants me to refer to each and every document, which I’ve now made it simple as well, I’ve had all of them uploaded in one PDF; the Clerk has them on standby. As we go through, I have no problem deviating from this at all and going through the document, but I would like to finish the examination, at least, if I’m forced to do that, in order to get through these records. These records, there’s -- in my view, I would submit, as we go through, that there’s simply no issue with the facts stated herein.",27-109-26,109,26,24,speaker_start,CROSS-EXAMINATION BY MS. CARA ZWIBEL,MR. BRENDAN MILLER,brendan miller
27-110-10,Did you say there is a PDF with all of them on it?,27-110-12,110,12,10,speaker_start,CROSS-EXAMINATION BY MS. CARA ZWIBEL,COMMISSIONER ROULEAU,commissioner rouleau
27-110-12,I had that uploaded just now. So I got them -- all of them consolidated and put into one PDF so that I can stop wasting ---,27-110-14,110,14,12,speaker_start,CROSS-EXAMINATION BY MS. CARA ZWIBEL,MR. BRENDAN MILLER,brendan miller
27-110-15,Why can’t we use it?,27-110-17,110,17,15,speaker_start,CROSS-EXAMINATION BY MS. CARA ZWIBEL,COMMISSIONER ROULEAU,commissioner rouleau
27-110-16,"Well, we can if we want. It’s just going to have to -- I have to navigate it. So -- because it’s not exactly labelled completely great. So I guess we could -- can we use that? Yeah, we can use that, sure.",27-110-18,110,18,16,speaker_start,CROSS-EXAMINATION BY MS. CARA ZWIBEL,MR. BRENDAN MILLER,brendan miller
27-110-21,"That would be best, I think.",27-110-23,110,23,21,speaker_start,CROSS-EXAMINATION BY MS. CARA ZWIBEL,COMMISSIONER ROULEAU,commissioner rouleau
27-110-23,Yeah.,27-110-25,110,25,23,speaker_start,CROSS-EXAMINATION BY MS. CARA ZWIBEL,MR. BRENDAN MILLER,brendan miller
27-110-24,Then we avoid any issues.,27-110-26,110,26,24,speaker_start,CROSS-EXAMINATION BY MS. CARA ZWIBEL,COMMISSIONER ROULEAU,commissioner rouleau
27-110-25,"Great, okay. Time begin now?",27-110-27,110,27,25,speaker_start,CROSS-EXAMINATION BY MS. CARA ZWIBEL,MR. BRENDAN MILLER,brendan miller
27-110-27,"You’ve already taken a fair amount of your time, but I’ll be generous.",27-110-29,110,29,27,speaker_start,CROSS-EXAMINATION BY MS. CARA ZWIBEL,COMMISSIONER ROULEAU,commissioner rouleau
27-111-01,Okay.,27-111-03,111,3,1,speaker_start,CROSS-EXAMINATION BY MS. CARA ZWIBEL,MR. BRENDAN MILLER,brendan miller
27-111-02,"Just -- Robert MacKinnon again. Sorry; last thing. Just as long as the documents that you’re referring to, you have I don’t know how many here ---",27-111-04,111,4,2,speaker_start,CROSS-EXAMINATION BY MS. CARA ZWIBEL,MR. ROBERT MacKINNON,robert mackinnon
27-111-06,They’re all the ones that I -- document that I’ve given you already. The one that ---,27-111-08,111,8,6,speaker_start,CROSS-EXAMINATION BY MS. CARA ZWIBEL,MR. BRENDAN MILLER,brendan miller
27-111-08,So they’re all in relativity?,27-111-10,111,10,8,speaker_start,CROSS-EXAMINATION BY MS. CARA ZWIBEL,MR. ROBERT MacKINNON,robert mackinnon
27-111-10,"Pretty much, yeah.",27-111-12,111,12,10,speaker_start,CROSS-EXAMINATION BY MS. CARA ZWIBEL,MR. BRENDAN MILLER,brendan miller
27-111-11,"No, no.",27-111-13,111,13,11,speaker_start,CROSS-EXAMINATION BY MS. CARA ZWIBEL,MR. ROBERT MacKINNON,robert mackinnon
27-111-12,"All of those are in relativity because that document is in relativity. So if we could pull up the document, and I just don’t want to run out of time.",27-111-14,111,14,12,speaker_start,CROSS-EXAMINATION BY MS. CARA ZWIBEL,MR. BRENDAN MILLER,brendan miller
27-111-16,"Okay. So let’s see how it goes, and I’ll try and keep an eye out for you, Mr. MacKinnon, if there’s an issue.",27-111-18,111,18,16,speaker_start,CROSS-EXAMINATION BY MS. CARA ZWIBEL,COMMISSIONER ROULEAU,commissioner rouleau
27-111-19,--- CROSS-EXAMINATION BY MR. BRENDAN MILLER:,27-111-21,111,21,19,section_header,CROSS-EXAMINATION BY MR. BRENDAN MILLER,NA,NA
27-111-20,"Okay. So if I can first -- Director, does CSIS have a concern with the current elected executive leaking information and CSIS information to the media? Do they have a current concern about that?",27-111-22,111,22,20,speaker_start,CROSS-EXAMINATION BY MR. BRENDAN MILLER,MR. BRENDAN MILLER,brendan miller
27-111-24,Do you have something specific you can refer to?,27-111-26,111,26,24,speaker_start,CROSS-EXAMINATION BY MR. BRENDAN MILLER,MR. DAVID VIGNEAULT,david vigneault
27-111-26,"No, not specific. Does CSIS have a concern generally about the current political executive leaking information from CSIS to the media?",27-111-28,111,28,26,speaker_start,CROSS-EXAMINATION BY MR. BRENDAN MILLER,MR. BRENDAN MILLER,brendan miller
27-112-01,"We always have concern when we see information that is, you know, unauthorizedly, you know, made public. I don’t know where the source of that -- of those unauthorized disclosures are, so I do not have a specific view on your premise. I’m concerned when I see unauthorized disclosure.",27-112-03,112,3,1,speaker_start,CROSS-EXAMINATION BY MR. BRENDAN MILLER,MR. DAVID VIGNEAULT,david vigneault
