interjection_id,text_clean_combined,line_id,page,line,transcript_line_number,line_type,section_header,speaker,speaker_standardized
01-008-02,"--- Upon commencing on Thursday, October 13, 2022 at 9:30 a.m.",01-008-03,8,3,2,proceedings_start,NA,NA,NA
01-008-03,Order. À l’ordre. The Public Emergency Commission is now in session. La Commission sur l’état d’urgence est maintenant ouverte. Please be seated. Veuillez vous asseoir.,01-008-04,8,4,3,speaker_start,NA,THE REGISTRAR,the registrar
01-008-07,--- OPENING REMARKS BY COMMISSIONER ROULEAU:,01-008-08,8,8,7,section_header,OPENING REMARKS BY COMMISSIONER ROULEAU,NA,NA
