interjection_id,text_clean_combined,line_id,page,line,transcript_line_number,line_type,section_header,speaker,speaker_standardized
27-193-10,Okay. And so this is the third of your three attempts to table a tripart meeting and the third time that Ontario is missing in action and you referred to a statement from Ontario that your meetings will accomplish nothing. Is that what you’re saying there? Is that what you’d heard from Ontario?,27-193-12,193,12,10,speaker_start,EXAMINATION IN-CHIEF BY MR. GORDON CAMERON,MR. GORDON CAMERON,gordon cameron
27-193-16,I believe that’s what I’m referencing to. I don’t have a memory of that statement at this moment but I think clearly my statement -- my comment here is that there was a statement suggesting the table would accomplish nothing.,27-193-18,193,18,16,speaker_start,EXAMINATION IN-CHIEF BY MR. GORDON CAMERON,MINISTER WILLIAM BLAIR,minister william blair
27-193-21,Right. And then there’s a discussion between you and -- I take it that’s you and the mayor?,27-193-23,193,23,21,speaker_start,EXAMINATION IN-CHIEF BY MR. GORDON CAMERON,MR. GORDON CAMERON,gordon cameron
27-193-24,"Yes sir, myself, the mayor, I believe as well -- I believe the City Manager, and Minister Mendicino, of course, were on that call.",27-193-26,193,26,24,speaker_start,EXAMINATION IN-CHIEF BY MR. GORDON CAMERON,MINISTER WILLIAM BLAIR,minister william blair
27-193-27,"Right. And there’s -- you say, “Good point” -- or sorry, the mayor says: ""Good point."" And you say -- refine a point he’s trying to make and then the mayor says in the third line: ""I can say that I’m disappointed that the province has not come to the table. Premier is telling me ‘anything you want’, but then there is silence."" Now, we’ve already heard from the mayor and he’s given his side of this but, from your perspective, was -- were you disappointed that Ontario hadn’t participated in these meetings so far, and was it your sense that the mayor was also disappointed that Ontario, at least at the level you had hoped to have participation, hadn’t shown up at that meetings?",27-193-29,193,29,27,speaker_start,EXAMINATION IN-CHIEF BY MR. GORDON CAMERON,MR. GORDON CAMERON,gordon cameron
27-194-14,"Frankly, I had hoped that we would be able to convene the tripartite table as I had originally planned it, but I was -- you know, this was on the 10th. By that date, I was receiving assurances that, you know, for example, Deputy Minister Stewart was in regular contact with his counterpart in Ontario, Deputy Minister Di Tomasso, and that there was ongoing discussions between my Government Operations Centre, between the Deputy Minister of Public Safety, and between, as -- frankly, the Deputy Minister of Public Safety, Mr. Stewart, was acting as an interlocutor between both municipality and the province in these circumstances. And so yes, a little disappointed that the minister wasn’t able to attend but quite gratified, frankly, in that there was now, I think, and my goal had been, good communication between the three orders of government. I believed that that was being achieved.",27-194-16,194,16,14,speaker_start,EXAMINATION IN-CHIEF BY MR. GORDON CAMERON,MINISTER WILLIAM BLAIR,minister william blair
27-195-02,"That is helpful, thank you. And the other point, again, the mayor wasn’t only -- as you’ll recall because I think you might say you got an earful from him as well, was the mayor wasn’t just disappointed in Ontario. And the notes, which I don’t think you need to be taken to to remember because you probably had some of the same frustration experiencing these exchanges as one gets just reading them, which is the mayor seems very frustrated that he cannot get the support from either Ontario or from Ottawa in terms of boots on the ground in Ottawa of, in particular, federal -- he’d be looking to you for commitments with respect to the RCMP and there seems to be almost interminable confusion about how many are committed, how many are actually there, different ways of counting how many people are there. Were you able to participate usefully in that discussion? Did you have good lines of communication to the RCMP, because it doesn’t seem that much was being accomplished on that front in these meetings?",27-195-04,195,4,2,speaker_start,EXAMINATION IN-CHIEF BY MR. GORDON CAMERON,MR. GORDON CAMERON,gordon cameron
27-195-20,"Minster Mendicino is the minister with direct lines of communication to the Commission of the RCMP and that organization. That’s his responsibility. He was on this call and made a number of comments in response to the mayor’s, as I recall from those discussions. One of the things I tried to contribute to this discussion is that it wasn’t just a numbers plan; it wasn’t just about how many people. And in fact, I pointed out that it’s actually difficult to start talking about specific numbers because, you know, the number of police officers to be deployed is a matter, frankly, of police confidentiality and it can actually compromise police operations, in my experience, and so I cautioned about that. And so my recommendation is that we should be talking about resources. We should be talking about providing the support that the city needs without being specific about numbers. There had also been discussion, Mr. Cameron, throughout these tripartite meetings and in other fora about the need for an integrated action plan, not just how many people were required but how those people would then be utilized in order to affect the purpose of bringing the protest to a peaceful resolution.",27-195-22,195,22,20,speaker_start,EXAMINATION IN-CHIEF BY MR. GORDON CAMERON,MINISTER WILLIAM BLAIR,minister william blair
27-196-13,"Okay, well, that -- you’ve segued right into my next point, which is you -- from your perspective -- and we’ve heard a lot of police perspective from people similarly qualified already but you were in a unique position so we’d benefit from your perspective on why it was, as you saw it, that there might have been some -- a challenge for the OPP and the RCMP to commit resources to solving the problems that Ottawa was facing.",27-196-15,196,15,13,speaker_start,EXAMINATION IN-CHIEF BY MR. GORDON CAMERON,MR. GORDON CAMERON,gordon cameron
27-196-21,"Yeah, to be very clear, sir, I was never briefed on any aspect -- operational aspect of the plan. That would have been inappropriate. I never sought to be briefed on it and I was not. But what we were seeking was assurances from those who did have operational responsibilities that they were satisfied an integrated operational plan, an action plan, and that they were prepared to action it. That, I think, was a consideration because it’s also useful to remember, I think, Mr. Cameron, there were a number of things happening right across the country at the time. You know, the OPP, in particular, were dealing with a difficult situation in Windsor. They had also had to respond to other events across Southern Ontario. Their resources were being quite significantly challenged because they had to continue to respond to a very dynamic and mobile threat across the country. And so my understanding was that, you know, they needed the clarity of an integrated command action plan that they’d all agreed to in order to facilitate the movement of people to go and deal with the situation in Ottawa.",27-196-23,196,23,21,speaker_start,EXAMINATION IN-CHIEF BY MR. GORDON CAMERON,MINISTER WILLIAM BLAIR,minister william blair
27-197-12,"And in that context, did you have a view as to whether there was any logical order of operations, if I can call it that way, in terms of where Ottawa should look to first? We have heard from Commissioner Lucki that she wasn’t standing on protocol here, she was prepared to devote resources as quickly as she could while Ottawa sought help from the province as well. But putting aside those urgent first steps that were taken, did you have a sense of what the proper protocol was for Ottawa to follow in this context, putting in mind both the hats you were wearing as Minister of Emergency Preparedness and your history of having encountered similar situations doubtless over many years in Toronto?",27-197-14,197,14,12,speaker_start,EXAMINATION IN-CHIEF BY MR. GORDON CAMERON,MR. GORDON CAMERON,gordon cameron
27-197-24,"Yes, sir, to be very clear, there’s a number of different ways in which this has been approached, particularly if there’s a planned event. A planned event -- as I’ve already mentioned, the G20 in 2010, there was another planned event that I was involved in involving the visit of a US President to the City of Ottawa. This happened in the early 2000’s. That was a planned event where there was an integrated command structure put in place. At the time, I actually brought about 400 Toronto Police Service officers up here to Ottawa to work under that integrated command structure and to assist in public order for that event. I’m also aware because, frankly, I’ve been around a long time, that there was always a very close working relationship between all of the police services working in the National Capital Region. They convened a table that they refer to as INTERSECT. I’ve had no dealings with it in the recent period but I was familiar with it when I was a police chief, where the RCMP work very closely with the Ottawa Police Service. I believe the OPP were at the table, and the Gatineau Police. And so there’s always been good cooperation among the police services in the National Capital Region. I’m also very familiar -- I’ve been involved in very many incidents when I was a police officer where we would - - in the Toronto Police Service, we had, frankly, a lot of people. We had a lot of people trained in public order and we would bring our public order resources to assist in Kingston, for example, for their homecoming event, in other towns around Ontario that didn’t have those resources available so we would go and assist. But there’s also, and I’m aware, that within the Ontario Police Services Act, which is, frankly, the legislation that governs policing in the City of Ottawa and in the Province of Ontario, there is a provision in that Act that -- in circumstances that exceed the capacity of the police of jurisdiction, a municipal police service, to deal with an emergency, there is a provision within that Act for the chief to make a request to the Commissioner of the OPP, and the Commissioner is required under that act to respond. You may also make a request to another municipal police service and that municipal police service has the ability to decline. But there is a provision whereby a police service dealing with an emergency, exceeding their capacity to manage, can also, within the Act, make an appeal and a request to the OPP. I believe that was done, in fact, in Windsor, in response to the event at the Ambassador Bridge. It’s not -- it’s a rarely used provision of the Act, but it is a tool that was available.",27-197-26,197,26,24,speaker_start,EXAMINATION IN-CHIEF BY MR. GORDON CAMERON,MINISTER WILLIAM BLAIR,minister william blair
27-199-15,"And you describe it as a tool that was available. Was it your view at the time, or is it your view now, that it was necessary for Ottawa to take that step before it came -- the City of Ottawa to take that step before it came to the Federal Government for policing assistance?",27-199-17,199,17,15,speaker_start,EXAMINATION IN-CHIEF BY MR. GORDON CAMERON,MR. GORDON CAMERON,gordon cameron
27-199-21,"Not if the police services, the OPP, the RCMP, and other police services were willing and able to send their people, keeping in mind it’s a difficult thing to pull people from various jurisdictions, bring them to Ottawa for this type of a planned event. And that had - - that’s an approach that had been used successfully in the past. If that could be facilitated, that could be used, and if it wasn’t available to the Chief, there was the tool within the Ontario Police Services Act.",27-199-23,199,23,21,speaker_start,EXAMINATION IN-CHIEF BY MR. GORDON CAMERON,MINISTER WILLIAM BLAIR,minister william blair
27-200-02,"Now, you described the use of either the formal use of the Police Services Act, or more likely, when you’re talking about planned events, simply consensual arrangements where looking perhaps months or even years ahead to an event, you can get a multi-police organization team put together. That doesn’t work if the event manifests itself over the course of a weekend. And so one thing that the Commissioner might be interested in your views on is whether it would assist matters to have a protocol in place so that there isn’t quite as much confusion and disagreement about whose responsibility it is to - - who goes where and who provides what, to have a protocol in place and perhaps even stand by memoranda of understanding or something so that it -- within days, rather than weeks, everybody knows who goes where, whose responsibilities are what, and the matter hopefully gets sorted out more quickly?",27-200-04,200,4,2,speaker_start,EXAMINATION IN-CHIEF BY MR. GORDON CAMERON,MR. GORDON CAMERON,gordon cameron
27-200-18,"Yes, sir. I believe good communication, and to the extent that it is possible to plan for an unplanned event, those types of arrangements can be very useful. I’ve actually had the experience as a police chief making arrangements with other police services in the event of emergency, how many people I would send them and how quickly I’d be able to get them there, because we all know that certain types of events can exceed any of our capacity to respond to an emergency. Planned events are actually pretty straightforward. And I believe that we’ve got a long history and an element of success in dealing with, I’ll stop saying “we”, sir. In my previous capacity. The police services have a long history of working very collaboratively together for planned events. And a number of different things are worked out well in advance, including the integrated command structure, who is going to be in charge, a -- what they call -- what they often refer to as gold, silver command structure that is put in place, who is paying for what, and et cetera, what resources and obligations each of them will undertake to provide, is usually worked out well in advance. It is, quite frankly, more challenging in the event of an emergency, and maybe even more challenging when that emergency might be taking place in multiple jurisdictions.",27-200-20,200,20,18,speaker_start,EXAMINATION IN-CHIEF BY MR. GORDON CAMERON,MINISTER WILLIAM BLAIR,minister william blair
27-201-15,"All right. The speed with which you are able to deliver information, Mr. Blair, is helpful. If not to the translators, to me in getting through my questions in record time. So I’m flipping through some pages here. I want to ask you some questions about a related issue. You talked about Ipperwash. You had the probably not entirely pleasant experience of having a Commission of Inquiry look into the events of G20, not an entirely pleasant experience of having your conduct examined in a Commission of Inquiry. And one of the issues that came up in the Morden Inquiry into the G20 event, and Ipperwash as well, had to do with the extent of administrative oversight and political input to the activities of the police. And so with -- again, with your long policing experience and your role now as a Minister of the Crown, can you start by giving us an overview of where you -- how you see either Police Board or other levels of government officialdom oversight of police, where you see that fits in and how you view what has been called in this hearing so far sometimes the line between church and state or the conundrum of how much police forces should resist political interference and that whole topic?",27-201-17,201,17,15,speaker_start,EXAMINATION IN-CHIEF BY MR. GORDON CAMERON,MR. GORDON CAMERON,gordon cameron
27-202-10,"Thank you, sir. If I may, first of all, just a point of clarification. Justice Morden’s report, although a very important report, was not a public inquiry. It was a report commissioned by the Toronto Police Services Board. In the aftermath of that report, there was also another public report done by the Office of the Independent Police Review Director, Mr. Gerry McNeilly, also on that report, but also not a public inquiry.",27-202-12,202,12,10,speaker_start,EXAMINATION IN-CHIEF BY MR. GORDON CAMERON,MINISTER WILLIAM BLAIR,minister william blair
27-202-19,Thank you.,27-202-21,202,21,19,speaker_start,EXAMINATION IN-CHIEF BY MR. GORDON CAMERON,MR. GORDON CAMERON,gordon cameron
27-202-20,"One of the things -- and I can share with you, sir, I was the Police Chief for 10 years. I was appointed by the Police Services Board. The Police Services Board is constituted under the Police Services Act. It’s defined on its duties and responsibilities and how it’s comprised. I very firmly believe, very sincerely believe, that good policing requires good governance. And governance is not to suggest, sir, that a police services board or the governance authority will direct the police in their investigations, in their operations, will even direct them in the administration of their police service. That’s not the function of good governance. The function of good governance, in my experience, is oversight and accountability. And I think it’s fairly well articulated in a number of provincial statutes across the country, including the Ontario Police Services Act. In my own personal experience, I used to meet with my Board every month for several hours over the course of a day. It was done in public. They would -- some of it was in- camera, much of it was in public. They would ask me questions about use of force. They would ask me about training. They would ask me about HR issues, the discipline and maintaining of conduct within my organization. I reported to them in a very public way about our engagement with diverse communities, about a number of efforts that we were making to prevent crime. All those things that were the responsibility of the police service to deliver adequate and effective police service, and that’s actually directive with the Board and then designated to me by the Board. The police have extraordinary authorities in our society, but those are not unfettered authorities. There’s an expectation that we will be held to accountable -- held to account for the way that we use those authorities, and that there will be independent civilian oversight for policing activities. And I believe that’s absolutely key. There is no good policing without good governance.",27-202-22,202,22,20,speaker_start,EXAMINATION IN-CHIEF BY MR. GORDON CAMERON,MINISTER WILLIAM BLAIR,minister william blair
27-204-02,"So sorry. Slow down and say that again, please? There is no?",27-204-04,204,4,2,speaker_start,EXAMINATION IN-CHIEF BY MR. GORDON CAMERON,MR. GORDON CAMERON,gordon cameron
27-204-04,There is no good policing without good governance.,27-204-06,204,6,4,speaker_start,EXAMINATION IN-CHIEF BY MR. GORDON CAMERON,MINISTER WILLIAM BLAIR,minister william blair
27-204-06,"And when you use “governance” in this context, you’re not talking about the police and his or her deputies. You’re talking about some level of ---",27-204-08,204,8,6,speaker_start,EXAMINATION IN-CHIEF BY MR. GORDON CAMERON,MR. GORDON CAMERON,gordon cameron
27-204-10,"No, sir. I’m talking about independent civilian oversight of policing. The police chief answers to someone. I answer to my Board. I work for my Board. And I was accountable to my Board and I understood that was my responsibility to be accountable, to answer their questions. They were always very careful, by the way, and I can’t remember -- recall one incident in 10 years where they ever directed me in an investigation, in an operation, but they asked me a lot of questions about what we were doing and why we were doing it. I believe it was my responsibility to provide them with that information so that they could fulfil their function of providing oversight to me and to hold me accountable for the job that I was doing. And so I know there’s been -- because I’ve watched. There’s been a lot of discussion about, you know, having a civilian or a politician directing the police. And that’s never acceptable. But at the same time, the police must be accountable to an independent civilian authority. Now that - - and that can be achieved through a government minister who is assigned responsibility, it can be done through a police services board, but in my experience, public -- policing is all predicated on public trust and the consent of the people who are policed. That trust is really warranted by that oversight, and accountability, and transparency, and the way those extraordinary authorities given to the police are exercised.",27-204-12,204,12,10,speaker_start,EXAMINATION IN-CHIEF BY MR. GORDON CAMERON,MINISTER WILLIAM BLAIR,minister william blair
27-205-08,"Right. And in the time that you were Chief of Police and having this governance relationship with the Police Services Board, would you have considered that interreference, or what is sometimes called directing the police, for that Board to have outlined to you either long-term or immediate priorities or rankings of objectives to accomplish with your available resources?",27-205-10,205,10,8,speaker_start,EXAMINATION IN-CHIEF BY MR. GORDON CAMERON,MR. GORDON CAMERON,gordon cameron
27-205-15,There are a number of different models of governance that are often employed by police service boards. One of them is through policies and priorities. I believe it's called the Carver model.,27-205-17,205,17,15,speaker_start,EXAMINATION IN-CHIEF BY MR. GORDON CAMERON,MINISTER WILLIAM BLAIR,minister william blair
27-205-19,"Actually, slow down for the reporter. The what model?",27-205-21,205,21,19,speaker_start,EXAMINATION IN-CHIEF BY MR. GORDON CAMERON,MR. GORDON CAMERON,gordon cameron
27-205-21,"The Carver model. I've actually spent a lot of time --I also felt it was my responsibility to help my Board be a good Board because they would help me be a good chief. And so we spent a lot of time talking about how they could do their job and it would help me do my job as a Board, and I think it was a very effective relationship. They did set priorities for the service. They also set my budget. I would collaborate with them and work very closely with them, and they would consult with the public on what those priorities should be, because there is a bridge that a governance body can serve or a police service to be that connection on behalf of community. And so they would bring -- there was lots of community deputations made at our Board meetings where people would outline their expectations and their concerns, and the Board would set priorities, but my Board was also very careful not to cross a line into operational matters, to suggest where we should deploy people or you know, what investigations or what laws would be in force. They never went there, and neither would, frankly, I'd allow them. I'd have pushed back on that. But they often talked about, you know, placing a greater emphasis on community policing, on community outreach, on building greater diversity within the police service, and you know, how we interact with the incredible diverse population of our city and in issues of crime prevention and how communities were to be policed. And frankly, I never considered those infringements on police operations. I just thought it was -- we were working together to do good policing.",27-205-23,205,23,21,speaker_start,EXAMINATION IN-CHIEF BY MR. GORDON CAMERON,MINISTER WILLIAM BLAIR,minister william blair
27-206-23,"And what about when that effort at direction from the Police Services Board was aimed at a more immediate situation, and I don’t mean a particular investigation or anything of that type, but for example, if the Tamil protest had shut down University Avenue for four days, would you have considered it out of line for the Police Services Board to ask you what you intended to do about it and express to you their view that they considered this a serious problem for the city?",27-206-25,206,25,23,speaker_start,EXAMINATION IN-CHIEF BY MR. GORDON CAMERON,MR. GORDON CAMERON,gordon cameron
27-207-04,"I would have considered it entirely appropriate. Frankly, I recall getting these questions from the Board, ""What are you doing? Why are you doing it?"" There was a fair bit of criticism, as you can imagine. As a matter of fact, some of the national papers were accusing me of being overly tolerant. My Board was very supportive of what we were doing, but they did ask questions about what and why, which I considered entirely appropriate. But at no time did they tell me how to police that community, and I think that’s -- for me, there is a bright line there, and they didn’t cross that line, but they held me to account to the decisions I was making on how I was going to deliver policing services in those circumstances. And I didn’t consider their questions infringements on any aspect of my authority of responsibility. It was my job to answer their questions and to allow them to perform that oversight role and to hold me accountable for the decisions I made.",27-207-06,207,6,4,speaker_start,EXAMINATION IN-CHIEF BY MR. GORDON CAMERON,MINISTER WILLIAM BLAIR,minister william blair
