interjection_id,text_clean_combined,line_id,page,line,transcript_line_number,line_type,section_header,speaker,speaker_standardized
02-080-07,Sorry.,02-080-09,80,9,7,speaker_start,EXAMINATION IN-CHIEF BY MR. JEAN-SIMON SCHOENHOLZ,MS. NATHALIE CARRIER,nathalie carrier
02-080-08,"No, finish your thought, please.",02-080-10,80,10,8,speaker_start,EXAMINATION IN-CHIEF BY MR. JEAN-SIMON SCHOENHOLZ,MR. JEAN-SIMON SCHOENHOLZ,jean-simon schoenholz
02-080-10,"I was going to say, oftentimes, the police representatives we had on the call are not people that I would consider senior OPS that I would have seen in other events.",02-080-12,80,12,10,speaker_start,EXAMINATION IN-CHIEF BY MR. JEAN-SIMON SCHOENHOLZ,MS. NATHALIE CARRIER,nathalie carrier
02-080-14,"So did any of the senior OPS officials, former Chief Sloly, Deputies Bell and Ferguson, did they attend?",02-080-16,80,16,14,speaker_start,EXAMINATION IN-CHIEF BY MR. JEAN-SIMON SCHOENHOLZ,MR. JEAN-SIMON SCHOENHOLZ,jean-simon schoenholz
02-080-17,"I have a recollection of Chief Sloly joining the first week, so between the first and second weekends, there -- I don't recall what day exactly, but there was one call that he was on with us.",02-080-19,80,19,17,speaker_start,EXAMINATION IN-CHIEF BY MR. JEAN-SIMON SCHOENHOLZ,MS. NATHALIE CARRIER,nathalie carrier
02-080-21,"Yeah, he was on one or two calls at the very beginning, and then as the situation continued, he was no longer on the call.",02-080-23,80,23,21,speaker_start,EXAMINATION IN-CHIEF BY MR. JEAN-SIMON SCHOENHOLZ,MR. KEVIN McHALE,kevin mchale
02-080-24,"Okay. And the deputies, did they attend?",02-080-26,80,26,24,speaker_start,EXAMINATION IN-CHIEF BY MR. JEAN-SIMON SCHOENHOLZ,MR. JEAN-SIMON SCHOENHOLZ,jean-simon schoenholz
02-080-26,"No, generally, police representation was Constable Lemay, who was the community officer ---",02-080-28,80,28,26,speaker_start,EXAMINATION IN-CHIEF BY MR. JEAN-SIMON SCHOENHOLZ,MR. KEVIN McHALE,kevin mchale
02-081-01,Okay.,02-081-03,81,3,1,speaker_start,EXAMINATION IN-CHIEF BY MR. JEAN-SIMON SCHOENHOLZ,MR. JEAN-SIMON SCHOENHOLZ,jean-simon schoenholz
02-081-02,--- was the primary police contact on the phone call.,02-081-04,81,4,2,speaker_start,EXAMINATION IN-CHIEF BY MR. JEAN-SIMON SCHOENHOLZ,MR. KEVIN McHALE,kevin mchale
02-081-04,"And there was -- and I apologize. I do not remember her name, but I believe she was the deputy who came once or twice on the call as well.",02-081-06,81,6,4,speaker_start,EXAMINATION IN-CHIEF BY MR. JEAN-SIMON SCHOENHOLZ,MS. NATHALIE CARRIER,nathalie carrier
02-081-07,Ferguson?,02-081-09,81,9,7,speaker_start,EXAMINATION IN-CHIEF BY MR. JEAN-SIMON SCHOENHOLZ,MR. JEAN-SIMON SCHOENHOLZ,jean-simon schoenholz
02-081-08,Yes.,02-081-10,81,10,8,speaker_start,EXAMINATION IN-CHIEF BY MR. JEAN-SIMON SCHOENHOLZ,MR. KEVIN McHALE,kevin mchale
02-081-09,Yes.,02-081-11,81,11,9,speaker_start,EXAMINATION IN-CHIEF BY MR. JEAN-SIMON SCHOENHOLZ,MS. NATHALIE CARRIER,nathalie carrier
02-081-10,Chris Ferguson.,02-081-12,81,12,10,speaker_start,EXAMINATION IN-CHIEF BY MR. JEAN-SIMON SCHOENHOLZ,MR. KEVIN McHALE,kevin mchale
02-081-11,Thank you.,02-081-13,81,13,11,speaker_start,EXAMINATION IN-CHIEF BY MR. JEAN-SIMON SCHOENHOLZ,MR. JEAN-SIMON SCHOENHOLZ,jean-simon schoenholz
02-081-12,Sorry.,02-081-14,81,14,12,speaker_start,EXAMINATION IN-CHIEF BY MR. JEAN-SIMON SCHOENHOLZ,MS. NATHALIE CARRIER,nathalie carrier
02-081-13,"And do you recall -- so you say Chief Sloly attended once at that first week, so after the first weekend. Do you recall, you know, anything specific that he said during his attendance?",02-081-15,81,15,13,speaker_start,EXAMINATION IN-CHIEF BY MR. JEAN-SIMON SCHOENHOLZ,MR. JEAN-SIMON SCHOENHOLZ,jean-simon schoenholz
02-081-17,"This is difficult because these are people we work with. These are people that we rely on. I remember being scared personally. I was -- because I remember the Chief saying at one point, ""You guys are scared. I get it. I'm scared too."" And I thought if the Chief of Police is scared, something much bigger is happening here than a protest, and that personally scared me, and I think a lot of us on that call were shaken. There was also a sense that week that things were starting to get shaken up. You know, there was instability. We -- I sensed a sense of defensiveness, you know. Everyone was caught off guard, I think, everyone. I don't think any of us could have dreamed that this event, that we -- in our biggest thinking would equate to Canada Day, sort of, you know, the infractions that happen, the closures that happen, the people that come in, the disturbances it creates, the loud noise, the fireworks. None of us I think could have understood that that would actually get so much bigger.",02-081-19,81,19,17,speaker_start,EXAMINATION IN-CHIEF BY MR. JEAN-SIMON SCHOENHOLZ,MS. NATHALIE CARRIER,nathalie carrier
02-082-06,"So did you each feel that the business community, the BIAs that you represent, that they got the information they needed to prepare for these events?",02-082-08,82,8,6,speaker_start,EXAMINATION IN-CHIEF BY MR. JEAN-SIMON SCHOENHOLZ,MR. JEAN-SIMON SCHOENHOLZ,jean-simon schoenholz
02-082-10,No. No.,02-082-12,82,12,10,speaker_start,EXAMINATION IN-CHIEF BY MR. JEAN-SIMON SCHOENHOLZ,MR. KEVIN McHALE,kevin mchale
02-082-11,Ms. Carrier?,02-082-13,82,13,11,speaker_start,EXAMINATION IN-CHIEF BY MR. JEAN-SIMON SCHOENHOLZ,MR. JEAN-SIMON SCHOENHOLZ,jean-simon schoenholz
02-082-12,"No, no. Despite us asking vehemently daily. There was no ---",02-082-14,82,14,12,speaker_start,EXAMINATION IN-CHIEF BY MR. JEAN-SIMON SCHOENHOLZ,MS. NATHALIE CARRIER,nathalie carrier
02-082-14,What specific information were you seeking that you did not receive?,02-082-16,82,16,14,speaker_start,EXAMINATION IN-CHIEF BY MR. JEAN-SIMON SCHOENHOLZ,MR. JEAN-SIMON SCHOENHOLZ,jean-simon schoenholz
02-082-16,"So there -- things that pertain to businesses that are very specific in events like this, or -- and I'm sorry, I keep calling it an event. That's my knowledge. So things like will they have access to loading zones, how can deliveries happen, can staff get in, you know, where will the bus routes be, what -- and because there was so much fluidity to what was happening, there was no sense that the plan today was going to be the next -- the plan the next day. There was -- you know, there was some fluidity to it, but mostly, those are the things we needed to know. Can staff take OC Transpo and get from Vanier to their job at the Rideau Centre? Will the Rideau Centre be safe? You know, those are the things that pertain to businesses. Like, can we have -- can they have deliveries picked up? And can they still do click and collect? And can Uber Eats and Skip the Dishes get through? And to give context to it, though we're five kilometres away in Vanier from the downtown core, Uber Eats was not servicing. They were not servicing. So unlike what could be said to have happened to businesses during COVID, businesses were completely crippled, and that has to be understood by this Commission, because there were no deliveries. There was no loading zone. There was no Uber Eats. There was no clients in the stores. A lot of the protesters that arrived did support businesses and I'm not going to say that they didn't. They supported some businesses, but there was a lot of chaos. There was a lot of businesses that were deeply affected by protesters. And then there was this sense -- there was a lawlessness, if I can speak specifically to restaurants, which are often the most flexible of all of our businesses; right? They adapt very quickly. They can figure out things very quickly. But restaurants often had catering tables organized by protesters right outside their doors offering free hotdogs, free chocolates, free, you know, to everyone. Meanwhile, the business that was trying to stay open and survive was not getting any business.",02-082-18,82,18,16,speaker_start,EXAMINATION IN-CHIEF BY MR. JEAN-SIMON SCHOENHOLZ,MS. NATHALIE CARRIER,nathalie carrier
02-083-22,"Thank you. I'd like to pull up document COA-00000063. So the document we'll see here, Mr. McHale, is an exchange between you and Councillor McKenney.",02-083-24,83,24,22,speaker_start,EXAMINATION IN-CHIEF BY MR. JEAN-SIMON SCHOENHOLZ,MR. JEAN-SIMON SCHOENHOLZ,jean-simon schoenholz
02-083-26,M'hm.,02-083-28,83,28,26,speaker_start,EXAMINATION IN-CHIEF BY MR. JEAN-SIMON SCHOENHOLZ,MR. KEVIN McHALE,kevin mchale
02-083-27,"If you can scroll to the bottom, please? Yeah. Okay. So I'll just let you refresh your memory and read that exchange. So Councillor McKenney is asking if you need any additional information.",02-083-29,83,29,27,speaker_start,EXAMINATION IN-CHIEF BY MR. JEAN-SIMON SCHOENHOLZ,MR. JEAN-SIMON SCHOENHOLZ,jean-simon schoenholz
02-084-04,M'hm.,02-084-06,84,6,4,speaker_start,EXAMINATION IN-CHIEF BY MR. JEAN-SIMON SCHOENHOLZ,MR. KEVIN McHALE,kevin mchale
02-084-05,"And your response is -- and if we can go up just a tiny bit? So on January 28, so before the arrival of the convoy you say, ""I think we are good."" And then continue. Can you just help maybe explain to us what that meant in the context of what you were just communicating to me?",02-084-07,84,7,5,speaker_start,EXAMINATION IN-CHIEF BY MR. JEAN-SIMON SCHOENHOLZ,MR. JEAN-SIMON SCHOENHOLZ,jean-simon schoenholz
02-084-11,"Yeah, I think, again, it comes down to having been on Sparks Street for over nine years now and having a very veteran merchant mix. There wasn't initially going into it necessarily a lot of concern. So I, you know, again, having a bit more -- you know, dealing with protests and activation through the core all the time, again, I was -- as I said earlier, I felt that this was going to be large and boisterous, but not necessarily -- not obviously the three-week event that it was. So we -- and again, Sparks Street, we tend to be a little self-sufficient. So we were very active on social media, making sure we were getting information from OPS and bylaw, as we were directed to through Coms, and which was said the fastest way to get our information oftentimes was Twitter. And so Catherine did reach out to make sure that we had gotten what we had. And so again, yeah, it was very much I think we're good. The members are aware. Again, my members go into an event like this any other protest, not thinking about closing their doors, not really worried about -- concerned about staff. At events, as we always say -- I always say on Sparks Street, people march up to Parliament Hill determined to get their message out, to tell people about what they need -- what they think that needs to be told and say their piece and they leave satisfied and happy that they've accomplished what they set out to do, and then they end up visiting our coffeeshops and our restaurants, et cetera. It was only kind of into Saturday night, Sunday where we realised this was a different -- there was a different energy in the crowd, if I can use that term, and that's when I get a lot of my businesses, who on the Saturday were open or trying to open. Regulations in Ontario were starting to be lifted and they're being ready to be lifted on the Monday, on the 31st, and so our businesses were kind of actually getting ready for the provinces to reopened and to welcome customers back inside their businesses after a very long January, or yeah, January/December. So again, I wasn't overly concerned. There was a very casual nature to the conversation, and that's kind of how I speak and how I flow.",02-084-13,84,13,11,speaker_start,EXAMINATION IN-CHIEF BY MR. JEAN-SIMON SCHOENHOLZ,MR. KEVIN McHALE,kevin mchale
02-085-21,"In hindsight, were you prepared at that time?",02-085-23,85,23,21,speaker_start,EXAMINATION IN-CHIEF BY MR. JEAN-SIMON SCHOENHOLZ,MR. JEAN-SIMON SCHOENHOLZ,jean-simon schoenholz
02-085-23,"In hindsight, yeah. I mean, as I say, I was -- here, I -- you know, I talked with staff. Along Sparks Street, we have bollards that can be installed. We use them in the spring, summer, fall to control traffic. They're out right now on the street if you're out there today. Wintertime we have to remove them for snow operations. So we had actually taken them out back in November and so the street was open. And again, it was at that point where at the same time we were just sitting there say, ""Okay, do you think we should put them in?"" You know, we started seeing vehicles coming in, we didn't want them on the street for what we thought was just the weekend. So my event supervisor and I made the decision, you know, we -- you know, we had to dig out the holes, and they're all full of snow and ice, and dig them out and vacuum them out and we put the posts in for the weekend. And I think it was kind of a fortunate decision for us to do that because I feel like the street would have ended up as kind of a secondary holding spot for vehicles and other activities.",02-085-25,85,25,23,speaker_start,EXAMINATION IN-CHIEF BY MR. JEAN-SIMON SCHOENHOLZ,MR. KEVIN McHALE,kevin mchale
02-086-15,Did you consult OPS?,02-086-17,86,17,15,speaker_start,EXAMINATION IN-CHIEF BY MR. JEAN-SIMON SCHOENHOLZ,MR. JEAN-SIMON SCHOENHOLZ,jean-simon schoenholz
02-086-16,"Yes. We had reached out to Constable Sean Kay, who we had a conversation with a couple of months ago for another activation. The constable's job is to liaise with marches and activations like that. So we had reached out to Sean to say ""Do you think we should do that? Is it going to interfere with Operations?"" Again, having a knowledge of the street, in the past when there have been activations or incidents, Sparks Street can sometimes become a holding spot for, or just a cut through for police services or other entities, Operations and such. So we just did a reach out saying, ""Is this going to interfere in any of your planning or any Operations?"" And he said, ""No, nothing, so just keep -- just let us know when it's done."" So we did that. Later, at the beginning of the week, I want to say about February 3rd or so, we had to -- we reached -- or 2nd, 2nd or 3rd, we reached back out to let him we were taking them out. They had done their job, they kept the vehicles off the street. The feeling was there was two things happening then. I felt that the vehicles couldn't move anymore, they were kind of jammed into the spaces, and we had snow falling, and so we had to pull them out so that snow clearing could happen. What ended up happening was there was no snow operations for the next three weeks, so you had a nice layer of snow and ice on Sparks Street that -- for the remaining of the convoy.",02-086-18,86,18,16,speaker_start,EXAMINATION IN-CHIEF BY MR. JEAN-SIMON SCHOENHOLZ,MR. KEVIN McHALE,kevin mchale
02-087-13,So did you keep the bollards in for the whole period?,02-087-15,87,15,13,speaker_start,EXAMINATION IN-CHIEF BY MR. JEAN-SIMON SCHOENHOLZ,MR. JEAN-SIMON SCHOENHOLZ,jean-simon schoenholz
02-087-15,"We ended up removing them. And what we realised from observing the crowd, the vehicles and everyone around us, and the way the groups were operating is we felt Sparks Street was okay without them in at that point because we didn't think anything large could get in anymore. There was a lane for fire and such, but that was about it, and that was being respected by everyone. So -- and it would have been -- again, these were mechanical, all -- they're not all automated, it's not a heat system, it's a pretty simple system, but by that time to get -- to put them back in was going to be very difficult after a snow event.",02-087-17,87,17,15,speaker_start,EXAMINATION IN-CHIEF BY MR. JEAN-SIMON SCHOENHOLZ,MR. KEVIN McHALE,kevin mchale
02-087-26,Had you ever put these up for another protest before?,02-087-28,87,28,26,speaker_start,EXAMINATION IN-CHIEF BY MR. JEAN-SIMON SCHOENHOLZ,MR. JEAN-SIMON SCHOENHOLZ,jean-simon schoenholz
02-087-28,We had not.,02-087-30,87,30,28,speaker_start,EXAMINATION IN-CHIEF BY MR. JEAN-SIMON SCHOENHOLZ,MR. KEVIN McHALE,kevin mchale
02-088-01,"Ms. Carrier, I understand again, as you previously said, that you had some -- you liaised to a certain extent with the businesses on Coventry Road and visited that location.",02-088-03,88,3,1,speaker_start,EXAMINATION IN-CHIEF BY MR. JEAN-SIMON SCHOENHOLZ,MR. JEAN-SIMON SCHOENHOLZ,jean-simon schoenholz
02-088-05,M'hm.,02-088-07,88,7,5,speaker_start,EXAMINATION IN-CHIEF BY MR. JEAN-SIMON SCHOENHOLZ,MS. NATHALIE CARRIER,nathalie carrier
02-088-06,Is that correct?,02-088-08,88,8,6,speaker_start,EXAMINATION IN-CHIEF BY MR. JEAN-SIMON SCHOENHOLZ,MR. JEAN-SIMON SCHOENHOLZ,jean-simon schoenholz
02-088-07,Correct.,02-088-09,88,9,7,speaker_start,EXAMINATION IN-CHIEF BY MR. JEAN-SIMON SCHOENHOLZ,MS. NATHALIE CARRIER,nathalie carrier
02-088-08,And why was Coventry kind of a significant location in these events?,02-088-10,88,10,8,speaker_start,EXAMINATION IN-CHIEF BY MR. JEAN-SIMON SCHOENHOLZ,MR. JEAN-SIMON SCHOENHOLZ,jean-simon schoenholz
02-088-10,"Because the businesses were right next door to the encampment. So to put it in context, there is a hotel, a parking lot for the hotel, a parking lot for the stadium, the stadium, and then there is a Canadian Tire, Best Buy, and a Starbucks that are right there. There is also, just at the corner of Lola, there is a veterinarian and emergency hospital for animals, and also, one of our organisations that we liaise with a lot, the Minwaashin Lodge, was there as well. So there is organisations that are racialized that are in and around that area, so in my expertise as being a business relations person, I started just checking in on them to see if they were okay.",02-088-12,88,12,10,speaker_start,EXAMINATION IN-CHIEF BY MR. JEAN-SIMON SCHOENHOLZ,MS. NATHALIE CARRIER,nathalie carrier
02-088-22,How frequently did you go visit that location physically?,02-088-24,88,24,22,speaker_start,EXAMINATION IN-CHIEF BY MR. JEAN-SIMON SCHOENHOLZ,MR. JEAN-SIMON SCHOENHOLZ,jean-simon schoenholz
02-088-24,"Usually once a weekend. The weekends were definitely the worst. But Canadian Tire, we - - I must've spoken to them five or six times, different people at each time. Sometimes it was the person, the customer service person; sometimes it a manager on duty or another. The Starbucks, I would be going in to get a coffee, because I spent a lot of time at Coventry, and anecdotally I would ask questions and spoke to the manager once, I think.",02-088-26,88,26,24,speaker_start,EXAMINATION IN-CHIEF BY MR. JEAN-SIMON SCHOENHOLZ,MS. NATHALIE CARRIER,nathalie carrier
02-089-04,Okay. So what did the manager or other personnel from Canadian Tire report to you throughout this period? And maybe try and identify which time.,02-089-06,89,6,4,speaker_start,EXAMINATION IN-CHIEF BY MR. JEAN-SIMON SCHOENHOLZ,MR. JEAN-SIMON SCHOENHOLZ,jean-simon schoenholz
02-089-07,"Right. So in the beginning, it was, you know, they were selling a lot of stuff. They were selling gas tanks, and they were selling rope, and you know, all the type of things that I think you would buy if you were camping out. And they also reported that large groups of protestors, you know, by large I probably mean 3 to 10, would come in at once and then do the sort of thing that was, you know, that is now sort of cliché, but would go up to the workers with masks on and say, ""Why are you wearing a mask? Why are you doing this?"" They would disrupt the sort of general, you know, the store, they would disrupt the store. And there was also evidence or not evidence, sorry, there was things that were relayed to me that they -- the protestors had been putting up posters throughout the store that looked like public health posters, but saying things like, ""masks are stupid, or masks aren't needed"", or you know, so counterintuitive sort of things that staff... Nothing, you know, violent, but definitely disruptive. The most terrifying call I had was on the last -- the third weekend, where the manager was talking to me, and he said, ""You know, Nathalie, I don't know if this is something but I feel like I should tell you. We've sold out of knives and bear spray this weekend."" And that is something that I reported immediately to OPS.",02-089-09,89,9,7,speaker_start,EXAMINATION IN-CHIEF BY MR. JEAN-SIMON SCHOENHOLZ,MS. NATHALIE CARRIER,nathalie carrier
02-090-04,"Thank you. Did you - - were -- did the Starbucks location, and their manager, report anything to you?",02-090-06,90,6,4,speaker_start,EXAMINATION IN-CHIEF BY MR. JEAN-SIMON SCHOENHOLZ,MR. JEAN-SIMON SCHOENHOLZ,jean-simon schoenholz
02-090-07,"Just disruptions. You know, there's a lot of LGBT people that work in OPS and, sorry, in Starbucks, and OPS as well, I'm sure, and that -- sorry. But you know, there was a general feeling of annoyance, you know, it was an annoying thing. It was, you know, it was fine, but it wasn't, you know, the pleasant sort of... You know, there was some -- some protestors were perfectly pleasant and lovely, you know, that should be said. They're not all homogenous; right? But there were definitely the ones that would make comments about why they'd be wearing a mask in a window, and the door would be -- you know, ""the window's open, you don't need a mask"", those types of things. And again, I think we have to put this back into context of the first weekend being our stores were still closed. You couldn't go into a restaurant that first weekend; that was reopening on the 31st. So the -- you know, the feeling that we have about masks today, really has to be brought back to how weird that felt then.",02-090-09,90,9,7,speaker_start,EXAMINATION IN-CHIEF BY MR. JEAN-SIMON SCHOENHOLZ,MS. NATHALIE CARRIER,nathalie carrier
02-090-25,I understand that you also visited the Coventry Road parking lot where the -- that the protestors were using during this period; correct?,02-090-27,90,27,25,speaker_start,EXAMINATION IN-CHIEF BY MR. JEAN-SIMON SCHOENHOLZ,MR. JEAN-SIMON SCHOENHOLZ,jean-simon schoenholz
02-090-28,"Several times, yes.",02-090-30,90,30,28,speaker_start,EXAMINATION IN-CHIEF BY MR. JEAN-SIMON SCHOENHOLZ,MS. NATHALIE CARRIER,nathalie carrier
02-091-01,Okay. And you took some videos?,02-091-03,91,3,1,speaker_start,EXAMINATION IN-CHIEF BY MR. JEAN-SIMON SCHOENHOLZ,MR. JEAN-SIMON SCHOENHOLZ,jean-simon schoenholz
02-091-03,I sure did.,02-091-05,91,5,3,speaker_start,EXAMINATION IN-CHIEF BY MR. JEAN-SIMON SCHOENHOLZ,MS. NATHALIE CARRIER,nathalie carrier
02-091-04,"I'll show a few to you. So if we can pull up COM, five zeroes, 744. If you could tell me when this was taken and where? [VIDEO PLAYBACK]",02-091-06,91,6,4,speaker_start,EXAMINATION IN-CHIEF BY MR. JEAN-SIMON SCHOENHOLZ,MR. JEAN-SIMON SCHOENHOLZ,jean-simon schoenholz
02-091-10,"I believe -- I'm going to say it's Sunday night of the first weekend. Sorry, this is very embarrassing. It has to be said. [END VIDEO PLAYBACK]",02-091-12,91,12,10,speaker_start,EXAMINATION IN-CHIEF BY MR. JEAN-SIMON SCHOENHOLZ,MS. NATHALIE CARRIER,nathalie carrier
02-091-14,So this was the first weekend you were telling me?,02-091-16,91,16,14,speaker_start,EXAMINATION IN-CHIEF BY MR. JEAN-SIMON SCHOENHOLZ,MR. JEAN-SIMON SCHOENHOLZ,jean-simon schoenholz
02-091-16,"Correct, on the Sunday night. And again, it has to be put in context. The reason I took this video was to share with my colleague at OPS because that day we had been told that, you know, now we're going to move towards egress, but I was trying to demonstrate there is no sign of egress at Coventry.",02-091-18,91,18,16,speaker_start,EXAMINATION IN-CHIEF BY MR. JEAN-SIMON SCHOENHOLZ,MS. NATHALIE CARRIER,nathalie carrier
02-091-22,"And when you say, sorry, you said your colleague at OPS. You mean a kind of a police liaison in that area?",02-091-24,91,24,22,speaker_start,EXAMINATION IN-CHIEF BY MR. JEAN-SIMON SCHOENHOLZ,MR. JEAN-SIMON SCHOENHOLZ,jean-simon schoenholz
02-091-25,"The person that was on our calls with us during -- at those daily meetings, yes.",02-091-27,91,27,25,speaker_start,EXAMINATION IN-CHIEF BY MR. JEAN-SIMON SCHOENHOLZ,MS. NATHALIE CARRIER,nathalie carrier
02-091-27,Thank you. And can you describe ---,02-091-29,91,29,27,speaker_start,EXAMINATION IN-CHIEF BY MR. JEAN-SIMON SCHOENHOLZ,MR. JEAN-SIMON SCHOENHOLZ,jean-simon schoenholz
02-092-01,Yes.,02-092-03,92,3,1,speaker_start,EXAMINATION IN-CHIEF BY MR. JEAN-SIMON SCHOENHOLZ,MS. NATHALIE CARRIER,nathalie carrier
02-092-02,--- what was on that video? Anything significant stand out to you?,02-092-04,92,4,2,speaker_start,EXAMINATION IN-CHIEF BY MR. JEAN-SIMON SCHOENHOLZ,MR. JEAN-SIMON SCHOENHOLZ,jean-simon schoenholz
02-092-04,"Well, two things. So this video, to put it in context, is next to the stadium, so on, you know, depending on what map you're looking at, not on the hotel side but on the other side. What I had observed during that weekend, and it increased during the week, and certainly on the second weekend, was the sense of directing their own traffic, of allowing certain trucks in, or, you know, people in or not. So there was a sense of security that was -- security system of some sort that was building up. I observed large scale tents that, again, from an event planner perspective, signified to me, you know, organization, and places to work, and places to make food. I saw food being brought in. I saw deliveries being made. This is over the course of the four weeks. And I sawt hat encampment grow from an overflow parking to an encampment, a very solid, very organized, Blues Fest large scale event style, “We’re here for a long time and we have the infrastructure to stay.”",02-092-06,92,6,4,speaker_start,EXAMINATION IN-CHIEF BY MR. JEAN-SIMON SCHOENHOLZ,MS. NATHALIE CARRIER,nathalie carrier
02-092-21,"Thank you. Let’s just play COM00000743, please? [VIDEO PLAYBACK]",02-092-23,92,23,21,speaker_start,EXAMINATION IN-CHIEF BY MR. JEAN-SIMON SCHOENHOLZ,MR. JEAN-SIMON SCHOENHOLZ,jean-simon schoenholz
