interjection_id,text_clean_combined,line_id,page,line,transcript_line_number,line_type,section_header,speaker,speaker_standardized
20-053-28,No.,20-053-30,53,30,28,speaker_start,CROSS-EXAMINATION BY MS. ANDREA GONSALVES,MS. ANDREA GONSALVES,andrea gonsalves
20-054-01,It’s just PB.CAN.,20-054-03,54,3,1,speaker_start,CROSS-EXAMINATION BY MS. ANDREA GONSALVES,MR. DAVID SHIROKY,david shiroky
20-054-02,"Thank you, Mr. Shiroky.",20-054-04,54,4,2,speaker_start,CROSS-EXAMINATION BY MS. ANDREA GONSALVES,MS. ANDREA GONSALVES,andrea gonsalves
20-054-03,It is here. I just need to download it. It’ll just be a moment.,20-054-05,54,5,3,speaker_start,CROSS-EXAMINATION BY MS. ANDREA GONSALVES,THE CLERK,the clerk
20-054-05,"Okay. Thank you. I think I can do the rest of my questions and come back to that. And of course, you’re aware, Mayor, that ultimately search warrants were carried out the morning of February 14th?",20-054-07,54,7,5,speaker_start,CROSS-EXAMINATION BY MS. ANDREA GONSALVES,MS. ANDREA GONSALVES,andrea gonsalves
20-054-10,Yes.,20-054-12,54,12,10,speaker_start,CROSS-EXAMINATION BY MS. ANDREA GONSALVES,MAYOR JIMMY WILLETT,mayor jimmy willett
20-054-11,And a cache of weapons and body armour was seized?,20-054-13,54,13,11,speaker_start,CROSS-EXAMINATION BY MS. ANDREA GONSALVES,MS. ANDREA GONSALVES,andrea gonsalves
20-054-13,Yes.,20-054-15,54,15,13,speaker_start,CROSS-EXAMINATION BY MS. ANDREA GONSALVES,MAYOR JIMMY WILLETT,mayor jimmy willett
20-054-14,And there were a number of arrests made; right?,20-054-16,54,16,14,speaker_start,CROSS-EXAMINATION BY MS. ANDREA GONSALVES,MS. ANDREA GONSALVES,andrea gonsalves
20-054-16,Yes.,20-054-18,54,18,16,speaker_start,CROSS-EXAMINATION BY MS. ANDREA GONSALVES,MAYOR JIMMY WILLETT,mayor jimmy willett
20-054-17,"And you were informed, in addition to these arrests, an attempt was made by a vehicle to ram a police vehicle?",20-054-19,54,19,17,speaker_start,CROSS-EXAMINATION BY MS. ANDREA GONSALVES,MS. ANDREA GONSALVES,andrea gonsalves
20-054-20,Yeah.,20-054-22,54,22,20,speaker_start,CROSS-EXAMINATION BY MS. ANDREA GONSALVES,MAYOR JIMMY WILLETT,mayor jimmy willett
20-054-21,"Again, we don’t have to pull it up while Mr. Clerk is doing me another favour, but the email to you about those arrests is COU00000453. And even with those arrests, I think I understood your evidence that it took some time for the protestors to clear out?",20-054-23,54,23,21,speaker_start,CROSS-EXAMINATION BY MS. ANDREA GONSALVES,MS. ANDREA GONSALVES,andrea gonsalves
20-054-27,"Well, some time. It happened on the 14th and they left on the 15th. Yeah.",20-054-29,54,29,27,speaker_start,CROSS-EXAMINATION BY MS. ANDREA GONSALVES,MAYOR JIMMY WILLETT,mayor jimmy willett
20-055-01,Right. And that was after the Emergencies Act had been invoked; right?,20-055-03,55,3,1,speaker_start,CROSS-EXAMINATION BY MS. ANDREA GONSALVES,MS. ANDREA GONSALVES,andrea gonsalves
20-055-03,"Just barely, yeah.",20-055-05,55,5,3,speaker_start,CROSS-EXAMINATION BY MS. ANDREA GONSALVES,MAYOR JIMMY WILLETT,mayor jimmy willett
20-055-04,"And you mentioned in your witness summary, you understood there were rumours circulating among the protestors that the Emergencies Act would be invoked, and among other things, their bank accounts could be frozen; right?",20-055-06,55,6,4,speaker_start,CROSS-EXAMINATION BY MS. ANDREA GONSALVES,MS. ANDREA GONSALVES,andrea gonsalves
20-055-09,"Yeah. Again, that was social media. But yes.",20-055-11,55,11,9,speaker_start,CROSS-EXAMINATION BY MS. ANDREA GONSALVES,MAYOR JIMMY WILLETT,mayor jimmy willett
20-055-11,"Yeah. Okay. So I’m -- Mr. Commissioner, I’m just waiting for that video to load.",20-055-13,55,13,11,speaker_start,CROSS-EXAMINATION BY MS. ANDREA GONSALVES,MS. ANDREA GONSALVES,andrea gonsalves
20-055-13,Apologies. Just one more moment.,20-055-15,55,15,13,speaker_start,CROSS-EXAMINATION BY MS. ANDREA GONSALVES,THE CLERK,the clerk
20-055-14,"That’s okay. It’s my fault. And we’ll just play from the beginning, not the whole thing but just... (VIDEO PLAYBACK)",20-055-16,55,16,14,speaker_start,CROSS-EXAMINATION BY MS. ANDREA GONSALVES,MS. ANDREA GONSALVES,andrea gonsalves
20-055-19,"We can pause that there, thank you. Mayor Willett, is that video of the sermon that Pastor Pawlowski delivered at the Smuggler’s Saloon on February 3rd?",20-055-21,55,21,19,speaker_start,CROSS-EXAMINATION BY MS. ANDREA GONSALVES,MS. ANDREA GONSALVES,andrea gonsalves
20-055-24,"It is, yes.",20-055-26,55,26,24,speaker_start,CROSS-EXAMINATION BY MS. ANDREA GONSALVES,MAYOR JIMMY WILLETT,mayor jimmy willett
20-055-25,And that’s the video you understand was -- or you’ve described as inciting the crowd?,20-055-27,55,27,25,speaker_start,CROSS-EXAMINATION BY MS. ANDREA GONSALVES,MS. ANDREA GONSALVES,andrea gonsalves
20-055-27,Yes.,20-055-29,55,29,27,speaker_start,CROSS-EXAMINATION BY MS. ANDREA GONSALVES,MAYOR JIMMY WILLETT,mayor jimmy willett
20-055-28,"Thank you. Those are my questions. Thank you, Commissioner.",20-055-30,55,30,28,speaker_start,CROSS-EXAMINATION BY MS. ANDREA GONSALVES,MS. ANDREA GONSALVES,andrea gonsalves
20-056-03,"Okay, thank you. Next is the Government of Alberta.",20-056-05,56,5,3,speaker_start,CROSS-EXAMINATION BY MS. ANDREA GONSALVES,COMMISSIONER ROULEAU,commissioner rouleau
20-056-05,Good morning. Hana Laura Yamamoto for the Government of Alberta. Can you see and hear me?,20-056-07,56,7,5,speaker_start,CROSS-EXAMINATION BY MS. ANDREA GONSALVES,MS. HANA LAURA YAMAMOTO,hana laura yamamoto
20-056-08,"Yes, we can.",20-056-10,56,10,8,speaker_start,CROSS-EXAMINATION BY MS. ANDREA GONSALVES,COMMISSIONER ROULEAU,commissioner rouleau
20-056-09,Yes.,20-056-11,56,11,9,speaker_start,CROSS-EXAMINATION BY MS. ANDREA GONSALVES,MAYOR JIMMY WILLETT,mayor jimmy willett
20-056-10,Perfect.,20-056-12,56,12,10,speaker_start,CROSS-EXAMINATION BY MS. ANDREA GONSALVES,MS. HANA LAURA YAMAMOTO,hana laura yamamoto
20-056-11,--- CROSS-EXAMINATION BY MS. HANA LAURA YAMAMOTO:,20-056-13,56,13,11,section_header,CROSS-EXAMINATION BY MS. HANA LAURA YAMAMOTO,NA,NA
20-056-12,"Good morning, Mayor Willett. I have a few questions for you.",20-056-14,56,14,12,speaker_start,CROSS-EXAMINATION BY MS. HANA LAURA YAMAMOTO,MS. HANA LAURA YAMAMOTO,hana laura yamamoto
20-056-14,Good morning.,20-056-16,56,16,14,speaker_start,CROSS-EXAMINATION BY MS. HANA LAURA YAMAMOTO,MAYOR JIMMY WILLETT,mayor jimmy willett
20-056-15,"Clerk, if you could please ---",20-056-17,56,17,15,speaker_start,CROSS-EXAMINATION BY MS. HANA LAURA YAMAMOTO,MS. HANA LAURA YAMAMOTO,hana laura yamamoto
20-056-17,"Could you identify yourself, for the record. You may have but it didn’t come across.",20-056-19,56,19,17,speaker_start,CROSS-EXAMINATION BY MS. HANA LAURA YAMAMOTO,COMMISSIONER ROULEAU,commissioner rouleau
20-056-20,"Of course, Commissioner. Hana Laura Yamamoto for the Province of Alberta. Mr. Clerk, if you could please bring up WTS00000012; it’s been up before. This is your witness statement. (SHORT PAUSE)",20-056-22,56,22,20,speaker_start,CROSS-EXAMINATION BY MS. HANA LAURA YAMAMOTO,MS. HANA LAURA YAMAMOTO,hana laura yamamoto
20-056-26,And just while that’s coming up; so on page 5 you stated that you did not receive the type of support you expected from the provincial and federal governments. So what kind of support did you expect from the federal government?,20-056-28,56,28,26,speaker_start,CROSS-EXAMINATION BY MS. HANA LAURA YAMAMOTO,MS. HANA LAURA YAMAMOTO,hana laura yamamoto
20-057-03,"At that point, it seemed like we were not getting anywhere, and I was looking for somebody to do something to get the highway unblocked and get things happening again. So any kind of support would have been -- make them go away and make this end. I wasn’t in a position to say exactly who should do what, but somebody should appear to be doing something, and at this time it didn’t look like anybody was doing much.",20-057-05,57,5,3,speaker_start,CROSS-EXAMINATION BY MS. HANA LAURA YAMAMOTO,MAYOR JIMMY WILLETT,mayor jimmy willett
20-057-11,Okay. And so I have the same question with respect to provincial government; what kind of support did you expect from the provincial government?,20-057-13,57,13,11,speaker_start,CROSS-EXAMINATION BY MS. HANA LAURA YAMAMOTO,MS. HANA LAURA YAMAMOTO,hana laura yamamoto
20-057-14,"Same story. We had the -- as I mentioned before, an Act that was supposed to give unlimited powers, basically, to protect infrastructure and remedy this exact problem, and yet it appeared to me nothing was going on. Now, I’ve seen the situation reports since then and it showed that there was action in the background, but I wasn’t privy to that, so where I was sitting in my office looking out the window, I didn’t see anything happening.",20-057-16,57,16,14,speaker_start,CROSS-EXAMINATION BY MS. HANA LAURA YAMAMOTO,MAYOR JIMMY WILLETT,mayor jimmy willett
20-057-23,"Okay. So now that you say that there’s things that you saw going on in the background, in your opinion is that statement still true, that you believe that the provincial government should have made better use of the Critical Infrastructure Act?",20-057-25,57,25,23,speaker_start,CROSS-EXAMINATION BY MS. HANA LAURA YAMAMOTO,MS. HANA LAURA YAMAMOTO,hana laura yamamoto
20-057-28,"I guess it goes back to the statement that the RCMP made to me about building the airplane as we’re flying it. I understand that the Province was in the same situation; like, looking for tow trucks and that kind of thing. So probably my opinion is not as harsh as it was at the time. I believe the Province was doing more than was visible to me and most people. There were things going on that -- where if we’d gone a little farther down the road -- no pun intended, if we’d gone a little farther down the road there would have been actual physical action taken. So my opinion has changed a bit.",20-057-30,57,30,28,speaker_start,CROSS-EXAMINATION BY MS. HANA LAURA YAMAMOTO,MAYOR JIMMY WILLETT,mayor jimmy willett
20-058-10,"Thank you, Mayor. So you understand as well that the RCMP was the lead agency responsible for responding to the border blockade occurring at Coutts, and they would make the operational plans and decisions?",20-058-12,58,12,10,speaker_start,CROSS-EXAMINATION BY MS. HANA LAURA YAMAMOTO,MS. HANA LAURA YAMAMOTO,hana laura yamamoto
20-058-15,"I don’t know if it was my ears playing tricks or not; can you do that a little slower, please?",20-058-17,58,17,15,speaker_start,CROSS-EXAMINATION BY MS. HANA LAURA YAMAMOTO,MAYOR JIMMY WILLETT,mayor jimmy willett
20-058-18,"I apologize. I should slow down for the translator as well. So you understand that the RCMP would have been the lead agency responsible for responding to the border blockades occurring at Coutts, and they would have made the operational plans and decisions?",20-058-20,58,20,18,speaker_start,CROSS-EXAMINATION BY MS. HANA LAURA YAMAMOTO,MS. HANA LAURA YAMAMOTO,hana laura yamamoto
20-058-24,Correct.,20-058-26,58,26,24,speaker_start,CROSS-EXAMINATION BY MS. HANA LAURA YAMAMOTO,MAYOR JIMMY WILLETT,mayor jimmy willett
20-058-25,Okay. And you worked with the RCMP throughout this blockade?,20-058-27,58,27,25,speaker_start,CROSS-EXAMINATION BY MS. HANA LAURA YAMAMOTO,MS. HANA LAURA YAMAMOTO,hana laura yamamoto
20-058-27,"We were in contact all the time, yeah.",20-058-29,58,29,27,speaker_start,CROSS-EXAMINATION BY MS. HANA LAURA YAMAMOTO,MAYOR JIMMY WILLETT,mayor jimmy willett
20-059-01,"Okay. So Mr. Clerk, if I could have you pull up ALB00000908.0001? So what you’re going to see here is a statement from the Alberta Minister of Justice and Solicitor General Savage on February 8th, 2022. Now, the fourth and fifth paragraphs from the bottom is just where we want to go. Perfect. And it says: “Those participating in this illegal blockade could potentially face charges or actions under any number of laws including...” And it includes the Critical Infrastructure Defence Act, and goes on to say: “Whatever action law enforcement may take is at their independent discretion. I trust the authorities to lay appropriate charges wherever the evidence provides reasonable grounds [to do] so.” So based on that statement, do you now understand that it’s the RCMP that would have made decisions whether or not to undertake enforcement under the Critical Infrastructure Defence Act?",20-059-03,59,3,1,speaker_start,CROSS-EXAMINATION BY MS. HANA LAURA YAMAMOTO,MS. HANA LAURA YAMAMOTO,hana laura yamamoto
20-059-26,"Correct, I understand that, yeah.",20-059-28,59,28,26,speaker_start,CROSS-EXAMINATION BY MS. HANA LAURA YAMAMOTO,MAYOR JIMMY WILLETT,mayor jimmy willett
20-059-28,"Okay. We saw your texts with Minister Sawhney; we don’t have to pull them up, but those would be under COU00000016. So these texts show contact every day, often multiple times a day, from February 2nd to 18th, as well as you said you had phone calls with Minister Sawhney?",20-059-30,59,30,28,speaker_start,CROSS-EXAMINATION BY MS. HANA LAURA YAMAMOTO,MS. HANA LAURA YAMAMOTO,hana laura yamamoto
20-060-06,Yes.,20-060-08,60,8,6,speaker_start,CROSS-EXAMINATION BY MS. HANA LAURA YAMAMOTO,MAYOR JIMMY WILLETT,mayor jimmy willett
20-060-07,Okay. And you also had a phone call with the Premier?,20-060-09,60,9,7,speaker_start,CROSS-EXAMINATION BY MS. HANA LAURA YAMAMOTO,MS. HANA LAURA YAMAMOTO,hana laura yamamoto
20-060-09,I did.,20-060-11,60,11,9,speaker_start,CROSS-EXAMINATION BY MS. HANA LAURA YAMAMOTO,MAYOR JIMMY WILLETT,mayor jimmy willett
20-060-10,And at no time did you make a request for specific supports or assistance from the Province?,20-060-12,60,12,10,speaker_start,CROSS-EXAMINATION BY MS. HANA LAURA YAMAMOTO,MS. HANA LAURA YAMAMOTO,hana laura yamamoto
20-060-13,"I think we -- when I talked to the Premier, we talked more in generalities. As I said earlier, he was kind of caught in a pinch-point between “Darned if I do and darned if I don’t”; we talked about that. He talked about the fact that he could only do so much because of the lack of surge capacity in the hospitals. He mentioned that he was going to be talking to governors in the northern states to see if they would put pressure on, on that side, because even if we did get rid of the provincial mandates, the federal mandates still sat there, and that was the thing that triggered the whole deal in the first place. So, no, it was more a generality thing. I did not hit him up for any kind of action.",20-060-15,60,15,13,speaker_start,CROSS-EXAMINATION BY MS. HANA LAURA YAMAMOTO,MAYOR JIMMY WILLETT,mayor jimmy willett
20-060-26,"But based on that conversation, there were things that the Alberta government was doing to support removing the border blockade at Coutts.",20-060-28,60,28,26,speaker_start,CROSS-EXAMINATION BY MS. HANA LAURA YAMAMOTO,MS. HANA LAURA YAMAMOTO,hana laura yamamoto
20-061-01,"And again, I only caught about half of that. I'm deaf in one ear and I can't hear in the other one so.",20-061-03,61,3,1,speaker_start,CROSS-EXAMINATION BY MS. HANA LAURA YAMAMOTO,MAYOR JIMMY WILLETT,mayor jimmy willett
20-061-04,"I apologise. I'll slow down and speak up. And based on that conversation with Premier Kenney, Alberta was providing supports if not -- even if you weren't asking for specific supports; correct?",20-061-06,61,6,4,speaker_start,CROSS-EXAMINATION BY MS. HANA LAURA YAMAMOTO,MS. HANA LAURA YAMAMOTO,hana laura yamamoto
20-061-08,Yes.,20-061-10,61,10,8,speaker_start,CROSS-EXAMINATION BY MS. HANA LAURA YAMAMOTO,MAYOR JIMMY WILLETT,mayor jimmy willett
20-061-09,Okay. And you had wanted Minister Sonya to speak with protestors?,20-061-11,61,11,9,speaker_start,CROSS-EXAMINATION BY MS. HANA LAURA YAMAMOTO,MS. HANA LAURA YAMAMOTO,hana laura yamamoto
20-061-11,"It was not my suggestion. It was her suggestion. She thought that she could come and talk to people in the first day or two because she was getting feedback from the fact that there are truckers stuck. She wanted to come, and I don't know what she had planned to say, but it was her suggestion that she come down.",20-061-13,61,13,11,speaker_start,CROSS-EXAMINATION BY MS. HANA LAURA YAMAMOTO,MAYOR JIMMY WILLETT,mayor jimmy willett
20-061-17,Okay. And you had said that the protestors were like herding cats?,20-061-19,61,19,17,speaker_start,CROSS-EXAMINATION BY MS. HANA LAURA YAMAMOTO,MS. HANA LAURA YAMAMOTO,hana laura yamamoto
20-061-19,The protestors were letting ---,20-061-21,61,21,19,speaker_start,CROSS-EXAMINATION BY MS. HANA LAURA YAMAMOTO,MAYOR JIMMY WILLETT,mayor jimmy willett
20-061-21,"Were like herding cats, sorry, excuse me.",20-061-23,61,23,21,speaker_start,CROSS-EXAMINATION BY MS. HANA LAURA YAMAMOTO,MS. HANA LAURA YAMAMOTO,hana laura yamamoto
20-061-23,"Yeah, that's what Alex told me when -- the first time I made contact with the guys, the smugglers, he said at that time that it was like herd -- that's my expression, but that was the impression. He said he could get a group here and a group there and try and get them all together and they'd make a decision, then they'd walk out the door and forgot what they'd talked about. So he was very frustrated.",20-061-25,61,25,23,speaker_start,CROSS-EXAMINATION BY MS. HANA LAURA YAMAMOTO,MAYOR JIMMY WILLETT,mayor jimmy willett
20-062-03,So there was no definitive leader of the protest?,20-062-05,62,5,3,speaker_start,CROSS-EXAMINATION BY MS. HANA LAURA YAMAMOTO,MS. HANA LAURA YAMAMOTO,hana laura yamamoto
20-062-05,"At that point, there didn't appear to be.",20-062-07,62,7,5,speaker_start,CROSS-EXAMINATION BY MS. HANA LAURA YAMAMOTO,MAYOR JIMMY WILLETT,mayor jimmy willett
20-062-07,"Okay. And I just have one point of clarification. So in your evidence with my friend Commission Counsel, you said that tractors lined up on the side of the road on the 14th. And I just want to clarify, that's so traffic could flow?",20-062-09,62,9,7,speaker_start,CROSS-EXAMINATION BY MS. HANA LAURA YAMAMOTO,MS. HANA LAURA YAMAMOTO,hana laura yamamoto
20-062-12,"Oh, by then they were off the highway, and I think at that point, traffic was being held up in Milk River still, but there wasn't any really physical blockading going on, on the morning on the 15th, possibly on the evening of the 14th. I couldn't do 24-hour coverage. But, no, the tractors were all lined up. They were just getting ready to leave as a group, and so they pulled them all in -- actually pulled them into the village and down that street and lined them up along there, so they were out of the way.",20-062-14,62,14,12,speaker_start,CROSS-EXAMINATION BY MS. HANA LAURA YAMAMOTO,MAYOR JIMMY WILLETT,mayor jimmy willett
20-062-21,"Okay. And you're not sure if that was the evening of the 14th, or did that start the evening of the 14th where they were moving the tractors?",20-062-23,62,23,21,speaker_start,CROSS-EXAMINATION BY MS. HANA LAURA YAMAMOTO,MS. HANA LAURA YAMAMOTO,hana laura yamamoto
20-062-24,"When I went down the morning of the 15th to see what was going on, they were all lined up down the street. That's all I know, and I don't know exactly when. Like I say, I wasn't sitting, watching them 24 hours a day, so I'm not sure when they moved.",20-062-26,62,26,24,speaker_start,CROSS-EXAMINATION BY MS. HANA LAURA YAMAMOTO,MAYOR JIMMY WILLETT,mayor jimmy willett
20-063-01,"Okay. Perfect. Thank you, Mayor Willett. That's all my questions.",20-063-03,63,3,1,speaker_start,CROSS-EXAMINATION BY MS. HANA LAURA YAMAMOTO,MS. HANA LAURA YAMAMOTO,hana laura yamamoto
20-063-03,Thank you.,20-063-05,63,5,3,speaker_start,CROSS-EXAMINATION BY MS. HANA LAURA YAMAMOTO,MAYOR JIMMY WILLETT,mayor jimmy willett
20-063-04,Thank you. Next is the City of Windsor.,20-063-06,63,6,4,speaker_start,CROSS-EXAMINATION BY MS. HANA LAURA YAMAMOTO,COMMISSIONER ROULEAU,commissioner rouleau
20-063-06,--- CROSS-EXAMINATION BY MICHAEL FINLEY:,20-063-08,63,8,6,section_header,CROSS-EXAMINATION BY MICHAEL FINLEY,NA,NA
20-063-07,Good morning ---,20-063-09,63,9,7,speaker_start,CROSS-EXAMINATION BY MICHAEL FINLEY,MR. MICHAEL FINLEY,michael finley
20-063-08,Good morning.,20-063-10,63,10,8,speaker_start,CROSS-EXAMINATION BY MICHAEL FINLEY,MAYOR JIMMY WILLETT,mayor jimmy willett
20-063-09,"--- Mayor Willett. My name's Michael Finley. I represent the City of Windsor, which as I'm sure you're aware, is a fellow border municipality.",20-063-11,63,11,9,speaker_start,CROSS-EXAMINATION BY MICHAEL FINLEY,MR. MICHAEL FINLEY,michael finley
20-063-12,Yes.,20-063-14,63,14,12,speaker_start,CROSS-EXAMINATION BY MICHAEL FINLEY,MAYOR JIMMY WILLETT,mayor jimmy willett
20-063-13,"And we heard today, Mayor Willett, you live just blocks away from the protest site and indeed the border; right?",20-063-15,63,15,13,speaker_start,CROSS-EXAMINATION BY MICHAEL FINLEY,MR. MICHAEL FINLEY,michael finley
20-063-16,"No matter where you are in Coutts, you're only blocks away, yeah.",20-063-18,63,18,16,speaker_start,CROSS-EXAMINATION BY MICHAEL FINLEY,MAYOR JIMMY WILLETT,mayor jimmy willett
20-063-18,And that border crossing is an important link; true?,20-063-20,63,20,18,speaker_start,CROSS-EXAMINATION BY MICHAEL FINLEY,MR. MICHAEL FINLEY,michael finley
20-063-20,It definitely is.,20-063-22,63,22,20,speaker_start,CROSS-EXAMINATION BY MICHAEL FINLEY,MAYOR JIMMY WILLETT,mayor jimmy willett
20-063-21,And I think you described it earlier as a lifeline and something with larger importance than just to the village of Coutts; is that fair?,20-063-23,63,23,21,speaker_start,CROSS-EXAMINATION BY MICHAEL FINLEY,MR. MICHAEL FINLEY,michael finley
20-063-24,That's correct.,20-063-26,63,26,24,speaker_start,CROSS-EXAMINATION BY MICHAEL FINLEY,MAYOR JIMMY WILLETT,mayor jimmy willett
20-063-25,"And I guess perhaps I'm stating the obvious, sir, but fair to say that the village of Coutts doesn't have sufficient resources on its own to ensure the security of that border crossing?",20-063-27,63,27,25,speaker_start,CROSS-EXAMINATION BY MICHAEL FINLEY,MR. MICHAEL FINLEY,michael finley
20-064-01,No.,20-064-03,64,3,1,speaker_start,CROSS-EXAMINATION BY MICHAEL FINLEY,MAYOR JIMMY WILLETT,mayor jimmy willett
20-064-02,"Or, in fact, to deal with a blockade of the magnitude that you faced earlier this year?",20-064-04,64,4,2,speaker_start,CROSS-EXAMINATION BY MICHAEL FINLEY,MR. MICHAEL FINLEY,michael finley
20-064-04,"No, our police force, as you heard, is four or five officers stationed in Milk River.",20-064-06,64,6,4,speaker_start,CROSS-EXAMINATION BY MICHAEL FINLEY,MAYOR JIMMY WILLETT,mayor jimmy willett
20-064-06,Right.,20-064-08,64,8,6,speaker_start,CROSS-EXAMINATION BY MICHAEL FINLEY,MR. MICHAEL FINLEY,michael finley
20-064-07,RCMP.,20-064-09,64,9,7,speaker_start,CROSS-EXAMINATION BY MICHAEL FINLEY,MAYOR JIMMY WILLETT,mayor jimmy willett
20-064-08,And so a situation like that requires more than a local response; is that fair?,20-064-10,64,10,8,speaker_start,CROSS-EXAMINATION BY MICHAEL FINLEY,MR. MICHAEL FINLEY,michael finley
20-064-10,Correct.,20-064-12,64,12,10,speaker_start,CROSS-EXAMINATION BY MICHAEL FINLEY,MAYOR JIMMY WILLETT,mayor jimmy willett
20-064-11,"Including because you noted earlier, provincial support?",20-064-13,64,13,11,speaker_start,CROSS-EXAMINATION BY MICHAEL FINLEY,MR. MICHAEL FINLEY,michael finley
20-064-13,Yeah.,20-064-15,64,15,13,speaker_start,CROSS-EXAMINATION BY MICHAEL FINLEY,MAYOR JIMMY WILLETT,mayor jimmy willett
20-064-14,And federal support too?,20-064-16,64,16,14,speaker_start,CROSS-EXAMINATION BY MICHAEL FINLEY,MR. MICHAEL FINLEY,michael finley
20-064-15,"Yeah, well, that's RCMP, so it's provincial and federal.",20-064-17,64,17,15,speaker_start,CROSS-EXAMINATION BY MICHAEL FINLEY,MAYOR JIMMY WILLETT,mayor jimmy willett
20-064-17,"And so that being so, would you agree that one might benefit from having a plan or at least a framework in advance to deal with situations like the one you experienced, even if they're not exactly the same, in future?",20-064-19,64,19,17,speaker_start,CROSS-EXAMINATION BY MICHAEL FINLEY,MR. MICHAEL FINLEY,michael finley
20-064-21,"Sure, yeah. It would be nice. Dealing with hindsight is 20/20 but it would have been nice to have a plan, yeah.",20-064-23,64,23,21,speaker_start,CROSS-EXAMINATION BY MICHAEL FINLEY,MAYOR JIMMY WILLETT,mayor jimmy willett
20-064-24,I think you spoke about being caught flatfooted and building an airplane while it's flying. I guess we can agree you're sticking with that metaphor? It's probably better to have the plane assembled in advance before it takes to the air?,20-064-26,64,26,24,speaker_start,CROSS-EXAMINATION BY MICHAEL FINLEY,MR. MICHAEL FINLEY,michael finley
20-065-01,"Yeah, if we're talking about police response, they had response for certain situations, but this was a situation that was unique, at the time, to anything they'd faced. And so I'm not going to be an apologist for the RCMP, but I think they were doing well under the circumstances. I don't think it's fair to say they had no plan. They would have had plans for demonstrations and so on, just nothing of this magnitude.",20-065-03,65,3,1,speaker_start,CROSS-EXAMINATION BY MICHAEL FINLEY,MAYOR JIMMY WILLETT,mayor jimmy willett
20-065-09,"Right. And I suppose all I'm getting at is it's better in this type of circumstance, I hope you'll agree with me, when you have a multijurisdictional issue to deal with to have some plan in advance to address it?",20-065-11,65,11,9,speaker_start,CROSS-EXAMINATION BY MICHAEL FINLEY,MR. MICHAEL FINLEY,michael finley
20-065-13,Yeah.,20-065-15,65,15,13,speaker_start,CROSS-EXAMINATION BY MICHAEL FINLEY,MAYOR JIMMY WILLETT,mayor jimmy willett
20-065-14,"Well, thank you, sir. Those are all my questions.",20-065-16,65,16,14,speaker_start,CROSS-EXAMINATION BY MICHAEL FINLEY,MR. MICHAEL FINLEY,michael finley
20-065-16,Yeah.,20-065-18,65,18,16,speaker_start,CROSS-EXAMINATION BY MICHAEL FINLEY,MAYOR JIMMY WILLETT,mayor jimmy willett
20-065-17,Thank you. Next are the Convoy Organizers.,20-065-19,65,19,17,speaker_start,CROSS-EXAMINATION BY MICHAEL FINLEY,COMMISSIONER ROULEAU,commissioner rouleau
